PMID,PMCID,Title,Year,Journal,DOI,Authors,Keywords,Abstract
31482754,,,2020,Hum Gene Ther,10.1089/hum.2019.217,"['Sara Marcó', 'Virginia Haurigot', 'Fatima Bosch']","['Sanfilippo syndrome', 'adeno-associated viral vectors', 'central nervous system', 'gene therapy', 'mucopolysaccharidosis type III']","For most lysosomal storage diseases (LSDs), there is no cure. Gene therapy is an attractive tool for treatment of LSDs caused by deficiencies in secretable lysosomal enzymes, in which neither full restoration of normal enzymatic activity nor transduction of all cells of the affected organ is necessary. However, some LSDs, such as mucopolysaccharidosis type III (MPSIII) diseases or Sanfilippo syndrome, represent a difficult challenge because patients suffer severe neurodegeneration with mild somatic alterations. The disease's main target is the central nervous system (CNS) and enzymes do not efficiently cross the blood-brain barrier (BBB) even if present at very high concentration in circulation. No specific treatment has been approved for MPSIII. In this study, we discuss the adeno-associated virus (AAV) vector-mediated gene transfer strategies currently being developed for MPSIII disease. These strategies rely on local delivery of AAV vectors to the CNS either through direct intraparenchymal injection at several sites or through delivery to the cerebrospinal fluid (CSF), which bathes the whole CNS, or exploit the properties of certain AAV serotypes capable of crossing the BBB upon systemic administration. Although studies in small and large animal models of MPSIII diseases have provided evidence supporting the efficacy and safety of all these strategies, there are considerable differences between the different routes of administration in terms of procedure-associated risks, vector dose requirements, sensitivity to the effect of circulating neutralizing antibodies that block AAV transduction, and potential toxicity. Ongoing clinical studies should shed light on which gene transfer strategy leads to highest clinical benefits while minimizing risks. The development of all these strategies opens a new horizon for treatment of not only MPSIII and other LSDs but also of a wide range of neurological diseases."
30782832,PMC6410774,Dual AAV-mediated gene therapy restores hearing in a DFNB9 mouse model.,2019,Proc Natl Acad Sci U S A,10.1073/pnas.1817537116,"['Omar Akil', 'Frank Dyka', 'Charlotte Calvet', 'Alice Emptoz', 'Ghizlene Lahlou', 'Sylvie Nouaille', 'Jacques Boutet de Monvel', 'Jean-Pierre Hardelin', 'William W Hauswirth', 'Paul Avan', 'Christine Petit', 'Saaid Safieddine', 'Lawrence R Lustig']","['DFNB9', 'deafness', 'dual AAV', 'gene therapy', 'otoferlin']","Autosomal recessive genetic forms (DFNB) account for most cases of profound congenital deafness. Adeno-associated virus (AAV)-based gene therapy is a promising therapeutic option, but is limited by a potentially short therapeutic window and the constrained packaging capacity of the vector. We focus here on the otoferlin gene underlying DFNB9, one of the most frequent genetic forms of congenital deafness. We adopted a dual AAV approach using two different recombinant vectors, one containing the 5' and the other the 3' portions of otoferlin cDNA, which exceed the packaging capacity of the AAV when combined. A single delivery of the vector pair into the mature cochlea of "
26222377,,Antiangiogenic Eye Gene Therapy.,2016,Hum Gene Ther,10.1089/hum.2015.064,['Thomas J Corydon'],[],"The idea of treating disease in humans with genetic material was conceived over two decades ago and with that a promising journey involving development and efficacy studies in cells and animals of a large number of novel therapeutic reagents unfolded. In the footsteps of this process, successful gene therapy treatment of genetic conditions in humans has shown clear signs of efficacy. Notably, significant advancements using gene supplementation and silencing strategies have been made in the field of ocular gene therapy, thereby pinpointing ocular gene therapy as one of the compelling ""actors"" bringing gene therapy to the clinic. Most of all, this success has been facilitated because of (1) the fact that the eye is an effortlessly accessible, exceedingly compartmentalized, and immune-privileged organ offering a unique advantage as a gene therapy target, and (2) significant progress toward efficient, sustained transduction of cells within the retina having been achieved using nonintegrating vectors based on recombinant adeno-associated virus and nonintegrating lentivirus vectors. The results from in vivo experiments and trials suggest that treatment of inherited retinal dystrophies, ocular angiogenesis, and inflammation with gene therapy can be both safe and effective. Here, the progress of ocular gene therapy is examined with special emphasis on the potential use of RNAi- and protein-based antiangiogenic gene therapy to treat exudative age-related macular degeneration. "
28494742,,Potential Gene Therapy Towards Treating Neurodegenerative Disea ses Employing Polymeric Nanosystems.,2018,Curr Gene Ther,10.2174/1566523217666170510153845,"['Prachi Bangde', 'Sonal Atale', 'Anomitra Dey', 'Ashish Pandit', 'Prajakta Dandekar', 'Ratnesh Jain']","[""Alzheimer's diseases"", 'Amyotrophic lateral sclerosis', 'Blood brain barrier', 'Gene therapy', ""Huntington's disease"", ""Parkinson's disease"", 'Polymeric nanoparticles']",Recent integrated approaches involving nanotechnology and gene therapy have accelerated development of efficient drug delivery to the central nervous system (CNS). Neurodegenerative disorders are closely associated with genetic inheritance and mutation.
28707263,,Delivery of viral vectors for gene therapy in intimal hyperplasia and restenosis in atherosclerotic swine.,2018,Drug Deliv Transl Res,10.1007/s13346-017-0409-0,"['Sannette Hall', 'Devendra K Agrawal']","['Gene therapy', 'Intimal hyperplasia', 'Porcine models', 'Restenosis', 'Viral vectors']","Cardiovascular diseases including atherosclerosis are a major financial and health burden globally. Inflammation associated with atherosclerosis results in the development of plaques that can rupture causing thrombosis, stroke, or death. The most widely used treatment for the removal of atherosclerotic plaques is percutaneous transluminal coronary angioplasty (PTCA) with or without stenting. Although this is a safer and minimally invasive method, restenosis and intimal hyperplasia after interventional procedure remains a major hurdle and more refined approaches are needed. Studies in large animal models such as pigs have facilitated a greater understanding of the underlying mechanisms of the disease and provided novel targets for therapeutic intervention. In pre-clinical studies, viral vector gene therapy has emerged as a promising option for the reduction and/or prevention of restenosis and intimal hyperplasia. Although studies in animal models have generated promising results, clinical trials have yet to prove the clinical efficacy of gene therapy in coronary artery diseases. In this review, we examined and critically reviewed the most recent advances in viral vector gene therapy obtained from studies using porcine model of atherosclerosis."
28270008,,Gene delivery to the lungs: pulmonary gene therapy for cystic fibrosis.,2017,Drug Dev Ind Pharm,10.1080/03639045.2017.1298122,"['Ilia Villate-Beitia', 'Jon Zarate', 'Gustavo Puras', 'José Luis Pedraz']","['Cystic fibrosis', 'cystic fibrosis transmembrane conductance regulator', 'gene therapy', 'genome edition', 'scale up']","Cystic fibrosis (CF) is a monogenic autosomal recessive disorder where the defective gene, the cystic fibrosis transmembrane conductance regulator (CFTR), is well identified. Moreover, the respiratory tract can be targeted through noninvasive aerosolized formulations for inhalation. Therefore, gene therapy is considered a plausible strategy to address this disease. Conventional gene therapy strategies rely on the addition of a correct copy of the CFTR gene into affected cells in order to restore the channel activity. In recent years, genome correction strategies have emerged, such as zinc-finger nucleases, transcription activator-like effector nucleases and clustered regularly interspaced short palindromic repeats associated to Cas9 nucleases. These gene editing tools aim to repair the mutated gene at its original genomic locus with high specificity. Besides, the success of gene therapy critically depends on the nucleic acids carriers. To date, several clinical studies have been carried out to add corrected copies of the CFTR gene into target cells using viral and non-viral vectors, some of them with encouraging results. Regarding genome editing systems, preliminary in vitro studies have been performed in order to repair the CFTR gene. In this review, after briefly introducing the basis of CF, we discuss the up-to-date gene therapy strategies to address the disease. The review focuses on the main factors to take into consideration when developing gene delivery strategies, such as the design of vectors and plasmid DNA, in vitro/in vivo tests, translation to human use, administration methods, manufacturing conditions and regulatory issues."
30539526,,Cancer Suicide Gene Therapy with TK.007.,2019,Methods Mol Biol,10.1007/978-1-4939-8922-5_2,"['Jubayer A Hossain', 'Kristoffer Riecken', 'Hrvoje Miletic', 'Boris Fehse']","['Cancer gene therapy', 'Glioblastoma', 'HSV-TK', 'Lentiviral vectors', 'Suicide gene therapy']","Cancer is a devastating disease characterized by uncontrolled and aggressive cell growth. Suicide gene therapy (SGT) facilitating induction of malignancy-specific cell death represents a novel therapeutic approach to treat cancer, which has been investigated in several cancer types with very promising results. In addition, SGT has been suggested as a safeguard in adoptive immunotherapy and regenerative-medicine settings. Generally, SGT consists of two steps-vector-mediated delivery of suicide genes into tumors and subsequent activation of the suicide mechanism, e.g., by administration of a specific prodrug. This chapter provides a framework of protocols for basic and translational research using the Herpes-simplex-virus thymidine kinase (HSV-TK)/ganciclovir (GCV) system, the most widely used suicide gene approach. The protocols provide standard guidelines for the preparation of high-titer third-generation lentiviral vectors encoding a genetically improved HSV-TK version known as TK.007 and its application in in vitro and in vivo treatment setups."
30101608,PMC6437630,Gene Therapy Rescues Retinal Degeneration in Receptor Expression-Enhancing Protein 6 Mutant Mice.,2018,Hum Gene Ther,10.1089/hum.2018.078,"['Smriti Agrawal Zaneveld', 'Aiden Eblimit', 'Qingnan Liang', 'Renae Bertrand', 'Nathaniel Wu', 'Hehe Liu', 'Quynh Nguyen', 'Jacques Zaneveld', 'Keqing Wang', 'Yumei Li', 'Rui Chen']","['REEP6', 'blindness', 'gene therapy', 'human disease', 'inherited retinal dystrophy', 'retinitis pigmentosa']","Hereditary retinal dystrophy is clinically defined as a broad group of chronic and progressive disorders that affect visual function by causing photoreceptor degeneration. Previously, we identified mutations in the gene encoding receptor expression-enhancing protein 6 (REEP6), in individuals with autosomal recessive retinitis pigmentosa (RP), the most common form of inherited retinal dystrophy. One individual was molecularly diagnosed with biallelic REEP6 mutations, a missense mutation over a frameshift mutation. In this study, we generated Reep6 compound heterozygous mice, Reep6"
31016359,PMC6560027,Nerve growth factor gene therapy improves bone marrow sensory innervation and nociceptor-mediated stem cell release in a mouse model of type 1 diabetes with limb ischaemia.,2019,Diabetologia,10.1007/s00125-019-4860-y,"['Zexu Dang', 'Elisa Avolio', 'Ambra Albertario', 'Graciela B Sala-Newby', 'Anita C Thomas', 'Nianhong Wang', 'Costanza Emanueli', 'Paolo Madeddu']","['Bone marrow', 'Bone marrow stem cells', 'Gene therapy', 'Nerve growth factor', 'Nociceptor', 'PC12 cells', 'Peripheral ischaemia', 'Sensory neuropathy', 'Substance P', 'Type 1 diabetes']","Sensory neuropathy is common in people with diabetes; neuropathy can also affect the bone marrow of individuals with type 2 diabetes. However, no information exists on the state of bone marrow sensory innervation in type 1 diabetes. Sensory neurons are trophically dependent on nerve growth factor (NGF) for their survival. The aim of this investigation was twofold: (1) to determine if sensory neuropathy affects the bone marrow in a mouse model of type 1 diabetes, with consequences for stem cell liberation after tissue injury; and (2) to verify if a single systemic injection of the NGF gene exerts long-term beneficial effects on these phenomena."
29433935,PMC5910668,Gene Therapy for Adenosine Deaminase Deficiency: A Comprehensive Evaluation of Short- and Medium-Term Safety.,2018,Mol Ther,10.1016/j.ymthe.2017.12.022,"['Maria Pia Cicalese', 'Francesca Ferrua', 'Laura Castagnaro', 'Katie Rolfe', 'Erika De Boever', 'Rickey R Reinhardt', 'Jonathan Appleby', 'Maria Grazia Roncarolo', 'Alessandro Aiuti']","['ADA-SCID', 'adenosine deaminase', 'gene therapy', 'immune deficiency', 'immune reconstitution', 'opportunistic infection', 'retroviral vector', 'safety']","Loss of adenosine deaminase activity leads to severe combined immunodeficiency (ADA-SCID); production and function of T, B, and natural killer (NK) cells are impaired. Gene therapy (GT) with an autologous CD34"
30688548,,Gene Therapy for Inherited Retinal Degeneration.,2019,J Ocul Pharmacol Ther,10.1089/jop.2018.0087,"['Amirmohsen Arbabi', 'Amelia Liu', 'Hossein Ameri']","['CRISPR/Cas system', 'gene augmentation', 'gene disruption', 'inherited retinal degeneration', 'ocular gene therapy', 'viral and/or non-viral vectors']","Inherited retinal degeneration (IRD), a group of rare retinal diseases that primarily lead to the progressive loss of retinal photoreceptor cells, can be inherited in all modes of inheritance: autosomal dominant (AD), autosomal recessive (AR), X-linked (XL), and mitochondrial. Based on the pattern of inheritance of the dystrophy, retinal gene therapy has 2 main strategies. AR, XL, and AD IRDs with haploinsufficiency can be treated by inserting a functional copy of the gene using either viral or nonviral vectors (gene augmentation). Different types of viral vectors and nonviral vectors are used to transfer plasmid DNA both in vitro and in vivo. AD IRDs with gain-of-function mutations or dominant-negative mutations can be treated by disrupting the mutant allele with (and occasionally without) gene augmentation. This review article aims to provide an overview of ocular gene therapy for treating IRDs using gene augmentation with viral or nonviral vectors or gene disruption through different gene-editing tools, especially with the clustered regularly interspaced short palindromic repeats (CRISPR)/CRISPR-associated (Cas) system."
30200778,,Engineering of Human Mesenchymal Stem/Stromal Cells with Vascular Endothelial Growth Factor-Encoding Minicircles for Angiogenic Ex Vivo Gene Therapy.,2018,Hum Gene Ther,10.1089/hum.2018.154,"['Joana Serra', 'Cláudia P A Alves', 'Liliana Brito', 'Gabriel A Monteiro', 'Joaquim M S Cabral', 'Duarte Miguel F Prazeres', 'Cláudia L da Silva']","[' gene therapy', 'VEGF', 'angiogenesis', 'mesenchymal stem/stromal cells (MSC)', 'minicircles']","Peripheral artery disease (PAD) is a debilitating and prevalent condition characterized by blockage of the arteries, leading to limb amputation in more severe cases. Mesenchymal stem/stromal cells (MSC) are known to have intrinsic regenerative properties that can be potentiated by the introduction of pro-angiogenic genes such as the vascular endothelial growth factor (VEGF). Herein, the use of human bone marrow MSC transiently transfected with minicircles encoding for VEGF is proposed as an ex vivo gene therapy strategy to enhance angiogenesis in PAD patients. The VEGF gene was cloned in minicircle and conventional plasmid vectors and used to transfect bone marrow-derived MSC ex vivo. VEGF expression was evaluated both by quantitative polymerase chain reaction and enzyme-linked immunosorbent assay. The number of VEGF transcripts following MSC transfection with minicircles increased 130-fold relative to the expression in non-transfected MSC, whereas for the plasmid (pVAX1)-based transfection, the increase was 50-fold. Compared to the VEGF basal levels secreted by MSC (11.1 ± 3.4 pg/1,000 cells/day), significantly higher values were detected by enzyme-linked immunosorbent assay after both minicircle and pVAX1 transfection (644.8 ± 82.5 and 508.3 ± 164.0 pg/1,000 cells/day, respectively). The VEGF overexpression improved the angiogenic potential of MSC in vitro, as confirmed by endothelial cell tube formation and cell migration assays, without affecting the expansion potential ex vivo, as well as multilineage differentiation capacity or immunophenotype of MSC. Although preclinical in vivo studies are required, these results suggest that minicircle-mediated VEGF gene delivery, combined with the unique properties of human MSC, could represent a promising ex vivo gene therapy approach for an improved angiogenesis in the context of PAD."
29031540,,Maternal uterine artery VEGF gene therapy for treatment of intrauterine growth restriction.,2017,Placenta,10.1016/j.placenta.2017.09.011,['Anna L David'],"['Gene therapy', 'Intrauterine growth restriction', 'Uterine blood flow', 'Vascular endothelial growth factor']","Intrauterine growth restriction (IUGR) is a serious pregnancy complication affecting approximately 8% of all pregnancies. The aetiology is believed to be insufficient maternal uteroplacental perfusion which prevents adequate nutrient and oxygen availability for the fetus. There is no treatment that can improve uteroplacental perfusion and thereby increase fetal growth in the uterus. Maternal uterine artery gene therapy presents a promising treatment strategy for IUGR, with the use of adenoviral vectors encoding for proteins such as Vascular Endothelial Growth Factor (VEGF) demonstrating improvements in fetal growth and neonatal outcome in preclinical studies. Mechanistically, maternal VEGF gene therapy delivered to the uterine arteries increases uterine blood flow and enhances vascular relaxation short term, while reducing vascular contractility long term. It also leads to vascular remodeling with increased endothelial cell proliferation in the perivascular adventitia of uterine arteries. Safety assessments suggest no vector spread to the fetus and no adverse risk to the mother or fetus; a clinical trial is in development. This article assesses research into VEGF maternal uterine artery directed gene therapy for IUGR, investigating the use of transgenes and vectors, their route of administration in obstetrics, and the steps that will be needed to take this treatment modality into the clinic."
32053763,,Recent highlights and advances in cardiac gene therapy.,2019,Discov Med,,"['Jae Gyun Oh', 'Kiyotake Ishikawa']",[],"There has been significant progress in the field of gene therapy toward clinical application in recent years. Cardiac gene therapy has followed this trend, but at a slower pace compared to therapies targeting retinal, spinal, and blood disorders. New approaches targeting monogenic disorders are being developed at a rapid pace and studies in large animal models show promise. Meanwhile, several clinical trials are underway to prove the efficacy of gene therapy for cardiovascular diseases such as heart failure. In this concise review, we attempt to summarize recent highlights in technological advancements, preclinical studies, and clinical trials of cardiac gene therapy."
28692305,,Fight fire with fire: Gene therapy strategies to cure HIV.,2017,Expert Rev Anti Infect Ther,10.1080/14787210.2017.1353911,"['Jon Huyghe', 'Sips Magdalena', 'Linos Vandekerckhove']","['Artificial TCRs', 'CAR T cells', 'CCR5 knockout', 'CRISPR-Cas9', 'HIV cure', 'broadly neutralizing antibodies', 'chimeric antigen receptors', 'gene therapy', 'hematopoietic stem cells', 'latency', 'shock and kill', 'vectored immunoprophylaxis', 'zinc finger nucleases']","Human Immunodeficiency Virus (HIV) to date remains one of the most notorious viruses mankind has ever faced. Despite enormous investments in HIV research for more than 30 years an effective cure for HIV has been elusive. Areas covered: Combination antiretroviral therapy (cART) suppresses active viral replication, but is not able to eliminate the virus completely due to stable integration of HIV inside the host genome of infected cells and the establishment of a latent reservoir, that is insensitive to cART. Nevertheless, this latent HIV reservoir is fully capable to refuel viral replication when treatment is stopped, creating a major obstacle towards a cure for HIV. Several gene therapy approaches ranging from the generation of HIV resistant CD4 + T cells to the eradication of HIV infected cells by immune cell engineering are currently under pre-clinical and clinical investigation and may present a promising road to a cure. In this review, we focus on the status and the prospects of gene therapy strategies to cure/eradicate HIV. Expert commentary: Recent advances in gene therapy for oncology and infectious diseases indicate that gene therapy may be a feasible and very potent cure strategy, and therefore a potential game changer in the search for an effective HIV cure."
26239654,PMC4571836,"Gene therapy for cardiovascular disease: advances in vector development, targeting, and delivery for clinical translation.",2015,Cardiovasc Res,10.1093/cvr/cvv205,"['Melvin Y Rincon', 'Thierry VandenDriessche', 'Marinee K Chuah']","['Adeno-associated viral vector', 'Adenylate cyclase', 'CRISPR', 'Cardiovascular disease', 'Clinical trials', 'Gene therapy', 'Heart failure', 'S100A1', 'SERCA2a', 'miRNA']","Gene therapy is a promising modality for the treatment of inherited and acquired cardiovascular diseases. The identification of the molecular pathways involved in the pathophysiology of heart failure and other associated cardiac diseases led to encouraging preclinical gene therapy studies in small and large animal models. However, the initial clinical results yielded only modest or no improvement in clinical endpoints. The presence of neutralizing antibodies and cellular immune responses directed against the viral vector and/or the gene-modified cells, the insufficient gene expression levels, and the limited gene transduction efficiencies accounted for the overall limited clinical improvements. Nevertheless, further improvements of the gene delivery technology and a better understanding of the underlying biology fostered renewed interest in gene therapy for heart failure. In particular, improved vectors based on emerging cardiotropic serotypes of the adeno-associated viral vector (AAV) are particularly well suited to coax expression of therapeutic genes in the heart. This led to new clinical trials based on the delivery of the sarcoplasmic reticulum Ca(2+)-ATPase protein (SERCA2a). Though the first clinical results were encouraging, a recent Phase IIb trial did not confirm the beneficial clinical outcomes that were initially reported. New approaches based on S100A1 and adenylate cyclase 6 are also being considered for clinical applications. Emerging paradigms based on the use of miRNA regulation or CRISPR/Cas9-based genome engineering open new therapeutic perspectives for treating cardiovascular diseases by gene therapy. Nevertheless, the continuous improvement of cardiac gene delivery is needed to allow the use of safer and more effective vector doses, ultimately bringing gene therapy for heart failure one step closer to reality. "
25227756,PMC4440458,State-of-the-art human gene therapy: part II. Gene therapy strategies and clinical applications.,2015,Discov Med,,"['Dan Wang', 'Guangping Gao']",[],"In Part I of this Review (Wang and Gao, 2014), we introduced recent advances in gene delivery technologies and explained how they have powered some of the current human gene therapy applications. In Part II, we expand the discussion on gene therapy applications, focusing on some of the most exciting clinical uses. To help readers to grasp the essence and to better organize the diverse applications, we categorize them under four gene therapy strategies: (1) gene replacement therapy for monogenic diseases, (2) gene addition for complex disorders and infectious diseases, (3) gene expression alteration targeting RNA, and (4) gene editing to introduce targeted changes in host genome. Human gene therapy started with the simple idea that replacing a faulty gene with a functional copy can cure a disease. It has been a long and bumpy road to finally translate this seemingly straightforward concept into reality. As many disease mechanisms unraveled, gene therapists have employed a gene addition strategy backed by a deep knowledge of what goes wrong in diseases and how to harness host cellular machinery to battle against diseases. Breakthroughs in other biotechnologies, such as RNA interference and genome editing by chimeric nucleases, have the potential to be integrated into gene therapy. Although clinical trials utilizing these new technologies are currently sparse, these innovations are expected to greatly broaden the scope of gene therapy in the near future. "
