PMID,PMCID,Title,Year,Journal,DOI,Authors,Keywords,Abstract
31269854,,Participant perspectives on a phase I/II ocular gene therapy trial (NCT02077361).,2019,Ophthalmic Genet,10.1080/13816810.2019.1630843,"['Stephanie P Brooks', 'Shelly Benjaminy', 'Tania Bubela']","['Gene therapy', 'clinical trials', 'communication', 'informed consent', 'patient-oriented research', 'trial conduct']",
28895054,,A Neuron-Specific Gene Therapy Relieves Motor Deficits in Pompe Disease Mice.,2017,Mol Neurobiol,10.1007/s12035-017-0763-4,"['Ni-Chung Lee', 'Wuh-Liang Hwu', 'Shin-Ichi Muramatsu', 'Darin J Falk', 'Barry J Byrne', 'Chia-Hao Cheng', 'Nien-Chu Shih', 'Kai-Ling Chang', 'Li-Kai Tsai', 'Yin-Hsiu Chien']","['Adeno-associated viral vector', 'Enzyme replacement therapy', 'Gene therapy', 'Glycogen', 'Neuron-specific', 'Pompe disease']","In Pompe disease, deficient lysosomal acid α-glucosidase (GAA) activity causes glycogen accumulation in the muscles, which leads to weakness, cardiomyopathy, and respiratory failure. Although glycogen accumulation also occurs in the nervous system, the burden of neurological deficits in Pompe disease remains obscure. In this study, a neuron-specific gene therapy was administered to Pompe mice through intracerebroventricular injection of a viral vector carrying a neuron-specific promoter. The results revealed that gene therapy increased GAA activity and decreased glycogen content in the brain and spinal cord but not in the muscles of Pompe mice. Gene therapy only slightly increased the muscle strength of Pompe mice but substantially improved their performance on the rotarod, a test measuring motor coordination. Gene therapy also decreased astrogliosis and increased myelination in the brain and spinal cord of Pompe mice. Therefore, a neuron-specific treatment improved the motor coordination of Pompe mice by lowering glycogen accumulation, decreasing astrogliosis, and increasing myelination. These findings indicate that neurological deficits are responsible for a significant burden in Pompe disease."
31094186,,Gene therapy of type 2 diabetes mellitus: state of art.,2019,Ter Arkh,10.26442/00403660.2019.02.000042,"['Yu S Stafeev', 'M Yu Menshikov', 'Ye V Parfyonova']","['diabetes mellitus type 2', 'gene therapy', 'insulin resistance']","Type 2 diabetes mellitus (T2DM) and other metabolic diseases are essential links in the structure of morbidity and mortality in the modern world. The accepted strategy for the correction of T2DM and insulin resistance is drug therapy aimed at delivering insulin from the outside, stimulating the secretion of own insulin and reducing the concentration of blood glucose. However, modern studies demonstrate a great potential for the use of gene therapy approaches for the correction of T2DM and insulin resistance. In the present review, the main variants of plasmid gene therapy of T2DM using the genes of adiponectin and type 1 glucagon-like peptide, as well as the main variants of viral gene therapy of T2DM using the genes of type 1 and leptin are considered. T2DM gene therapy is currently not ready to enter into routine clinical practice, but, subject to improvements in delivery systems, it can be a powerful link in combination therapy for diabetes."
27753762,PMC5465814,CLINICAL PROGRESS IN INHERITED RETINAL DEGENERATIONS: GENE THERAPY CLINICAL TRIALS AND ADVANCES IN GENETIC SEQUENCING.,2017,Retina,10.1097/IAE.0000000000001341,['Brian P Hafler'],[],Inherited retinal dystrophies are a significant cause of vision loss and are characterized by the loss of photoreceptors and the retinal pigment epithelium (RPE). Mutations in approximately 250 genes cause inherited retinal degenerations with a high degree of genetic heterogeneity. New techniques in next-generation sequencing are allowing the comprehensive analysis of all retinal disease genes thus changing the approach to the molecular diagnosis of inherited retinal dystrophies. This review serves to analyze clinical progress in genetic diagnostic testing and implications for retinal gene therapy.
30464254,,Unilateral ex vivo gene therapy by GDNF in epileptic rats.,2018,Gene Ther,10.1038/s41434-018-0050-7,"['Avtandil Nanobashvili', 'Esbjörn Melin', 'Dwaine Emerich', 'Jens Tornøe', 'Michele Simonato', 'Lars Wahlberg', 'Merab Kokaia']",[],"Temporal lobe epilepsy (TLE) is the most common type of epilepsy in adults. This neurological disorder is characterized by focal seizures originating in the temporal lobe, often with secondary generalization. A variety of pharmacological treatments exist for patients suffering from focal seizures, but systemically administered drugs offer only symptomatic relief and frequently cause unwanted side effects. Moreover, available drugs are ineffective in one third of the epilepsy patients. Thus, developing more targeted and effective treatment strategies for focal seizures, originating from, e.g., the temporal lobe, is highly warranted. In order to deliver potential anti-epileptic agents directly into the seizure focus we used encapsulated cell biodelivery (ECB), a specific type of ex vivo gene therapy. Specifically, we asked whether unilateral delivery of glial cell line-derived neurotrophic factor (GDNF), exclusively into the epileptic focus, would suppress already established spontaneous recurrent seizures (SRS) in rats. Our results show that GDNF delivered by ECB devices unilaterally into the seizure focus in the hippocampus effectively decreases the number of SRS in epileptic rats. Thus, our study demonstrates that focal unilateral delivery of neurotrophic factors, such as GDNF, using ex vivo gene therapy based on ECB devices could be an effective anti-epileptic strategy providing a bases for the development of a novel, alternative, treatment for focal epilepsies."
28835123,,Advances in Gene Therapy for Hemophilia.,2018,Hum Gene Ther,10.1089/hum.2017.167,"['Amit C Nathwani', 'Andrew M Davidoff', 'Edward G D Tuddenham']","['gene therapy', 'hemophilia A', 'hemophilia B']","Gene therapy provides hope for a cure for patients with hemophilia by establishing continuous endogenous expression of factor VIII or factor IX following transfer of a functional gene copy to replace the hemophilic patient's own defective gene. Hemophilia may be considered a ""low-hanging fruit"" for gene therapy because a small increment in blood factor levels (≥2% of normal) significantly improves the bleeding tendency from severe to moderate, eliminating most spontaneous bleeds. After decades of research, the first trial to provide clear evidence of efficiency after gene transfer in patients with hemophilia B using adeno-associated virus vectors was reported by the authors' group in 2011. This has been followed by unprecedented activity in this area, with the commencement of seven new early-phase trials involving >55 patients with hemophilia A or hemophilia B. These studies have, in large part, generated promising clinical data that lay a strong foundation for gene therapy to move forward rapidly to market authorization. This review discusses the data from the authors' studies and emerging results from other gene therapy trials in both hemophilia A and B."
28793786,,Hemophilia Gene Therapy: Ready for Prime Time?,2017,Hum Gene Ther,10.1089/hum.2017.116,"['Thierry VandenDriessche', 'Marinee K Chuah']","['AAV', 'CRISPR', 'ZFN', 'coagulation', 'factor IX', 'factor IX Padua', 'factor VIII', 'hemophilia', 'lentiviral']","Hemophilia A and B are congenital, X-linked bleeding disorders caused by mutations in the genes encoding for the blood clotting factor VIII (FVIII) or factor IX (FIX), respectively. Since the beginning of gene therapy, hemophilia has been considered an attractive disease target that served as a trailblazer for the field at large. Different technologies have been explored to efficiently and safely deliver the therapeutic FVIII and FIX genes into the patients' cells. Currently, the most promising vectors for hemophilia gene therapy are adeno-associated viral vectors (AAVs) and lentiviral vectors. More recently, gene editing approaches based on designer nucleases or CRISPR/Cas, have also been considered to minimize risks associated with random vector integration and insertional mutagenesis though off-target issues would have to be carefully and comprehensively assessed. In the past two decades, several phase 1 hemophilia gene therapy clinical trials have been initiated with varying success. In particular, the early gene therapy clinical trials in hemophilia B patients based on AAV showed either transient or subtherapeutic clotting factor expression levels. This could be ascribed, at least in part, to suboptimal vector design and/or inadvertent immune consequences triggering hepatic inflammation. Hence, there was an unmet need to further increase vector safety and efficacy in future trials, preferably by using lower vector doses. It is particularly encouraging that sustained therapeutic FVIII and FIX expression levels have recently been attained after gene therapy in patients with severe hemophilia paving the way towards pivotal trials and commercialization. Nevertheless, transient liver toxicity still occurs and the use of transient immunosuppression was still required to curtail inadvertent immune responses, especially at high vector doses. To further boost clotting factor expression levels, codon-usage optimized synthetic FVIII or FIX transgenes have been employed. Alternatively, we and others have shown that the incorporation of hyperactive gain-of-function R338L mutation in the FIX gene substantially increased the overall efficacy. It is inevitable that the continued improvements in vector engineering and new insights in the vector-patient interactions will further benefit the development of a safe and effective cure for hemophilia A and B."
25707196,,[Collaborative study on regulatory science for facilitating clinical development of gene therapy products for genetic diseases].,2015,Kokuritsu Iyakuhin Shokuhin Eisei Kenkyusho Hokoku,,"['Eriko Uchida', 'Yuka Igarashi', 'Yoji Sato']",[],"Gene therapy products are expected as innovative medicinal products for intractable diseases such as life-threatening genetic diseases and cancer. Recently, clinical developments by pharmaceutical companies are accelerated in Europe and the United States, and the first gene therapy product in advanced countries was approved for marketing authorization by the European Commission in 2012. On the other hand, more than 40 clinical studies for gene therapy have been completed or ongoing in Japan, most of them are conducted as clinical researches by academic institutes, and few clinical trials have been conducted for approval of gene therapy products. In order to promote the development of gene therapy products, revision of the current guideline and/or preparation of concept paper to address the evaluation of the quality and safety of gene therapy products are necessary and desired to clearly show what data should be submitted before First-in-Human clinical trials of novel gene therapy products. We started collaborative study with academia and regulatory agency to promote regulatory science toward clinical development of gene therapy products for genetic diseases based on lentivirus and adeno-associated virus vectors; National Center for Child Health and Development (NCCHD), Nippon Medical School and PMDA have been joined in the task force. At first, we are preparing pre-draft of the revision of the current gene therapy guidelines in this project."
31332444,,Advances and challenges for hemophilia gene therapy.,2020,Hum Mol Genet,10.1093/hmg/ddz157,"['Paul Batty', 'David Lillicrap']",[],"Hemophilia is an X-linked inherited bleeding disorder, resulting from defects in the F8 (hemophilia A) or F9 (hemophilia B) genes. Persons with hemophilia have bleeding episodes into the soft tissues and joints, which are treated with self-infusion of factor VIII or IX concentrates. Hemophilia provides an attractive target for gene therapy studies, due to the monogenic nature of these disorders and easily measurable endpoints (factor levels and bleed rates). All successful, pre-clinical and clinical studies to date have utilized recombinant adeno-associated viral (AAV) vectors for factor VIII or IX hepatocyte transduction. Recent clinical data have presented normalization of factor levels in some patients with improvements in bleed rate and quality of life. The main toxicity seen within these studies has been early transient elevation in liver enzymes, with variable effect on transgene expression. Although long-term data are awaited, durable expression has been seen within the hemophilia dog model with no late-toxicity or oncogenesis. There are a number of phase III studies currently recruiting; however, there may be some limitations in translating these data to clinical practice, due to inclusion/exclusion criteria. AAV-based gene therapy is one of a number of novel approaches for treatment of hemophilia with other gene therapy (in vivo and ex vivo) and non-replacement therapies progressing through clinical trials. Availability of these high-cost novel therapeutics will require evolution of both clinical and financial healthcare services to allow equitable personalization of care for persons with hemophilia."
30542185,,Regulating the gene-therapy revolution.,2019,Nature,10.1038/d41586-018-07641-1,['Eric Bender'],"['Drug discovery', 'Gene therapy', 'Policy', 'Therapeutics']",
31042754,PMC6493713,Gene therapy as a potential therapeutic option for Duchenne muscular dystrophy: A qualitative preference study of patients and parents.,2019,PLoS One,10.1371/journal.pone.0213649,"['Holly Landrum Peay', 'Ryan Fischer', 'Janice P Tzeng', 'Sharon E Hesterlee', 'Carl Morris', 'Amy Strong Martin', 'Colin Rensch', 'Edward Smith', 'Valeria Ricotti', 'Katherine Beaverson', 'Hannah Wand', 'Carol Mansfield']",[],Duchenne muscular dystrophy (DMD) is a rare neuromuscular disorder that causes progressive weakness and early death. Gene therapy is an area of new therapeutic development. This qualitative study explored factors influencing parents' and adult patients' preferences about gene therapy.
30809802,,Gene therapy in rheumatoid arthritis: Strategies to select therapeutic genes.,2019,J Cell Physiol,10.1002/jcp.28392,"['Mahdi Zavvar', 'Sara Assadiasl', 'Narjes Soleimanifar', 'Fatemeh Dadgar Pakdel', 'Kamal Abdolmohammadi', 'Yousef Fatahi', 'Mohsen Abdolmaleki', 'Hamed Baghdadi', 'Lobat Tayebi', 'Mohammad H Nicknam']","['gene therapy', 'rheumatoid arthritis', 'therapeutic genes', 'therapeutic strategies']","Significant advances have been achieved in recent years to ameliorate rheumatoid arthritis (RA) in animal models using gene therapy approaches rather than biological treatments. Although biological agents serve as antirheumatic drugs with suppressing proinflammatory cytokine activities, they are usually accompanied by systemic immune suppression resulting from continuous or high systemic dose injections of biological agents. Therefore, gene transfer approaches have opened an interesting perspective to deliver one or multiple genes in a target-specific or inducible manner for the sustained intra-articular expression of therapeutic products. Accordingly, many studies have focused on gene transferring methods in animal models by using one of the available approaches. In this study, the important strategies used to select effective genes for RA gene therapy have been outlined. Given the work done in this field, the future looks bright for gene therapy as a new method in the clinical treatment of autoimmune diseases such as RA, and by ongoing efforts in this field, we hope to achieve feasible, safe, and effective treatment methods."
28726562,,Gene therapy for age-related macular degeneration.,2017,Expert Opin Biol Ther,10.1080/14712598.2017.1356817,"['Nicholas A Moore', 'Peter Bracha', 'Rehan M Hussain', 'Nuria Morral', 'Thomas A Ciulla']","['Adeno-associated virus', 'age-related macular degeneration', 'gene therapy', 'retina', 'vascular endothelial growth factor']","In neovascular age related macular degeneration (nAMD), gene therapy to chronically express anti-vascular endothelial growth factor (VEGF) proteins could ameliorate the treatment burden of chronic intravitreal therapy and improve limited visual outcomes associated with 'real world' undertreatment. Areas covered: In this review, the authors assess the evolution of gene therapy for AMD. Adeno-associated virus (AAV) vectors can transduce retinal pigment epithelium; one such early application was a phase I trial of AAV2-delivered pigment epithelium derived factor gene in advanced nAMD. Subsequently, gene therapy for AMD shifted to the investigation of soluble fms-like tyrosine kinase-1 (sFLT-1), an endogenously expressed VEGF inhibitor, binding and neutralizing VEGF-A. After some disappointing results, research has centered on novel vectors, including optimized AAV2, AAV8 and lentivirus, as well as genes encoding other anti-angiogenic proteins, including ranibizumab, aflibercept, angiostatin and endostatin. Also, gene therapy targeting the complement system is being investigated for geographic atrophy due to non-neovascular AMD. Expert opinion: The success of gene therapy for AMD will depend on the selection of the most appropriate therapeutic protein and its level of chronic expression. Future investigations will center on optimizing vector, promoter and delivery methods, and evaluating the risks of the chronic expression of anti-angiogenic or anti-complement proteins."
31864360,PMC6925517,Gene therapy-emulating small molecule treatments in cystic fibrosis airway epithelial cells and patients.,2019,Respir Res,10.1186/s12931-019-1214-8,"['Q Yang', 'A R Soltis', 'G Sukumar', 'X Zhang', 'H Caohuy', 'J Freedy', 'C L Dalgard', 'M D Wilkerson', 'H B Pollard', 'B S Pollard']","['Cystic fibrosis', 'Digitoxin', 'Inflammation', 'Ivacaftor', 'Kalydeco', 'Lumacaftor', 'Tezacaftor']","Several small molecule corrector and potentiator drugs have recently been licensed for Cystic Fibrosis (CF) therapy. However, other aspects of the disease, especially inflammation, are less effectively treated by these drugs. We hypothesized that small molecule drugs could function either alone or as an adjuvant to licensed therapies to treat these aspects of the disease, perhaps emulating the effects of gene therapy in CF cells. The cardiac glycoside digitoxin, which has been shown to inhibit TNFα/NFκB signaling in CF lung epithelial cells, may serve as such a therapy."
25716532,,The impact of HIV-1 genetic diversity on the efficacy of a combinatorial RNAi-based gene therapy.,2015,Gene Ther,10.1038/gt.2015.11,"['E Herrera-Carrillo', 'B Berkhout']",[],"A hurdle for human immunodeficiency virus (HIV-1) therapy is the genomic diversity of circulating viruses and the possibility that drug-resistant virus variants are selected. Although RNA interference (RNAi) is a powerful tool to stably inhibit HIV-1 replication by the expression of antiviral short hairpin RNAs (shRNAs) in transduced T cells, this approach is also vulnerable to pre-existing genetic variation and the development of viral resistance through mutation. To prevent viral escape, we proposed to combine multiple shRNAs against important regions of the HIV-1 RNA genome, which should ideally be conserved in all HIV-1 subtypes. The vulnerability of RNAi therapy to viral escape has been studied for a single subtype B strain, but it is unclear whether the antiviral shRNAs can inhibit diverse virus isolates and subtypes, including drug-resistant variants that could be present in treated patients. To determine the breadth of the RNAi gene therapy approach, we studied the susceptibility of HIV-1 subtypes A-E and drug-resistant variants. In addition, we monitored the evolution of HIV-1 escape variants. We demonstrate that the combinatorial RNAi therapy is highly effective against most isolates, supporting the future testing of this gene therapy in appropriate in vivo models. "
32175942,,Gene therapy beyond luxturna: a new horizon of the treatment for inherited retinal disease.,2020,Curr Opin Ophthalmol,10.1097/ICU.0000000000000660,"['Dominic A Prado', 'Marcy Acosta-Acero', 'Ramiro S Maldonado']",[],"Gene therapy offers, for the first time, the possibility to cure diseases such as retinitis pigmentosa. The positive outcomes that led to the U.S. Food and Drug Administration (FDA) approval of Luxturna to treat Leber congenital amaurosis caused by RPE65 mutations created an optimistic atmosphere in the research, clinical and patient community. Despite this first success, we must understand that this is not a 'one treatment for all'. This review aims to explain the basic concepts of gene therapy and how they translate in different approaches that are utilized in ongoing clinical trials here reviewed."
29637858,,Gene Therapy to Enhance Bone and Cartilage Repair in Orthopaedic Surgery.,2019,Curr Gene Ther,10.2174/1566523218666180410152842,"['Sofia Bougioukli', 'Christopher H Evans', 'Ram K Alluri', 'Steven C Ghivizzani', 'Jay R Lieberman']","['Bone healing', 'Cartilage repair', 'Gene therapy', 'Osteoarthritis', 'Tissue engineering', 'Viral vectors.']","Musculoskeletal conditions are a major public health problem. Approximately 66 million individuals seek medical attention for a musculoskeletal injury in the United States, with current medical costs being estimated at $873 billion annually. Despite advances in pharmaceuticals, implant materials and surgical techniques, there remains an unmet clinical need for successful treatment of challenging musculoskeletal injuries and pathologic conditions, particularly in the setting of compromised biological environments. Tissue engineering via gene therapy attempts to provide an alternative treatment strategy to address the deficits associated with conventional approaches. The transfer of specific target genes coding for proteins with therapeutic or regenerative properties to target cells and tissues in the disease environment allows for their sustained production and release specifically at the site of interest. The increasing reports of success with gene therapy-based treatments in the clinical management of a variety of diseases provide genuine optimism that similar methods can be adapted for mainstream clinical application in musculoskeletal disorders. In preclinical studies, gene therapy has been successfully used to treat cartilaginous, bone, skeletal muscle, tendon, ligament and intervertebral disk injuries. In addition, gene therapy is being assessed in clinical trials for its safety and therapeutic potential in osteoarthritis. This review will specifically address the clinical potential, preclinical data and future hurdles for gene therapy to be a viable clinical entity for the treatment of fracture nonunion and difficult bone repair scenarios, articular cartilage repair and osteoarthritis."
29935173,,Nucleic-acid based gene therapy approaches for sepsis.,2018,Eur J Pharmacol,10.1016/j.ejphar.2018.06.031,"['Yuichi Hattori', 'Kohshi Hattori', 'Tokiko Suzuki', 'Sailesh Palikhe', 'Naoyuki Matsuda']","['Activator protein-1', 'Apoptosis', 'Gene therapy', 'MicroRNA', 'Nuclear factor-κB', 'Sepsis']","Despite advances in overall medical care, sepsis and its sequelae continue to be an embarrassing clinical entity with an unacceptably high mortality rate. The central reason for high morbidity and high mortality of sepsis and its sequelae is the lack of an effective treatment. Previous clinical trials have largely failed to identify an effective therapeutic target to improve clinical outcomes in sepsis. Thus, the key goal favoring the outcome of septic patients is to devise innovative and evolutionary therapeutic strategies. Gene therapy can be considered as one of the most promising novel therapeutic approaches for nasty disorders. Since a number of transcription factors, such as nuclear factor-κB (NF-κB) and activator protein-1 (AP-1), play a pivotal role in the pathophysiology of sepsis that can be characterized by the induction of multiple genes and their products, sepsis may be regarded as a gene-related disorder and gene therapy may be considered a promising novel therapeutic approach for treatment of sepsis. In this review article, we provide an up-to-date summary of the gene-targeting approaches, which have been developed in animal models of sepsis. Our review sheds light on the molecular basis of sepsis pathology for the development of novel gene therapy approaches and leads to the conclusion that future research efforts may fully take into account gene therapy for the treatment of sepsis."
