PMID,PMCID,Title,Year,Journal,DOI,Authors,Keywords,Abstract
29212377,PMC5909082,Gene Therapy for Bone Repair Using Human Cells: Superior Osteogenic Potential of Bone Morphogenetic Protein 2-Transduced Mesenchymal Stem Cells Derived from Adipose Tissue Compared to Bone Marrow.,2018,Hum Gene Ther,10.1089/hum.2017.097,"['Sofia Bougioukli', 'Osamu Sugiyama', 'William Pannell', 'Brandon Ortega', 'Matthew H Tan', 'Amy H Tang', 'Robert Yoho', 'Daniel A Oakes', 'Jay R Lieberman']","['BMP-2', 'adipose-derived stem cells', 'bone repair', 'bone-marrow stem cells', 'gene therapy', 'lentivirus']","Ex vivo regional gene therapy strategies using animal mesenchymal stem cells genetically modified to overexpress osteoinductive growth factors have been successfully used in a variety of animal models to induce both heterotopic and orthotopic bone formation. However, in order to adapt regional gene therapy for clinical applications, it is essential to assess the osteogenic capacity of transduced human cells and choose the cell type that demonstrates the best clinical potential. Bone-marrow stem cells (BMSC) and adipose-derived stem cells (ASC) were selected in this study for in vitro evaluation, before and after transduction with a lentiviral two-step transcriptional amplification system (TSTA) overexpressing bone morphogenetic protein 2 (BMP-2; LV-TSTA-BMP-2) or green fluorescent protein (GFP; LV-TSTA-GFP). Cell growth, transduction efficiency, BMP-2 production, and osteogenic capacity were assessed. The study demonstrated that BMSC were characterized by a slower cell growth compared to ASC. Fluorescence-activated cell sorting analysis of GFP-transduced cells confirmed successful transduction with the vector and revealed an overall higher but not statistically significant transduction efficiency in ASC versus BMSC (90.2 ± 4.06% vs. 80.4 ± 8.51%, respectively; p = 0.146). Enzyme-linked immunosorbent assay confirmed abundant BMP-2 production by both cell types transduced with LV-TSTA-BMP-2, with BMP-2 production being significantly higher in ASC versus BMSC (239.5 ± 116.55 ng vs. 70.86 ± 24.7 ng; p = 0.001). Quantitative analysis of extracellular deposition of calcium (Alizarin red) and alkaline phosphatase activity showed that BMP-2-transduced cells had a higher osteogenic differentiation capacity compared to non-transduced cells. When comparing the two cell types, ASC/LV-TSTA-BMP-2 demonstrated a significantly higher mineralization potential compared to BMSC/LV-TSTA-BMP-2 7 days post transduction (p = 0.014). In conclusion, this study demonstrates that transduction with LV-TSTA-BMP-2 can significantly enhance the osteogenic potential of both human BMSC and ASC. BMP-2-treated ASC exhibited higher BMP-2 production and greater osteogenic differentiation capacity compared to BMP-2-treated BMSC. These results, along with the fact that liposuction is an easy procedure with lower donor-site morbidity compared to BM aspiration, indicate that adipose tissue might be a preferable source of MSCs to develop a regional gene therapy approach to treat difficult bone-repair scenarios."
28366768,PMC5417846,Evolving Gene Therapy in Primary Immunodeficiency.,2017,Mol Ther,10.1016/j.ymthe.2017.03.018,"['Adrian J Thrasher', 'David A Williams']","['gene therapy', 'immunodeficiencies', 'retrovirus']","Prior to the first successful bone marrow transplant in 1968, patients born with severe combined immunodeficiency (SCID) invariably died. Today, with a widening availability of newborn screening, major improvements in the application of allogeneic procedures, and the emergence of successful hematopoietic stem and progenitor cell (HSC/P) gene therapy, the majority of these children can be identified and cured. Here, we trace key steps in the development of clinical gene therapy for SCID and other primary immunodeficiencies (PIDs), and review the prospects for adoption of new targets and technologies."
28390761,,The AAV-mediated and RNA-guided CRISPR/Cas9 system for gene therapy of DMD and BMD.,2017,Brain Dev,10.1016/j.braindev.2017.03.024,"['Jing-Zhang Wang', 'Peng Wu', 'Zhi-Min Shi', 'Yan-Li Xu', 'Zhi-Jun Liu']","['Adeno-associated virus vector', 'Becker muscular dystrophy', 'CRISPR/Cas9', 'Duchenne muscular dystrophy', 'Dystrophin', 'Gene therapy']","Mutations in the dystrophin gene (Dmd) result in Duchenne muscular dystrophy (DMD) and Becker muscular dystrophy (BMD), which afflict many newborn boys. In 2016, Brain and Development published several interesting articles on DMD treatment with antisense oligonucleotide, kinase inhibitor, and prednisolone. Even more strikingly, three articles in the issue 6271 of Science in 2016 provide new insights into gene therapy of DMD and BMD via the clustered regularly interspaced short palindromic repeats (CRISPR)/CRISPR-associated protein 9 (Cas9). In brief, adeno-associated virus (AAV) vectors transport guided RNAs (gRNAs) and Cas9 into mdx mouse model, gRNAs recognize the mutated Dmd exon 23 (having a stop codon), and Cas9 cut the mutated exon 23 off the Dmd gene. These manipulations restored expression of truncated but partially functional dystrophin, improved skeletal and cardiac muscle function, and increased survival of mdx mice significantly. This review concisely summarized the related advancements and discussed their primary implications in the future gene therapy of DMD, including AAV-vector selection, gRNA designing, Cas9 optimization, dystrophin-restoration efficiency, administration routes, and systemic and long-term therapeutic efficacy. Future orientations, including off-target effects, safety concerns, immune responses, precision medicine, and Dmd-editing in the brain (potentially blocked by the blood-brain barrier) were also elucidated briefly. Collectively, the AAV-mediated and RNA-guided CRISPR/Cas9 system has major superiorities compared with traditional gene therapy, and might contribute to the treatment of DMD and BMD substantially in the near future."
29966369,PMC6073662,Recent Progress in Gene Therapy for Ovarian Cancer.,2018,Int J Mol Sci,10.3390/ijms19071930,"['Ángela Áyen', 'Yaiza Jiménez Martínez', 'Juan A Marchal', 'Houria Boulaiz']","['delivery systems', 'gene therapy', 'ovarian cancer', 'ovarian cancer stem cells', 'promoter', 'suicide genes']","Ovarian cancer is the most lethal gynecological malignancy in developed countries. This is due to the lack of specific symptoms that hinder early diagnosis and to the high relapse rate after treatment with radical surgery and chemotherapy. Hence, novel therapeutic modalities to improve clinical outcomes in ovarian malignancy are needed. Progress in gene therapy has allowed the development of several strategies against ovarian cancer. Most are focused on the design of improved vectors to enhance gene delivery on the one hand, and, on the other hand, on the development of new therapeutic tools based on the restoration or destruction of a deregulated gene, the use of suicide genes, genetic immunopotentiation, the inhibition of tumour angiogenesis, the alteration of pharmacological resistance, and oncolytic virotherapy. In the present manuscript, we review the recent advances made in gene therapy for ovarian cancer, highlighting the latest clinical trials experience, the current challenges and future perspectives."
26151686,PMC4581786,Gene therapy for ocular diseases meditated by ultrasound and microbubbles (Review).,2015,Mol Med Rep,10.3892/mmr.2015.4054,"['Caifeng Wan', 'Fenghua Li', 'Hongli Li']",[],"The eye is an ideal target organ for gene therapy as it is easily accessible and immune‑privileged. With the increasing insight into the underlying molecular mechanisms of ocular diseases, gene therapy has been proposed as an effective approach. Successful gene therapy depends on efficient gene transfer to targeted cells to prove stable and prolonged gene expression with minimal toxicity. At present, the main hindrance regarding the clinical application of gene therapy is not the lack of an ideal gene, but rather the lack of a safe and efficient method to selectively deliver genes to target cells and tissues. Ultrasound‑targeted microbubble destruction (UTMD), with the advantages of high safety, repetitive applicability and tissue targeting, has become a potential strategy for gene‑ and drug delivery. When gene‑loaded microbubbles are injected, UTMD is able to enhance the transport of the gene to the targeted cells. High‑amplitude oscillations of microbubbles act as cavitation nuclei which can effectively focus ultrasound energy, produce oscillations and disruptions that increase the permeability of the cell membrane and create transient pores in the cell membrane. Thereby, the efficiency of gene therapy can be significantly improved. The UTMD‑mediated gene delivery system has been widely used in pre‑clinical studies to enhance gene expression in a site‑specific manner in a variety of organs. With reasonable application, the effects of sonoporation can be spatially and temporally controlled to improve localized tissue deposition of gene complexes for ocular gene therapy applications. In addition, appropriately powered, focused ultrasound combined with microbubbles can induce a reversible disruption of the blood‑retinal barrier with no significant side effects. The present review discusses the current status of gene therapy of ocular diseases as well as studies on gene therapy of ocular diseases meditated by UTMD."
29801986,PMC6076338,Conditional disruption of hepatic carbamoyl phosphate synthetase 1 in mice results in hyperammonemia without orotic aciduria and can be corrected by liver-directed gene therapy.,2018,Mol Genet Metab,10.1016/j.ymgme.2018.04.001,"['Suhail Khoja', 'Matt Nitzahn', 'Kip Hermann', 'Brian Truong', 'Roberta Borzone', 'Brandon Willis', 'Mitchell Rudd', 'Donna J Palmer', 'Philip Ng', 'Nicola Brunetti-Pierri', 'Gerald S Lipshutz']","['Carbamoyl phosphate', 'Gene therapy', 'synthetase deficiency']","Carbamoyl phosphate synthetase 1 (CPS1) is a urea cycle enzyme that forms carbamoyl phosphate from bicarbonate, ammonia and ATP. Bi-allelic mutations of the CPS1 gene result in a urea cycle disorder presenting with hyperammonemia, often with reduced citrulline, and without orotic aciduria. CPS1 deficiency is particularly challenging to treat and lack of early recognition typically results in early neonatal death. Therapeutic interventions have limited efficacy and most patients develop long-term neurologic sequelae. Using transgenic techniques, we generated a conditional Cps1 knockout mouse. By loxP/Cre recombinase technology, deletion of the Cps1 locus was achieved in adult transgenic animals using a Cre recombinase-expressing adeno-associated viral vector. Within four weeks from vector injection, all animals developed hyperammonemia without orotic aciduria and died. Minimal CPS1 protein was detectable in livers. To investigate the efficacy of gene therapy for CPS deficiency following knock-down of hepatic endogenous CPS1 expression, we injected these mice with a helper-dependent adenoviral vector (HDAd) expressing the large murine CPS1 cDNA under control of the phosphoenolpyruvate carboxykinase promoter. Liver-directed HDAd-mediated gene therapy resulted in survival, normalization of plasma ammonia and glutamine, and 13% of normal Cps1 expression. A gender difference in survival suggests that female mice may require higher hepatic CPS1 expression. We conclude that this conditional murine model recapitulates the clinical and biochemical phenotype detected in human patients with CPS1 deficiency and will be useful to investigate ammonia-mediated neurotoxicity and for the development of cell- and gene-based therapeutic approaches."
30612497,,MDA-7/interleukin 24 (IL-24) in tumor gene therapy: application of tumor penetrating/homing peptides for improvement of the effects.,2019,Expert Opin Biol Ther,10.1080/14712598.2019.1566453,"['Mohammad Rasoolian', 'Majid Kheirollahi', 'Seyed Younes Hosseini']","['IL-24 cytokine', 'Tumor gene therapy', 'cell penetrating peptides (CPPs)', 'melanoma differentiation-associated gene-7 (MDA-7)', 'tumor homing peptides (THPs)']","MDA-7/Interleukin-24 (IL-24), as a pleiotropic cytokine, exhibits a specific tumor suppression property that has attracted a great deal of attention. While its anti-tumor induction is mostly attributed to endogenous gene expression, attachment of secreted MDA-7/IL-24 to cognate receptors also triggers the death of cancerous cell via different pathways. Therefore, precise targeting of secreted MDA-7/IL-24 to tumor cells would render it more efficacy and specificity."
31633477,,CRISPR/Cas9 System and its Research Progress in Gene Therapy.,2020,Anticancer Agents Med Chem,10.2174/1871520619666191014103711,"['Wenlou Liu', 'Chunsheng Yang', 'Yanqun Liu', 'Guan Jiang']","['CRISPR/Cas9', 'Genome editing', 'dermatology', 'gene therapy', 'microbes', 'site mutation.']","Genome editing refers to changing the genome sequence of an organism by knockout, insertion, and site mutation, resulting in changes in the genetic information of the organism. The clustered regularly interspaced short palindromic repeats (CRISPR)/ CRISPR-associated protein-9 nuclease (Cas9) system is a genome editing technique developed by the acquired immune system in the microbes, such as bacteria and archaebacteria, which targets and edits genome sequences according to the principle of complementary base pairing. This technique can be used to edit endogenous genomic DNA sequences in organisms accurately and has been widely used in fields, such as biotechnology, cancer gene therapy, and dermatology. In this review, we summarize the history, structure, mechanism, and application of CRISPR/Cas9 in gene therapy and dermatological diseases."
28191778,PMC5442804,Generation of Human Induced Pluripotent Stem Cell-Derived Bona Fide Neural Stem Cells for Ex Vivo Gene Therapy of Metachromatic Leukodystrophy.,2016,Stem Cells Transl Med,10.5966/sctm.2015-0414,"['Vasco Meneghini', 'Giacomo Frati', 'Davide Sala', 'Silvia De Cicco', 'Marco Luciani', 'Chiara Cavazzin', 'Marianna Paulis', 'Wieslawa Mentzen', 'Francesco Morena', 'Serena Giannelli', 'Francesca Sanvito', 'Anna Villa', 'Alessandro Bulfone', 'Vania Broccoli', 'Sabata Martino', 'Angela Gritti']","['Gene therapy', 'Intracerebral transplantation', 'Metachromatic leukodystrophy', 'Neural stem cell', 'Oligodendrocytes', 'Pluripotent stem cells']","Allogeneic fetal-derived human neural stem cells (hfNSCs) that are under clinical evaluation for several neurodegenerative diseases display a favorable safety profile, but require immunosuppression upon transplantation in patients. Neural progenitors derived from patient-specific induced pluripotent stem cells (iPSCs) may be relevant for autologous ex vivo gene-therapy applications to treat genetic diseases with unmet medical need. In this scenario, obtaining iPSC-derived neural stem cells (NSCs) showing a reliable ""NSC signature"" is mandatory. Here, we generated human iPSC (hiPSC) clones via reprogramming of skin fibroblasts derived from normal donors and patients affected by metachromatic leukodystrophy (MLD), a fatal neurodegenerative lysosomal storage disease caused by genetic defects of the arylsulfatase A (ARSA) enzyme. We differentiated hiPSCs into NSCs (hiPS-NSCs) sharing molecular, phenotypic, and functional identity with hfNSCs, which we used as a ""gold standard"" in a side-by-side comparison when validating the phenotype of hiPS-NSCs and predicting their performance after intracerebral transplantation. Using lentiviral vectors, we efficiently transduced MLD hiPSCs, achieving supraphysiological ARSA activity that further increased upon neural differentiation. Intracerebral transplantation of hiPS-NSCs into neonatal and adult immunodeficient MLD mice stably restored ARSA activity in the whole central nervous system. Importantly, we observed a significant decrease of sulfatide storage when ARSA-overexpressing cells were used, with a clear advantage in those mice receiving neonatal as compared with adult intervention. Thus, we generated a renewable source of ARSA-overexpressing iPSC-derived bona fide hNSCs with improved features compared with clinically approved hfNSCs. Patient-specific ARSA-overexpressing hiPS-NSCs may be used in autologous ex vivo gene therapy protocols to provide long-lasting enzymatic supply in MLD-affected brains. Stem Cells Translational Medicine 2017;6:352-368."
28665213,,Twenty Years of European Union Support to Gene Therapy and Gene Transfer.,2017,Hum Gene Ther,10.1089/hum.2017.110,['David Gancberg'],"['European Union', 'Framework Programme', 'gene therapy', 'gene transfer']","For 20 years and throughout its research programmes, the European Union has supported the entire innovation chain for gene transfer and gene therapy. The fruits of this investment are ripening as gene therapy products are reaching the European market and as clinical trials are demonstrating the safety of this approach to treat previously untreatable diseases."
31529284,,ApoE-2 Brain-Targeted Gene Therapy Through Transferrin and Penetratin Tagged Liposomal Nanoparticles.,2019,Pharm Res,10.1007/s11095-019-2691-7,"['Bruna Dos Santos Rodrigues', 'Takahisa Kanekiyo', 'Jagdish Singh']","['ApoE2', 'gene therapy', 'liposome', 'penetratin', 'transferrin']",Apolipoprotein E2 (ApoE2) gene therapy is a potential disease-modifying therapy for Alzheimer's disease (AD). We investigated the potential of plasmid encoding ApoE2 loaded brain-targeted functionalized-liposomes for treatment of AD. This was achieved via systemic administration of liposomes entrapping therapeutic gene targeting the brain of mice.
27729044,PMC5059932,"Retroviral vectors and transposons for stable gene therapy: advances, current challenges and perspectives.",2016,J Transl Med,10.1186/s12967-016-1047-x,"['José Eduardo Vargas', 'Leonardo Chicaybam', 'Renato Tetelbom Stein', 'Amilcar Tanuri', 'Andrés Delgado-Cañedo', 'Martin H Bonamino']","['Clinical trials', 'Gene therapy', 'Lentivectors', 'Transposons']","Gene therapy protocols require robust and long-term gene expression. For two decades, retrovirus family vectors have offered several attractive properties as stable gene-delivery vehicles. These vectors represent a technology with widespread use in basic biology and translational studies that require persistent gene expression for treatment of several monogenic diseases. Immunogenicity and insertional mutagenesis represent the main obstacles to a wider clinical use of these vectors. Efficient and safe non-viral vectors are emerging as a promising alternative and facilitate clinical gene therapy studies. Here, we present an updated review for beginners and expert readers on retro and lentiviruses and the latest generation of transposon vectors (sleeping beauty and piggyBac) used in stable gene transfer and gene therapy clinical trials. We discuss the potential advantages and disadvantages of these systems such as cellular responses (immunogenicity or genome modification of the target cell) following exogenous DNA integration. Additionally, we discuss potential implications of these genome modification tools in gene therapy and other basic and applied science contexts."
26922809,PMC4887702,Gene therapy for the treatment of heart failure: promise postponed.,2016,Eur Heart J,10.1093/eurheartj/ehw019,"['Jean-Sebastien Hulot', 'Kiyotake Ishikawa', 'Roger J Hajjar']","['Adeno-associated vectors', 'Excitation–contraction coupling', 'Gene therapy', 'Heart failure', 'Sarcoplasmic reticulum calcium ATPase']","Gene therapy has emerged as a powerful tool in targeting the molecular mechanisms implicated in heart failure. Refinements in vector technology, including the development of recombinant adeno-associated vectors, have allowed for safe, long-term, and efficient gene transfer to the myocardium. These advancements, coupled with evolving delivery techniques, have placed gene therapy as a viable therapeutic option for patients with heart failure. However, after much promise in early-phase clinical trials, the more recent larger clinical trials have shown disappointing results, thus forcing the field to re-evaluate current vectors, delivery systems, targets, and endpoints. We provide here an updated review of current cardiac gene therapy programmes that have been or are being translated into clinical trials."
25455252,PMC4623027,Sleeping Beauty transposon system for genetic etiological research and gene therapy of cancers.,2015,Cancer Biol Ther,10.4161/15384047.2014.986944,"['Xiaomei Hou', 'Yan Du', 'Yang Deng', 'Jianfeng Wu', 'Guangwen Cao']","['7, 12-dimethylbenzanthracene/12-O-tetradecanoylphorbol-13-acetate', 'Alb-Cre, Albumin promoter-Cre', 'CAG promoter, CMV enhancer/chicken β-actin promoter', 'CAR, chimeric antigen receptor', 'CIS, common insertion site', 'CMV, chimeric cytomegalovirus', 'CRC, colorectal cancer', 'Cre, cyclization recombination enzyme', 'DDE, Asp, Asp, Glu', 'DMBA/TPA', 'DR, direct orientation', 'Fah, fumarylacetoacetate hydrolase gene', 'GWAS, gnome wide analysis study', 'HBV, Hepatitis B Virus', 'HBx, HBV X protein', 'HCC, hepatocellular carcinoma', 'IRs, inverted repeat sequences', 'LsL, loxP-stop-loxP', 'MPNSTs, malignant peripheral nerve sheath tumor', 'MSCV, murine stem cell virus', 'PAI, Pro, Ala, Ile', 'PBMCs, peripheral blood mononuclear cells', 'RED, Arg, Glu, Asp', 'RosaSBaseLsL, Cre-inducible SBase allele', 'Rtl1, Retrotransposon-like 1', 'SB, Sleeping Beauty', 'SBase, Sleeping Beauty transposase', 'Sleeping Beauty transposon system', 'StatinAE, angiostatin-endostatin fusion gene', 'Trp53, transformation related protein 53', 'animal model', 'driver', 'gene function', 'gene therapy', 'malignant diseases', 'sgRNA, single guide RNA', 'shp53, short hairpin RNA against the Trp53 gene', 'somatic mutation']","Carcinogenesis is etiologically associated with somatic mutations of critical genes. Recently, a number of somatic mutations and key molecules have been found to be involved in functional networks affecting cancer progression. Suitable animal models are required to validate cancer-promoting or -inhibiting capacities of these mutants and molecules. Sleeping Beauty transposon system consists of a transposon that carries gene(s) of interest and a transposase that recognizes, excises, and reinserts genes in given location of the genome. It can create both gain-of-function and loss-of-function mutations, thus being frequently chosen to investigate the etiological mechanisms and gene therapy for cancers in animal models. In this review, we summarized current advances of Sleeping Beauty transposon system in revealing molecular mechanism of cancers and improving gene therapy. Understanding molecular mechanisms by which driver mutations contribute to carcinogenesis and metastasis may pave the way for the development of innovative prophylactic and therapeutic strategies against malignant diseases."
31672061,PMC6919282,A Common Outer Retinal Change in Retinal Degeneration by Optical Coherence Tomography Can Be Used to Assess Outcomes of Gene Therapy.,2019,Hum Gene Ther,10.1089/hum.2019.162,"['Myung Kuk Joe', 'Wenbo Li', 'Suja Hiriyanna', 'Wenhan Yu', 'Shreya A Shah', 'Mones Abu-Asab', 'Haohua Qian', 'Zhijian Wu']","['AAV vectors', 'OCT', 'gene therapy', 'retinal degeneration']","Identifying early disease hallmarks in animal models with slow disease progression may expedite disease detection and assessment of treatment outcomes. Using optical coherence tomography, a widely applied noninvasive method for monitoring retinal structure changes, we analyzed retinal optical sections from six mouse lines with retinal degeneration caused by mutations in different disease-causing genes. While images from wild-type mice revealed four well-separated hyper-reflective bands in the outer retina (designated as outer retina reflective bands, ORRBs) at all ages, the second band (ORRB2) and the third band (ORRB3) were merged in retinas of five mutant mouse lines at early ages, suggesting the pathological nature of this alteration. This ORRB change appeared to be degenerating photoreceptor related, and occurred before obvious morphological changes that can be identified on both hematoxylin and eosin-stained sections and electron microscopic sections. Importantly, the merging of ORRB2 and ORRB3 was reversed by treatment with adeno-associated viral vector-mediated gene replacement therapies, and this restoration occurred much earlier than measurable functional or structural improvement. Our data suggest that the ORRB change could be a common hallmark of early retinal degeneration and its restoration could be used for rapid and noninvasive assessment of therapeutic effects following gene therapy or other treatment interventions."
