PMID,PMCID,Title,Year,Journal,DOI,Authors,Keywords,Abstract
28550013,PMC5560817,An Essential Regulatory System Originating from Polygenic Transcriptional Rewiring of PhoP-PhoQ of ,2017,Genetics,10.1534/genetics.117.200204,"['Bao-Yu Peng', 'Yue Pan', 'Ru-Jiao Li', 'Jin-Wei Wei', 'Fang Liang', 'Li Wang', 'Fang-Fang Wang', 'Wei Qian']","['PhoP-PhoQ', 'Xanthomonas campestris pv. campestris', 'essential gene', 'transcription-cis regulatory element rewiring', 'two-component signal transduction system']","How essential, regulatory genes originate and evolve is intriguing because mutations of these genes not only lead to lethality in organisms, but also have pleiotropic effects since they control the expression of multiple downstream genes. Therefore, the evolution of essential, regulatory genes is not only determined by genetic variations of their own sequences, but also by the biological function of downstream genes and molecular mechanisms of regulation. To understand the origin of essential, regulatory genes, experimental dissection of the complete regulatory cascade is needed. Here, we provide genetic evidences to reveal that PhoP-PhoQ is an essential two-component signal transduction system in the gram-negative bacterium "
26873854,PMC4982840,Neuronal Activity-Induced Sterol Regulatory Element Binding Protein-1 (SREBP1) is Disrupted in Dysbindin-Null Mice-Potential Link to Cognitive Impairment in Schizophrenia.,2016,Mol Neurobiol,10.1007/s12035-016-9773-x,"['Yong Chen', 'Sookhee Bang', 'Mary F McMullen', 'Hala Kazi', 'Konrad Talbot', 'Mei-Xuan Ho', 'Greg Carlson', 'Steven E Arnold', 'Wei-Yi Ong', 'Sangwon F Kim']","['ATP', 'Antipsychotics', 'Cerebral Cortex', 'Cognition', 'DHA', 'Dysbindin', 'Lipid synthesis', 'NMDA', 'Neurons', 'PUFA', 'SREBP', 'Synaptic Plasticity']","Schizophrenia is a chronic debilitating neuropsychiatric disorder that affects about 1 % of the population. Dystrobrevin-binding protein 1 (DTNBP1 or dysbindin) is one of the Research Domain Constructs (RDoC) associated with cognition and is significantly reduced in the brain of schizophrenia patients. To further understand the molecular underpinnings of pathogenesis of schizophrenia, we have performed microarray analyses of the hippocampi from dysbindin knockout mice, and found that genes involved in the lipogenic pathway are suppressed. Moreover, we discovered that maturation of a master transcriptional regulator for lipid synthesis, sterol regulatory element binding protein-1 (SREBP1) is induced by neuronal activity, and is required for induction of the immediate early gene ARC (activity-regulated cytoskeleton-associated protein), necessary for synaptic plasticity and memory. We found that nuclear SREBP1 is dramatically reduced in dysbindin-1 knockout mice and postmortem brain tissues from human patients with schizophrenia. Furthermore, activity-dependent maturation of SREBP1 as well as ARC expression were attenuated in dysbindin-1 knockout mice, and these deficits were restored by an atypical antipsychotic drug, clozapine. Together, results indicate an important role of dysbindin-1 in neuronal activity induced SREBP1 and ARC, which could be related to cognitive deficits in schizophrenia."
20201106,PMC3110066,Identification of a distant cis-regulatory element controlling pharyngeal arch-specific expression of zebrafish gdf6a/radar.,2010,Dev Dyn,10.1002/dvdy.22251,"['Nykolaus P Reed', 'Douglas P Mortlock']",[],"Skeletal formation is an essential and intricately regulated part of vertebrate development. Humans and mice deficient in growth and differentiation factor 6 (Gdf6) have numerous skeletal abnormalities, including joint fusions and cartilage reductions. The expression of Gdf6 is dynamic and in part regulated by distant evolutionarily conserved cis-regulatory elements. radar/gdf6a is a zebrafish ortholog of Gdf6 and has an essential role in embryonic patterning. Here, we show that radar is transcribed in the cells surrounding and between the developing cartilages of the ventral pharyngeal arches, similar to mouse Gdf6. A 312 bp evolutionarily conserved region (ECR5), 122 kilobases downstream, drives expression in a pharyngeal arch-specific manner similar to endogenous radar/gdf6a. Deletion analysis identified a 78 bp region within ECR5 that is essential for transgene activity. This work illustrates that radar is regulated in the pharyngeal arches by a distant conserved element and suggests radar has similar functions in skeletal development in fish and mammals."
29653103,,Sterol regulatory element binding protein 1 trans-activates 25-hydroxy vitamin D,2018,Biochem Biophys Res Commun,10.1016/j.bbrc.2018.04.058,"['Tomohiro Kagawa', 'Mina Kozai', 'Masashi Masuda', 'Nagakatsu Harada', 'Otoki Nakahashi', 'Mari Tajiri', 'Ryouhei Yoshikawa', 'Mari Nakao', 'Yuichiro Takei', 'Masayuki Iwano', 'Eiji Takeda', 'Yutaka Taketani', 'Hironori Yamamoto']","['CYP24A1', 'SREBP1', 'Thyroid hormone', 'Transcriptional regulation', 'Vitamin D']",The physiological activity of the steroid derived hormone vitamin D is regulated by several enzymatic steps. Both 25-hydroxy vitamin D
30954075,PMC6451783,Influences of sterol regulatory element binding protein-1c silencing on glucose production in HepG2 cells treated with free fatty acid.,2019,Lipids Health Dis,10.1186/s12944-019-1026-3,"['Xiu-Ping Bai', 'Feng Dong', 'Guo-Hua Yang', 'Lei Zhang']","['Free fatty acid', 'Glucose production', 'HepG2 cells', 'SREBP-1c silencing']","Elevation of exogenous free fatty acid (FFA) level leads to insulin resistance (IR) in liver, IR is manifested by elevated hepatic glucose production. We aim to study whether inhibition of endogenous fatty acid synthesis could decrease hepatic glucose production."
30430717,,Deficiency of sterol regulatory element-binding protein-1c induces schizophrenia-like behavior in mice.,2018,Genes Brain Behav,10.1111/gbb.12540,"['Sueun Lee', 'Sohi Kang', 'Mary Jasmin Ang', 'Juhwan Kim', 'Jong Choon Kim', 'Sung-Ho Kim', 'Tae-Il Jeon', 'Chaeyong Jung', 'Seung-Soon Im', 'Changjong Moon']","['GABAergic transmission', 'SREBP-1c', 'behavior', 'mice', 'schizophrenia']","Schizophrenia is a hereditary disease that approximately 1% of the worldwide population develops. Many studies have investigated possible underlying genes related to schizophrenia. Recently, clinical studies suggested sterol regulatory element-binding protein (SREBP) as a susceptibility gene in patients with schizophrenia. SREBP controls cellular lipid homeostasis by three isoforms: SREBP-1a, SREBP-1c and SREBP-2. This study used SREBP-1c knockout (KO) mice to examine whether a deficiency in SREBP-1c would affect their emotional and psychiatric behaviors. Altered mRNA expression in genes downstream from SREBP-1c was confirmed in the brains of SREBP-1c KO mice. Schizophrenia-like behavior, including hyperactivity during the dark phase, depressive-like behavior, aggressive behavior and deficits in social interaction and prepulse inhibition, was observed in SREBP-1c KO mice. Furthermore, increased volume of the lateral ventricle was detected in SREBP-1c KO mice. The mRNA levels of several γ-aminobutyric acid (GABA)-receptor subtypes and/or glutamic acid decarboxylase 65/67 decreased in the hippocampus and medial prefrontal cortex of SREBP-1c KO mice. Thus, SREBP-1c deficiency may contribute to enlargement of the lateral ventricle and development of schizophrenia-like behaviors and be associated with altered GABAergic transmission."
32641802,,lentiMPRA and MPRAflow for high-throughput functional characterization of gene regulatory elements.,2020,Nat Protoc,10.1038/s41596-020-0333-5,"['M Grace Gordon', 'Fumitaka Inoue', 'Beth Martin', 'Max Schubach', 'Vikram Agarwal', 'Sean Whalen', 'Shiyun Feng', 'Jingjing Zhao', 'Tal Ashuach', 'Ryan Ziffra', 'Anat Kreimer', 'Ilias Georgakopoulous-Soares', 'Nir Yosef', 'Chun Jimmie Ye', 'Katherine S Pollard', 'Jay Shendure', 'Martin Kircher', 'Nadav Ahituv']",[],"Massively parallel reporter assays (MPRAs) can simultaneously measure the function of thousands of candidate regulatory sequences (CRSs) in a quantitative manner. In this method, CRSs are cloned upstream of a minimal promoter and reporter gene, alongside a unique barcode, and introduced into cells. If the CRS is a functional regulatory element, it will lead to the transcription of the barcode sequence, which is measured via RNA sequencing and normalized for cellular integration via DNA sequencing of the barcode. This technology has been used to test thousands of sequences and their variants for regulatory activity, to decipher the regulatory code and its evolution, and to develop genetic switches. Lentivirus-based MPRA (lentiMPRA) produces 'in-genome' readouts and enables the use of this technique in hard-to-transfect cells. Here, we provide a detailed protocol for lentiMPRA, along with a user-friendly Nextflow-based computational pipeline-MPRAflow-for quantifying CRS activity from different MPRA designs. The lentiMPRA protocol takes ~2 months, which includes sequencing turnaround time and data processing with MPRAflow."
22736458,PMC3484864,Deletion of a conserved regulatory element required for Hmx1 expression in craniofacial mesenchyme in the dumbo rat: a newly identified cause of congenital ear malformation.,2012,Dis Model Mech,10.1242/dmm.009910,"['Lely A Quina', 'Takashi Kuramoto', 'Daniela V Luquetti', 'Timothy C Cox', 'Tadao Serikawa', 'Eric E Turner']",[],"Hmx1 is a homeodomain transcription factor expressed in the developing eye, peripheral ganglia, and branchial arches of avian and mammalian embryos. Recent studies have identified a loss-of-function allele at the HMX1 locus as the causative mutation in the oculo-auricular syndrome (OAS) in humans, characterized by ear and eye malformations. The mouse dumbo (dmbo) mutation, with similar effects on ear and eye development, also results from a loss-of-function mutation in the Hmx1 gene. A recessive dmbo mutation causing ear malformation in rats has been mapped to the chromosomal region containing the Hmx1 gene, but the nature of the causative allele is unknown. Here we show that dumbo rats and mice exhibit similar neonatal ear and eye phenotypes. In midgestation embryos, dumbo rats show a specific loss of Hmx1 expression in neural-crest-derived craniofacial mesenchyme (CM), whereas Hmx1 is expressed normally in retinal progenitors, sensory ganglia and in CM, which is derived from mesoderm. High-throughput resequencing of 1 Mb of rat chromosome 14 from dmbo/dmbo rats, encompassing the Hmx1 locus, reveals numerous divergences from the rat genomic reference sequence, but no coding changes in Hmx1. Fine genetic mapping narrows the dmbo critical region to an interval of ∼410 kb immediately downstream of the Hmx1 transcription unit. Further sequence analysis of this region reveals a 5777-bp deletion located ∼80 kb downstream in dmbo/dmbo rats that is not apparent in 137 other rat strains. The dmbo deletion region contains a highly conserved domain of ∼500 bp, which is a candidate distal enhancer and which exhibits a similar relationship to Hmx genes in all vertebrate species for which data are available. We conclude that the rat dumbo phenotype is likely to result from loss of function of an ultraconserved enhancer specifically regulating Hmx1 expression in neural-crest-derived CM. Dysregulation of Hmx1 expression is thus a candidate mechanism for congenital ear malformation, most cases of which remain unexplained."
31633482,PMC6802965,,2019,Elife,10.7554/eLife.48216,"['Daniel P Murphy', 'Andrew Eo Hughes', 'Karen A Lawrence', 'Connie A Myers', 'Joseph C Corbo']","['ATAC-seq', 'bipolar cell', 'chromosomes', 'cis-regulatory element', 'gene expression', 'genetics', 'genomics', 'mouse', 'photoreceptor', 'retina', 'sister cell type']","Multicellular organisms evolved via repeated functional divergence of transcriptionally related sister cell types, but the mechanisms underlying sister cell type divergence are not well understood. Here, we study a canonical pair of sister cell types, retinal photoreceptors and bipolar cells, to identify the key "
21839154,PMC3711265,The polypyrimidine/polypurine motif in the mouse mu opioid receptor gene promoter is a supercoiling-regulatory element.,2011,Gene,10.1016/j.gene.2011.07.026,"['Chung-youl Choe', 'Hogyoung Kim', 'Jinping Dong', 'Andre J van Wijnen', 'Ping-Yee Law', 'Horace H Loh']",[],"The mu opioid receptor (MOR) is the principle molecular target of opioid analgesics. The polypyrimidine/polypurine (PPy/u) motif enhances the activity of the MOR gene promoter by adopting a non-B DNA conformation. Here, we report that the PPy/u motif regulates the processivity of torsional stress, which is important for endogenous MOR gene expression. Analysis by topoisomerase assays, S1 nuclease digests, and atomic force microscopy showed that, unlike homologous PPy/u motifs, the position- and orientation-induced structural strains to the mouse PPy/u element affect its ability to perturb the relaxation activity of topoisomerase, resulting in polypurine strand-nicked and catenated DNA conformations. Raman spectrum microscopy confirmed that mouse PPy/u containing-plasmid DNA molecules under the different structural strains have a different configuration of ring bases as well as altered Hoogsteen hydrogen bonds. The mouse MOR PPy/u motif drives reporter gene expression fortyfold more effectively in the sense orientation than in the antisense orientation. Furthermore, mouse neuronal cells activate MOR gene expression in response to the perturbations of topology by topoisomerase inhibitors, whereas human cells do not. These results suggest that, interestingly among homologous PPy/u motifs, the mouse MOR PPy/u motif dynamically responds to torsional stress and consequently regulates MOR gene expression in vivo."
32853335,,Recapitulating evolutionary divergence in a single cis-regulatory element is sufficient to cause expression changes of the lens gene Tdrd7.,2020,Mol Biol Evol,10.1093/molbev/msaa212,"['Juliana G Roscito', 'Kaushikaram Subramanian', 'Ronald Naumann', 'Mihail Sarov', 'Anna Shevchenko', 'Aliona Bogdanova', 'Thomas Kurth', 'Leo Foerster', 'Moritz Kreysing', 'Michael Hiller']","['cis-regulatory elements', 'eye degeneration', 'genome engineering', 'phenotypic evolution', 'subterranean mammals']","Mutations in cis-regulatory elements play important roles for phenotypic changes during evolution. Eye degeneration in the blind mole rat (BMR; Nannospalax galili) and other subterranean mammals is significantly associated with widespread divergence of eye regulatory elements, but the effect of these regulatory mutations on eye development and function has not been explored. Here, we investigate the effect of mutations observed in the BMR sequence of a conserved non-coding element upstream of Tdrd7, a pleiotropic gene required for lens development and spermatogenesis. We first show that this conserved element is a transcriptional repressor in lens cells and that the BMR sequence partially lost repressor activity. Next, we recapitulated evolutionary changes in this element by precisely replacing the endogenous regulatory element in a mouse line by the orthologous BMR sequence with CRISPR-Cas9. Strikingly, this repressor replacement caused a more than two-fold up-regulation of Tdrd7 in the developing lens; however, increased mRNA level does not result in a corresponding increase in TDRD7 protein nor an obvious lens phenotype, possibly explained by buffering at the posttranscriptional level. Our results are consistent with eye degeneration in subterranean mammals having a polygenic basis where many small-effect mutations in different eye-regulatory elements collectively contribute to phenotypic differences."
30292406,,"Sterol regulatory element binding protein-1: Molecular cloning, tissue distribution and gene expression level in response to nutritional regulation in mud crab, Scylla paramamosain.",2018,Biochem Biophys Res Commun,10.1016/j.bbrc.2018.09.154,"['Meilin Hao', 'Zhideng Lin', 'Hua Rong', 'Dashi Zhu', 'Xiaobo Wen']","['Cloning', 'Mud crab', 'Nutritional regulation', 'SREBP-1', 'Soybean oil']","In the present study, SREBP-1 cDNA was cloned from the hepatopancreas of mud crab (Scylla paramamosain) and characterized by performing rapid-amplification of cDNA ends. The 3361bp long full-length cDNA encodes a polypeptide with 1039 amino acids. Tissue distribution analysis revealed that SREBP-1 transcripts were widely distributed in various organs, with higher mRNA levels in the eyestalk and cranial ganglia. Further, expression level of SREBP-1 mRNA were up-regulated in proportion to the replacement of dietary fish oil (FO) with soybean oil (SO). These results may contribute to better understanding of the long-chain polyunsaturated fatty acids (LC-PUFA) biosynthetic pathway and regulation mechanism in mud crab."
30564968,,MiRNA-target interactions in osteogenic signaling pathways involving zinc via the metal regulatory element.,2018,Biometals,10.1007/s10534-018-00162-4,"['Michael Francis', 'Arthur Grider']","['MIR34A', 'Metal regulatory element', 'Metal regulatory element-binding transcription factor 1', 'MicroRNA', 'Osteogenesis', 'Zinc']","Adequate zinc nutriture is necessary for normal bone growth and development, though the precise mechanisms for zinc-mediated bone growth remain poorly defined. A key transcription factor activated by zinc is metal response element-binding transcription factor 1 (MTF-1), which binds to the metal regulatory element (MRE). We hypothesize that MREs will be found upstream of miRNA genes as well as miRNA target genes in the following bone growth and development signaling pathways: TGF-β, MAPK, and Wnt. A Bioconductor-based workflow in R was designed to identify interactions between MREs, miRNAs, and target genes. MRE sequences were found upstream from 64 mature miRNAs that interact with 213 genes which have MRE sequences in their own promoter regions. MAPK1 exhibited the most miRNA-target interactions (MTIs) in the TGF-β and MAPK signaling pathways; CCND2 exhibited the most interactions in the Wnt signaling pathway. Hsa-miR-124-3p exhibited the most MTIs in the TGF-β and MAPK signaling pathways; hsa-miR-20b-5p exhibited the most MTIs in the Wnt signaling pathway. MYC and hsa-miR-34a-5p were shared between all three signaling pathways, also forming an MTI unit. JUN exhibited the most protein-protein interactions, followed by MAPK8. These in silico data support the hypothesis that intracellular zinc status plays a role in osteogenesis through the transcriptional regulation of miRNA genes via the zinc/MTF-1/MRE complex."
29968360,PMC6175466,Activation of sterol regulatory element-binding protein 1 (SREBP1)-mediated lipogenesis by the Epstein-Barr virus-encoded latent membrane protein 1 (LMP1) promotes cell proliferation and progression of nasopharyngeal carcinoma.,2018,J Pathol,10.1002/path.5130,"['Angela Kwok-Fung Lo', 'Raymond Wai-Ming Lung', 'Christopher W Dawson', 'Lawrence S Young', 'Chuen-Wai Ko', 'Walter Wai Yeung', 'Wei Kang', 'Ka-Fai To', 'Kwok-Wai Lo']","['Epstein-Barr virus', 'LMP1', 'SREBP1', 'lipogenesis', 'nasopharyngeal carcinoma']","Nasopharyngeal carcinoma (NPC) is closely associated with Epstein-Barr virus (EBV) infection. The EBV-encoded latent membrane protein 1 (LMP1), which is commonly expressed in NPC, engages multiple signaling pathways that promote cell growth, transformation, and metabolic reprogramming. Here, we report a novel function of LMP1 in promoting de novo lipogenesis. LMP1 increases the expression, maturation and activation of sterol regulatory element-binding protein 1 (SREBP1), a master regulator of lipogenesis, and its downstream target fatty acid synthase (FASN). LMP1 also induces de novo lipid synthesis and lipid droplet formation. In contrast, small interfering RNA (siRNA) knockdown of LMP1 in EBV-infected epithelial cells diminished SREBP1 activation and lipid biosynthesis. Furthermore, inhibition of the mammalian target of rapamycin (mTOR) pathway, through the use of either mTOR inhibitors or siRNAs, significantly reduced LMP1-mediated SREBP1 activity and lipogenesis, indicating that LMP1 activation of the mTOR pathway is required for SREBP1-mediated lipogenesis. In primary NPC tumors, FASN overexpression is common, with high levels correlating significantly with LMP1 expression. Moreover, elevated FASN expression was associated with aggressive disease and poor survival in NPC patients. Luteolin and fatostatin, two inhibitors of lipogenesis, suppressed lipogenesis and proliferation of nasopharyngeal epithelial cells, effects that were more profound in cells expressing LMP1. Luteolin and fatostatin also dramatically inhibited NPC tumor growth in vitro and in vivo. Our findings demonstrate that LMP1 activation of SREBP1-mediated lipogenesis promotes tumor cell growth and is involved in EBV-driven NPC pathogenesis. Our results also reveal the therapeutic potential of utilizing lipogenesis inhibitors in the treatment of locally advanced or metastatic NPC. © 2018 The Authors. The Journal of Pathology published by John Wiley & Sons Ltd on behalf of Pathological Society of Great Britain and Ireland."
32517818,,Transcriptional regulation mechanism of sterol regulatory element binding proteins on Δ6 fatty acyl desaturase in razor clam ,2020,Br J Nutr,10.1017/S0007114520002068,"['Zhaoshou Ran', 'Fei Kong', 'Jilin Xu', 'Kai Liao', 'Xiaojun Yan']","['Sinonovacula constricta', 'Sterol regulatory element binding proteins', 'Transcriptional regulation', 'Δ6 Fatty acyl desaturase']","The razor clam, Sinonovacula constricta, contains high levels of long-chain PUFA (LC-PUFA), which are critical for human health. In addition, S. constricta is the first marine mollusc demonstrated to possess Δ6 fatty acyl desaturase (Fad) and complete LC-PUFA biosynthetic ability, providing a good representative to investigate the molecular mechanism of sterol regulatory element binding proteins (SREBP) in regulating Δ6 Fad for LC-PUFA biosynthesis in marine molluscs. Herein, S. constricta SREBP and Δ6 Fad promoter were cloned and characterised. Subsequently, dual luciferase and electrophoretic mobility shift assays were conducted to explore the SREBP binding elements in the core regulatory region of S. constricta Δ6 Fad promoter. Results showed that S. constricta SREBP had a very conservative basic helix-loop-helix-leucine zipper motif, while S. constricta Δ6 Fad promoter exhibited very poor identity with teleost Fads2 promoters, indicating their differentiation during evolution. A 454 bp region harbouring a core sequence in S. constricta Δ6 Fad promoter was predicted to be essential for the transcriptional activation by SREBP. This was the first report on the regulatory mechanism of LC-PUFA biosynthesis in marine molluscs, which would facilitate optimising the LC-PUFA biosynthetic pathway of bivalves in further studies."
25794851,PMC4444420,Fibroblast growth factor 21 prevents atherosclerosis by suppression of hepatic sterol regulatory element-binding protein-2 and induction of adiponectin in mice.,2015,Circulation,10.1161/CIRCULATIONAHA.115.015308,"['Zhuofeng Lin', 'Xuebo Pan', 'Fan Wu', 'Dewei Ye', 'Yi Zhang', 'Yu Wang', 'Leigang Jin', 'Qizhou Lian', 'Yu Huang', 'Hong Ding', 'Chris Triggle', 'Kai Wang', 'Xiaokun Li', 'Aimin Xu']","['adipokines', 'atherosclerosis', 'fibroblast growth factor 21', 'hormones']","Fibroblast growth factor 21 (FGF21) is a metabolic hormone with pleiotropic effects on glucose and lipid metabolism and insulin sensitivity. It acts as a key downstream target of both peroxisome proliferator-activated receptor α and γ, the agonists of which have been used for lipid lowering and insulin sensitization, respectively. However, the role of FGF21 in the cardiovascular system remains elusive."
20599406,,Novel transcriptional regulatory element in the phenylalanine hydroxylase gene intron 8.,2010,Mol Genet Metab,10.1016/j.ymgme.2010.05.014,"['Maja Stojiljkovic', 'Branka Zukic', 'Natasa Tosic', 'Teodora Karan-Djurasevic', 'Vesna Spasovski', 'Gordana Nikcevic', 'Sonja Pavlovic']",[],"We present the first transcriptional regulatory element found in a PAH gene intron. The element is located in the PAH gene intron 8, acts as an enhancer specifically in the hepatoma cell line, and binds GATA-1 transcription factor. Herein the presented data could unlock a new area for the analysis of PAH gene expression and could contribute to refining genotype-phenotype correlation."
29804513,,Isoxanthohumol stimulates ubiquitin-proteasome-dependent degradation of precursor forms of sterol regulatory element-binding proteins.,2018,Biosci Biotechnol Biochem,10.1080/09168451.2018.1478715,"['Jun Inoue', 'Shingo Miyata', 'Makoto Shimizu', 'Ryuichiro Sato']","['Isoxanthohumol', 'SREBP', 'ubiquitin-proteasome']","Sterol regulatory element-binding proteins (SREBPs) are transcription factors that regulate a wide variety of genes involved in fatty acid and cholesterol synthesis. In the present study, we identified that isoxanthohumol (IXN) suppressed SREBP activity. Low concentrations of IXN (10 and 30 μM) reduced the amount of mature forms of SREBPs, while high concentration of IXN (100 μM) reduced both precursor and mature forms of SREBPs in Huh-7 cells. The IXN-mediated decrease in the precursor forms of SREBPs in Huh-7 cells was completely abolished by culturing cells under sterol-supplemented conditions and was partly abolished by treatment with a proteasome inhibitor, MG132, but not a lysosome inhibitor, NH"
