PMID,PMCID,Title,Year,Journal,DOI,Authors,Keywords,Abstract
22323723,PMC3324095,A Phox2- and Hand2-dependent Hand1 cis-regulatory element reveals a unique gene dosage requirement for Hand2 during sympathetic neurogenesis.,2012,J Neurosci,10.1523/JNEUROSCI.3584-11.2012,"['Joshua W Vincentz', 'Nathan J VanDusen', 'Andrew B Fleming', 'Michael Rubart', 'Beth A Firulli', 'Marthe J Howard', 'Anthony B Firulli']",[],"Neural crest cell specification and differentiation to a sympathetic neuronal fate serves as an important model for neurogenesis and depends upon the function of both bHLH transcription factors, notably Hand2, and homeodomain transcription factors, including Phox2b. Here, we define a 1007 bp cis-regulatory element 5' of the Hand1 gene sufficient to drive reporter expression within the sympathetic chain of transgenic mice. Comparative genomic analyses uncovered evolutionarily conserved consensus-binding sites within this element, which chromatin immunoprecipitation and electrophoretic mobility shift assays confirm are bound by Hand2 and Phox2b. Mutational analyses revealed that the conserved Phox2 and E-box binding sites are necessary for proper cis-regulatory element activity, and expression analyses on both Hand2 conditionally null and hypomorphic backgrounds demonstrate that Hand2 is required for reporter activation in a gene dosage-dependent manner. We demonstrate that Hand2 and Hand1 differentially bind the E-boxes in this cis-regulatory element, establishing molecular differences between these two factors. Finally, we demonstrate that Hand1 is dispensable for normal tyrosine hydroxylase (TH) and dopamine β-hydroxylase (DBH) expression in sympathetic neurons, even when Hand2 gene dosage is concurrently reduced by half. Together, these data define a tissue-specific Hand1 cis-regulatory element controlled by two factors essential for the development of the sympathetic nervous system and provide in vivo regulatory evidence to support previous findings that Hand2, rather than Hand1, is predominantly responsible for regulating TH, DBH, and Hand1 expression in developing sympathetic neurons."
29519853,,"Cooperative Regulation of Intestinal UDP-Glucuronosyltransferases 1A8, -1A9, and 1A10 by CDX2 and HNF4",2018,Mol Pharmacol,10.1124/mol.117.110619,"['Nurul Mubarokah', 'Julie-Ann Hulin', 'Peter I Mackenzie', 'Ross A McKinnon', 'Alex Z Haines', 'Dong Gui Hu', 'Robyn Meech']",[],The gastrointestinal tract expresses several UDP-glucuronosyltransferases (UGTs) that act as a first line of defense against dietary toxins and contribute to the metabolism of orally administered drugs. The expression of 
23300015,,Retinol binding protein 4 stimulates hepatic sterol regulatory element-binding protein 1 and increases lipogenesis through the peroxisome proliferator-activated receptor-γ coactivator 1β-dependent pathway.,2013,Hepatology,10.1002/hep.26227,"['Min Xia', 'Yan Liu', 'Honghui Guo', 'Duan Wang', 'Yun Wang', 'Wenhua Ling']",[],"Recent studies have revealed the essential role of retinol binding protein 4 (RBP4) in insulin resistance. However, the impact of RBP4 on aberrant lipogenesis, the common hepatic manifestation in insulin resistance states, and the underlying mechanism remain elusive. The present study was designed to examine the effect of RBP4 on sterol regulatory element-binding protein (SREBP-1) and hepatic lipogenesis. Treatment with human retinol-bound RBP4 (holo-RBP4) significantly induced intracellular triglyceride (TAG) synthesis in HepG2 cells and this effect is retinol-independent. Furthermore, RBP4 treatment enhanced the levels of mature SREBP-1 and its nuclear translocation, thereby increasing the expression of lipogenic genes, including fatty acid synthase (FAS), acetyl coenzyme A carboxylase-1 (ACC-1), and diacylglycerol O-acyltransferase 2 (DGAT-2). Stimulation of HepG2 cells with RBP4 strongly up-regulated the expression of transcriptional coactivator peroxisome proliferator-activated receptor-γ coactivator 1β (PGC-1β) at both the messenger RNA (mRNA) and protein levels. The transcriptional activation of PGC-1β is necessary and sufficient for the transcriptional activation of SREBP-1 in response to RBP4. The cyclic adenosine monophosphate (cAMP)-response element binding protein (CREB) was identified as the target transcription factor involved in the RBP4-mediated up-regulation of PGC-1β transcription as a result of phosphorylation on Ser133. Furthermore, in vivo RBP4 infusion induced SREBP-1c activation and consequently accelerated hepatic lipogenesis and plasma TAG in C57BL/6J mice, a phenomenon not observed in Ppargc1b knockout mice."
23274901,PMC3609558,Sterol regulatory element-binding factor 2 (SREBF-2) predicts 7-year NAFLD incidence and severity of liver disease and lipoprotein and glucose dysmetabolism.,2012,Diabetes,10.2337/db12-0858,"['Giovanni Musso', 'Maurizio Cassader', 'Simona Bo', 'Franco De Michieli', 'Roberto Gambino']",[],"We prospectively assessed the impact of a sterol regulatory element-binding factor-2 (SREBF-2) polymorphism on the risk of developing nonalcoholic fatty liver disease (NAFLD) and on liver histology and lipoprotein and glucose metabolism in biopsy-proven NAFLD. In a population-based study, we followed 175 nonobese, nondiabetic participants without NAFLD or metabolic syndrome at baseline, characterized for the SREBF-2 rs133291 C/T polymorphism, dietary habits, physical activity, adipokines, C-reactive protein (CRP), and endothelial adhesion molecules. A comparable cohort of NAFLD patients underwent liver biopsy, an oral glucose tolerance test with minimal model analysis to yield glucose homeostasis parameters, and an oral fat tolerance test with measurement of plasma lipoproteins, adipokines, and cytokeratin-18 fragments. After 7 years, 27% of subjects developed NAFLD and 5% developed diabetes. SREBF-2 predicted incident NAFLD and diabetes and CRP and endothelial adhesion molecule changes. In biopsy-proven NAFLD patients, SREBF-2 predicted nonalcoholic steatohepatitis (odds ratio 2.92 [95% CI 2.08-4.18], P = 0.002) and the severity of tissue insulin resistance, β-cell dysfunction, and oral fat intolerance (characterized by higher postprandial lipemia, cholesterol enrichment of triglyceride-rich lipoproteins and oxidized LDLs, HDL cholesterol fall, adipokine imbalance, and postprandial apoptosis activation). An SREBF-2 polymorphism predisposes individuals to NAFLD and associated cardiometabolic abnormalities and affects liver histology and glucose and lipid metabolism in biopsy-proven NAFLD."
17580311,PMC1935003,RNA structure is a key regulatory element in pathological ATM and CFTR pseudoexon inclusion events.,2007,Nucleic Acids Res,10.1093/nar/gkm447,"['Emanuele Buratti', 'Ashish Dhir', 'Marzena A Lewandowska', 'Francisco E Baralle']",[],"Genomic variations deep in the intronic regions of pre-mRNA molecules are increasingly reported to affect splicing events. However, there is no general explanation why apparently similar variations may have either no effect on splicing or cause significant splicing alterations. In this work we have examined the structural architecture of pseudoexons previously described in ATM and CFTR patients. The ATM case derives from the deletion of a repressor element and is characterized by an aberrant 5'ss selection despite the presence of better alternatives. The CFTR pseudoexon instead derives from the creation of a new 5'ss that is used while a nearby pre-existing donor-like sequence is never selected. Our results indicate that RNA structure is a major splicing regulatory factor in both cases. Furthermore, manipulation of the original RNA structures can lead to pseudoexon inclusion following the exposure of unused 5'ss already present in their wild-type intronic sequences and prevented to be recognized because of their location in RNA stem structures. Our data show that intrinsic structural features of introns must be taken into account to understand the mechanism of pseudoexon activation in genetic diseases. Our observations may help to improve diagnostics prediction programmes and eventual therapeutic targeting."
15811325,,BLG-e1 - a novel regulatory element in the distal region of the beta-lactoglobulin gene promoter.,2005,FEBS Lett,10.1016/j.febslet.2005.02.061,"['Moshe Reichenstein', 'Tania German', 'Itamar Barash']",[],"beta-Lactoglobulin (BLG) is a major ruminant milk protein. A regulatory element, termed BLG-e1, was defined in the distal region of the ovine BLG gene promoter. This 299-bp element lacks the established cis-regulatory sequences that affect milk-protein gene expression. Nevertheless, it alters the binding of downstream BLG sequences to histone H4 and the sensitivity of the histone-DNA complexes to trichostatin A treatment. In mammary cells cultured under favorable lactogenic conditions, BLG-e1 acts as a potent, position-independent silencer of BLG/luciferase expression, and similarly affects the promoter activity of the mouse whey acidic protein gene. Intragenic sequences upstream of BLG exon 2 reverse the silencing effect of BLG-e1 in vitro and in transgenic mice."
28064319,,[Main regulatory element (MRE) of the Danio rerio α/β-globin gene domain exerts enhancer activity toward the promoters of the embryonic-larval and adult globin genes].,2016,Mol Biol (Mosk),10.7868/S0026898416060112,"['A P Kovina', 'N V Petrova', 'S V Razin', 'O V Yarovaia']","['Danio rerio', 'enhancer', 'globin genes', 'promoter']","In warm-blooded vertebrates, the α- and β-globin genes are organized in domains of different types and are regulated in different fashion. In cold-blooded vertebrates and, in particular, the tropical fish Danio rerio, the α- and β-globin genes form two gene clusters. A major D. rerio globin gene cluster is in chromosome 3 and includes the α- and β-globin genes of embryonic-larval and adult types. The region upstream of the cluster contains c16orf35, harbors the main regulatory element (MRE) of the α-globin gene domain in warm-blooded vertebrates. In this study, transient transfection of erythroid cells with genetic constructs containing a reporter gene under the control of potential regulatory elements of the domain was performed to characterize the promoters of the embryonic-larval and adult α- and β-globin genes of the major cluster. Also, in the 5th intron of c16orf35 in Danio reriowas detected a functional analog of the warm-blooded vertebrate MRE. This enhancer stimulated activity of the promoters of both adult and embryonic-larval α- and β-globin genes."
31553754,PMC6760803,CRISPR/Cas9-based editing of a sensitive transcriptional regulatory element to achieve cell type-specific knockdown of the NEMO scaffold protein.,2019,PLoS One,10.1371/journal.pone.0222588,"['Milad Babaei', 'Yuekun Liu', 'Shelly M Wuerzberger-Davis', 'Ethan Z McCaslin', 'Christopher J DiRusso', 'Alan T Yeo', 'Larisa Kagermazova', 'Shigeki Miyamoto', 'Thomas D Gilmore']",[],"The use of alternative promoters for the cell type-specific expression of a given mRNA/protein is a common cell strategy. NEMO is a scaffold protein required for canonical NF-κB signaling. Transcription of the NEMO gene is primarily controlled by two promoters: one (promoter B) drives NEMO transcription in most cell types and the second (promoter D) is largely responsible for NEMO transcription in liver cells. Herein, we have used a CRISPR/Cas9-based approach to disrupt a core sequence element of promoter B, and this genetic editing essentially eliminates expression of NEMO mRNA and protein in 293T human kidney cells. By cell subcloning, we have isolated targeted 293T cell lines that express no detectable NEMO protein, have defined genomic alterations at promoter B, and do not support activation of canonical NF-κB signaling in response to treatment with tumor necrosis factor. Nevertheless, non-canonical NF-κB signaling is intact in these NEMO-deficient cells. Expression of ectopic wild-type NEMO, but not certain human NEMO disease mutants, in the edited cells restores downstream NF-κB signaling in response to tumor necrosis factor. Targeting of the promoter B element does not substantially reduce NEMO expression (from promoter D) in the human SNU-423 liver cancer cell line. Thus, we have created a strategy for selectively eliminating cell type-specific expression from an alternative promoter and have generated 293T cell lines with a functional knockout of NEMO. The implications of these findings for further studies and for therapeutic approaches to target canonical NF-κB signaling are discussed."
26503353,,Complex patterns of cis-regulatory polymorphisms in ebony underlie standing pigmentation variation in Drosophila melanogaster.,2015,Mol Ecol,10.1111/mec.13432,"['Ryutaro Miyagi', 'Noriyoshi Akiyama', 'Naoki Osada', 'Aya Takahashi']","['allele-specific expression level', 'amplicon sequencing', 'cis-regulatory variation', 'linkage disequilibrium', 'melanin biosynthesis']","Pigmentation traits in adult Drosophila melanogaster were used in this study to investigate how phenotypic variations in continuous ecological traits can be maintained in a natural population. First, pigmentation variation in the adult female was measured at seven different body positions in 20 strains from the Drosophila melanogaster Genetic Reference Panel (DGRP) originating from a natural population in North Carolina. Next, to assess the contributions of cis-regulatory polymorphisms of the genes involved in the melanin biosynthesis pathway, allele-specific expression levels of four genes were quantified by amplicon sequencing using a 454 GS Junior. Among those genes, ebony was significantly associated with pigmentation intensity of the thoracic segment. Detailed sequence analysis of the gene regulatory regions of this gene indicated that many different functional cis-regulatory alleles are segregating in the population and that variations outside the core enhancer element could potentially play important roles in the regulation of gene expression. In addition, a slight enrichment of distantly associated SNP pairs was observed in the ~10 kb cis-regulatory region of ebony, which suggested the presence of interacting elements scattered across the region. In contrast, sequence analysis in the core cis-regulatory region of tan indicated that SNPs within the region are significantly associated with allele-specific expression level of this gene. Collectively, the data suggest that the underlying genetic differences in the cis-regulatory regions that control intraspecific pigmentation variation can be more complex than those of interspecific pigmentation trait differences, where causal genetic changes are typically confined to modular enhancer elements."
26599760,,β-Hydroxybutyrate Facilitates Fatty Acids Synthesis Mediated by Sterol Regulatory Element-Binding Protein1 in Bovine Mammary Epithelial Cells.,2015,Cell Physiol Biochem,10.1159/000438569,"['Min Zhang', 'Shiqi Zhang', 'Qi Hui', 'Lin Lei', 'Xiliang Du', 'Wenwen Gao', 'Renhe Zhang', 'Guowen Liu', 'Xiaobing Li', 'Xinwei Li']",[],"In dairy cows, β-hydroxybutyrate (BHBA) is utilized as precursors of de novo synthesized fatty acids in mammary gland. Ketotic cows are characterized by excessive negative energy balance (NEB), which can further increase the blood BHBA concentration. Sterol regulatory element-binding protein1 (SREBP1) and cell death-inducing DNA fragmentation factor-alpha-like effector α (Cidea) play crucial roles in lipid synthesis. Therefore, we hypothesized that BHBA could stimulate SREBP1/Cidea pathway to increase milk fat synthesis in bovine mammary epithelial cells."
30255815,PMC6156983,Rare variants in the splicing regulatory elements of EXOC3L4 are associated with brain glucose metabolism in Alzheimer's disease.,2018,BMC Med Genomics,10.1186/s12920-018-0390-6,"['Jason E Miller', 'Manu K Shivakumar', 'Younghee Lee', 'Seonggyun Han', 'Emrin Horgousluoglu', 'Shannon L Risacher', 'Andrew J Saykin', 'Kwangsik Nho', 'Dokyoon Kim']","['Alternative splicing', 'Alzheimer’s disease', 'Imaging genomics', 'Rare variants', 'Whole genome sequencing']","Alzheimer's disease (AD) is one of the most common neurodegenerative diseases that causes problems related to brain function. To some extent it is understood on a molecular level how AD arises, however there are a lack of biomarkers that can be used for early diagnosis. Two popular methods to identify AD-related biomarkers use genetics and neuroimaging. Genes and neuroimaging phenotypes have provided some insights as to the potential for AD biomarkers. While the field of imaging-genomics has identified genetic features associated with structural and functional neuroimaging phenotypes, it remains unclear how variants that affect splicing could be important for understanding the genetic etiology of AD."
21546605,,Sterol regulatory element-binding protein-1 determines plasma remnant lipoproteins and accelerates atherosclerosis in low-density lipoprotein receptor-deficient mice.,2011,Arterioscler Thromb Vasc Biol,10.1161/ATVBAHA.110.219659,"['Tadayoshi Karasawa', 'Akimitsu Takahashi', 'Ryo Saito', 'Motohiro Sekiya', 'Masaki Igarashi', 'Hitoshi Iwasaki', 'Shoko Miyahara', 'Saori Koyasu', 'Yoshimi Nakagawa', 'Kiyoaki Ishii', 'Takashi Matsuzaka', 'Kazuto Kobayashi', 'Naoya Yahagi', 'Kazuhiro Takekoshi', 'Hirohito Sone', 'Shigeru Yatoh', 'Hiroaki Suzuki', 'Nobuhiro Yamada', 'Hitoshi Shimano']",[],Sterol regulatory element-binding protein-1 (SREBP-1) is nutritionally regulated and is known to be a key transcription factor regulating lipogenic enzymes. The goal of this study was to evaluate the roles of SREBP-1 in dyslipidemia and atherosclerosis.
23791467,,Ancient cis-regulatory constraints and the evolution of genome architecture.,2013,Trends Genet,10.1016/j.tig.2013.05.008,"['Manuel Irimia', 'Ignacio Maeso', 'Scott W Roy', 'Hunter B Fraser']","['cis-regulatory element', 'genome evolution', 'synteny']","The order of genes along metazoan chromosomes has generally been thought to be largely random, with few implications for organismal function. However, two recent studies, reporting hundreds of pairs of genes that have remained linked in diverse metazoan species over hundreds of millions of years of evolution, suggest widespread functional implications for gene order. These associations appear to largely reflect cis-regulatory constraints, with either (i) multiple genes sharing transcriptional regulatory elements, or (ii) regulatory elements for a developmental gene being found within a neighboring 'bystander' gene (known as a genomic regulatory block). We discuss implications, questions raised, and new research directions arising from these studies, as well as evidence for similar phenomena in other eukaryotic groups. "
27888103,,Luteolin improves non-alcoholic fatty liver disease in db/db mice by inhibition of liver X receptor activation to down-regulate expression of sterol regulatory element binding protein 1c.,2016,Biochem Biophys Res Commun,10.1016/j.bbrc.2016.11.101,"['Ye Yin', 'Lu Gao', 'Haiyan Lin', 'Yue Wu', 'Xiao Han', 'Yunxia Zhu', 'Jie Li']","['Fatty acid', 'Liver X receptor', 'Luteolin', 'Non-alcoholic fatty liver disease', 'db/db mouse']","In this study, we report that daily administration of luteolin for 8 weeks improved hepatic steatosis by repressing hepatic TG accumulation and increasing glycogen storage. Luteolin inhibited hepatic de novo lipid synthesis by regulating the LXR-SREBP-1c signaling pathway, which is over-activated in the livers of db/db mice. Further in vitro studies revealed that luteolin can competitively bind to the ligand binding domain to suppress the LXR activation induced by an LXR agonist and high glucose, thereby decreasing TG accumulation in HepG2 cells and primary hepatocytes. Taken together, our results indicate that luteolin can abolish lipid accumulation induced by LXR-SREBP-1c activation both in vivo and in vitro, and may have potential as a therapeutic agent for treating NAFLD."
23542164,PMC5416757,Sterol regulatory element-binding proteins are regulators of the NIS gene in thyroid cells.,2013,Mol Endocrinol,10.1210/me.2012-1269,"['Robert Ringseis', 'Christine Rauer', 'Susanne Rothe', 'Denise K Gessner', 'Lisa-Marie Schütz', 'Sebastian Luci', 'Gaiping Wen', 'Klaus Eder']",[],"The uptake of iodide into the thyroid, an essential step in thyroid hormone synthesis, is an active process mediated by the sodium-iodide symporter (NIS). Despite its strong dependence on TSH, the master regulator of the thyroid, the NIS gene was also reported to be regulated by non-TSH signaling pathways. In the present study we provide evidence that the rat NIS gene is subject to regulation by sterol regulatory element-binding proteins (SREBPs), which were initially identified as master transcriptional regulators of lipid biosynthesis and uptake. Studies in FRTL-5 thyrocytes revealed that TSH stimulates expression and maturation of SREBPs and expression of classical SREBP target genes involved in lipid biosynthesis and uptake. Almost identical effects were observed when the cAMP agonist forskolin was used instead of TSH. In TSH receptor-deficient mice, in which TSH/cAMP-dependent gene regulation is blocked, the expression of SREBP isoforms in the thyroid was markedly reduced when compared with wild-type mice. Sterol-mediated inhibition of SREBP maturation and/or RNA interference-mediated knockdown of SREBPs reduced expression of NIS and NIS-specific iodide uptake in FRTL-5 cells. Conversely, overexpression of active SREBPs caused a strong activation of the 5'-flanking region of the rat NIS gene mediated by binding to a functional SREBP binding site located in the 5'-untranslated region of the rat NIS gene. These findings show that TSH acts as a regulator of SREBP expression and maturation in thyroid epithelial cells and that SREBPs are novel transcriptional regulators of NIS."
30201851,PMC6165315,A G-Quadruplex Structure in the Promoter Region of ,2018,Int J Mol Sci,10.3390/ijms19092678,"['Mu-Ching Huang', 'I-Te Chu', 'Zi-Fu Wang', 'Steven Lin', 'Ta-Chau Chang', 'Chin-Tin Chen']","['CRISPR/Cas9', 'G-quadruplex', 'promoter', 'transcriptional regulation']",The differential transcriptional expression of 
27058369,PMC4825978,A Hox Transcription Factor Collective Binds a Highly Conserved Distal-less cis-Regulatory Module to Generate Robust Transcriptional Outcomes.,2016,PLoS Genet,10.1371/journal.pgen.1005981,"['Juli D Uhl', 'Arya Zandvakili', 'Brian Gebelein']",[],"cis-regulatory modules (CRMs) generate precise expression patterns by integrating numerous transcription factors (TFs). Surprisingly, CRMs that control essential gene patterns can differ greatly in conservation, suggesting distinct constraints on TF binding sites. Here, we show that a highly conserved Distal-less regulatory element (DCRE) that controls gene expression in leg precursor cells recruits multiple Hox, Extradenticle (Exd) and Homothorax (Hth) complexes to mediate dual outputs: thoracic activation and abdominal repression. Using reporter assays, we found that abdominal repression is particularly robust, as neither individual binding site mutations nor a DNA binding deficient Hth protein abolished cooperative DNA binding and in vivo repression. Moreover, a re-engineered DCRE containing a distinct configuration of Hox, Exd, and Hth sites also mediated abdominal Hox repression. However, the re-engineered DCRE failed to perform additional segment-specific functions such as thoracic activation. These findings are consistent with two emerging concepts in gene regulation: First, the abdominal Hox/Exd/Hth factors utilize protein-protein and protein-DNA interactions to form repression complexes on flexible combinations of sites, consistent with the TF collective model of CRM organization. Second, the conserved DCRE mediates multiple cell-type specific outputs, consistent with recent findings that pleiotropic CRMs are associated with conserved TF binding and added evolutionary constraints. "
22408256,,Expression of ABO blood-group genes is dependent upon an erythroid cell-specific regulatory element that is deleted in persons with the B(m) phenotype.,2012,Blood,10.1182/blood-2011-10-387167,"['Rie Sano', 'Tamiko Nakajima', 'Keiko Takahashi', 'Rieko Kubo', 'Yoshihiko Kominato', 'Junichi Tsukada', 'Haruo Takeshita', 'Toshihiro Yasuda', 'Kazuto Ito', 'Takayuki Maruhashi', 'Akihiko Yokohama', 'Kazumi Isa', 'Kenichi Ogasawara', 'Makoto Uchikawa']",[],"The ABO blood group is of great importance in blood transfusion and organ transplantation. However, the mechanisms regulating human ABO gene expression remain obscure. On the basis of DNase I-hypersensitive sites in and upstream of ABO in K562 cells, in the present study, we prepared reporter plasmid constructs including these sites. Subsequent luciferase assays indicated a novel positive regulatory element in intron 1. This element was shown to enhance ABO promoter activity in an erythroid cell-specific manner. Electrophoretic mobility-shift assays demonstrated that it bound to the tissue-restricted transcription factor GATA-1. Mutation of the GATA motifs to abrogate binding of this factor reduced the regulatory activity of the element. Therefore, GATA-1 appears to be involved in the cell-specific activity of the element. Furthermore, we found that a partial deletion in intron 1 involving the element was associated with B(m) phenotypes. Therefore, it is plausible that deletion of the erythroid cell-specific regulatory element could down-regulate transcription in the B(m) allele, leading to reduction of B-antigen expression in cells of erythroid lineage, but not in mucus-secreting cells. These results support the contention that the enhancer-like element in intron 1 of ABO has a significant function in erythroid cells."
