PMID,PMCID,Title,Year,Journal,DOI,Authors,Keywords,Abstract
29706549,PMC5989727,Integrated Single-Cell Analysis Maps the Continuous Regulatory Landscape of Human Hematopoietic Differentiation.,2018,Cell,10.1016/j.cell.2018.03.074,"['Jason D Buenrostro', 'M Ryan Corces', 'Caleb A Lareau', 'Beijing Wu', 'Alicia N Schep', 'Martin J Aryee', 'Ravindra Majeti', 'Howard Y Chang', 'William J Greenleaf']","['chromatin accessibility', 'epigenomics', 'hematopoiesis', 'single cell']","Human hematopoiesis involves cellular differentiation of multipotent cells into progressively more lineage-restricted states. While the chromatin accessibility landscape of this process has been explored in defined populations, single-cell regulatory variation has been hidden by ensemble averaging. We collected single-cell chromatin accessibility profiles across 10 populations of immunophenotypically defined human hematopoietic cell types and constructed a chromatin accessibility landscape of human hematopoiesis to characterize differentiation trajectories. We find variation consistent with lineage bias toward different developmental branches in multipotent cell types. We observe heterogeneity within common myeloid progenitors (CMPs) and granulocyte-macrophage progenitors (GMPs) and develop a strategy to partition GMPs along their differentiation trajectory. Furthermore, we integrated single-cell RNA sequencing (scRNA-seq) data to associate transcription factors to chromatin accessibility changes and regulatory elements to target genes through correlations of expression and regulatory element accessibility. Overall, this work provides a framework for integrative exploration of complex regulatory dynamics in a primary human tissue at single-cell resolution."
16188218,,A transcriptional regulatory element screening system reveals a novel E2F1/pRb transcription regulation pathway.,2005,Anal Biochem,10.1016/j.ab.2005.08.021,"['Sachiyo Mimaki', 'Yuko Mori-Furukawa', 'Hikari Katsuno', 'Toshihiko Kishimoto']",[],"We developed a transcriptional regulatory element library which contains 160 independent known transcriptional regulatory elements linked to luciferase reporter vectors. That library proved valuable in the identification of p53 response elements and of E-box sequence preferences of several E-box binding proteins, and we used it to explore E2F1 target regulatory elements. Among those 160 elements, we found 3 E2F1 response elements, an E2F1 consensus sequence, an insulin response element which contained the E2F consensus sequence, and a basal level enhancer (BLE1) which had a nonconsensus E2F binding sequence. BLE1 functioned as multiple copy, with E2F1 in a dose-dependent manner, and had a sequence specificity for E2F1. Electrophoretic mobility shift assay revealed that BLE1 specifically interacts with E2F1 comparable to the E2F element. Interestingly, transactivation via five copies of BLE1 was not repressed but rather was stimulated by E2F1 in combination with the retinoblastoma tumor suppressor protein (pRb). The retinoblastoma control element (RCE) contains a direct repeated BLE1 in the c-fos gene promoter which also functioned like the multiple BLE1. Our data show that E2F1 has potential binding activity to the RCE and a different transcriptional regulation pathway which cooperates with pRb. Our transcriptional regulatory element screening system is useful for identifying novel transcriptional pathways."
32265924,PMC7099406,A Shared Regulatory Element Controls the Initiation of ,2020,Front Immunol,10.3389/fimmu.2020.00470,"['Christelle Harly', 'Devin Kenney', 'Yueqiang Wang', 'Yi Ding', 'Yongge Zhao', 'Parirokh Awasthi', 'Avinash Bhandoola']","['T cells', 'TCF-1', 'Tcf7', 'development', 'enhancer', 'innate lymphoid cells']",The transcription factor TCF-1 (encoded by 
25757625,PMC4524425,Efficient inversions and duplications of mammalian regulatory DNA elements and gene clusters by CRISPR/Cas9.,2015,J Mol Cell Biol,10.1093/jmcb/mjv016,"['Jinhuan Li', 'Jia Shou', 'Ya Guo', 'Yuanxiao Tang', 'Yonghu Wu', 'Zhilian Jia', 'Yanan Zhai', 'Zhifeng Chen', 'Quan Xu', 'Qiang Wu']","['CRISPR/Cas9', 'DNA regulatory element inversion', 'deletion', 'duplication', 'enhancer', 'gene cluster', 'genome manipulation']","The human genome contains millions of DNA regulatory elements and a large number of gene clusters, most of which have not been tested experimentally. The clustered regularly interspaced short palindromic repeats (CRISPR)/CRISPR-associated nuclease 9 (Cas9) programed with a synthetic single-guide RNA (sgRNA) emerges as a method for genome editing in virtually any organisms. Here we report that targeted DNA fragment inversions and duplications could easily be achieved in human and mouse genomes by CRISPR with two sgRNAs. Specifically, we found that, in cultured human cells and mice, efficient precise inversions of DNA fragments ranging in size from a few tens of bp to hundreds of kb could be generated. In addition, DNA fragment duplications and deletions could also be generated by CRISPR through trans-allelic recombination between the Cas9-induced double-strand breaks (DSBs) on two homologous chromosomes (chromatids). Moreover, junctions of combinatorial inversions and duplications of the protocadherin (Pcdh) gene clusters induced by Cas9 with four sgRNAs could be detected. In mice, we obtained founders with alleles of precise inversions, duplications, and deletions of DNA fragments of variable sizes by CRISPR. Interestingly, we found that very efficient inversions were mediated by microhomology-mediated end joining (MMEJ) through short inverted repeats. We showed for the first time that DNA fragment inversions could be transmitted through germlines in mice. Finally, we applied this CRISPR method to a regulatory element of the Pcdhα cluster and found a new role in the regulation of members of the Pcdhγ cluster. This simple and efficient method should be useful in manipulating mammalian genomes to study millions of regulatory DNA elements as well as vast numbers of gene clusters. "
29556313,PMC5844001,Sterol regulatory element-binding protein 1 cooperates with c-Myc to promote epithelial-mesenchymal transition in colorectal cancer.,2018,Oncol Lett,10.3892/ol.2018.8058,"['Duanyang Zhai', 'Chunhui Cui', 'Lang Xie', 'Lianxu Cai', 'Jinlong Yu']","['SNAIL', 'c-Myc', 'colorectal cancer', 'epithelial-mesenchymal transition', 'sterol regulatory element-binding protein 1']","Metastasis is the primary cause of mortality in colorectal cancer (CRC), the mechanism of which remains unclear. In the present study, by detecting mRNA expression using a reverse transcription-quantitative polymerase chain reaction (qPCR), it was revealed that sterol regulatory element-binding protein 1 (SREBP1) is highly expressed in CRC. Using a cell wound healing assay and a cell invasion assay, a novel metastasis-promoting role for SREBP1 in CRC was identified. Furthermore, snail family transcriptional repressor 1 (SNAIL) was identified as a key downstream effector of SREBP1 in CRC by the use of small interfering RNA against SNAIL. Additionally, using co-immunoprecipitation and chromatin immunoprecipitation-qPCR assays, it was demonstrated that SREBP1 interacts with c-MYC to enhance the binding of c-MYC to the promoter of the mesenchymal gene, SNAIL, thereby increasing SNAIL expression and accelerating epithelial-mesenchymal transition. These results indicated a novel role for SREBP1 and provide insight into the regulatory mechanisms of the c-Myc oncogene in CRC, which may function as a potential therapeutic target for CRC treatment."
32948616,,Whole-genome analysis of noncoding genetic variations identifies multi-scale regulatory element perturbations associated with Hirschsprung disease.,2020,Genome Res,10.1101/gr.264473.120,"['Alexander Xi Fu', 'Kathy Nga-Chu Lui', 'Clara Sze-Man Tang', 'Ray Kit Ng', 'Frank Pui-Ling Lai', 'Sin-Ting Lau', 'Zhixin Li', 'Maria-Merce Gracia-Barcelo', 'Pak Sham', 'Paul Kwong-Hang Tam', 'Elly Sau-Wai Ngan', 'Kevin Y Yip']",[],"It is widely recognized that noncoding genetic variants play important roles in many human diseases, but there are multiple challenges that hinder the identification of functional disease-associated noncoding variants. The number of noncoding variants can be many times of coding variants; many of them are not functional but in linkage disequilibrium with the functional ones; different variants can have epistatic effects; different variants can affect the same genes or pathways in different individuals; and some variants are related to each other not by affecting the same gene but by affecting the binding of the same upstream regulator. To overcome these difficulties, we propose a novel analysis framework that considers convergent impacts of different genetic variants on protein binding, which provides multi-scale information about disease-associated perturbations of regulatory elements, genes, and pathways. Applying it to our whole-genome sequencing data of 918 short-segment Hirschsprung disease patients and matched controls, we identify various novel genes not detected by standard single-variant and region-based tests, functionally centering on neural crest migration and development. Our framework also identifies upstream regulators whose binding is influenced by the noncoding variants. Using human neural crest cells, we confirm cell-stage-specific regulatory roles of three top novel regulatory elements on our list, respectively in the "
27174439,,Massive contribution of transposable elements to mammalian regulatory sequences.,2016,Semin Cell Dev Biol,10.1016/j.semcdb.2016.05.004,"['Nirmala Arul Rayan', 'Ricardo C H Del Rosario', 'Shyam Prabhakar']","['Primate-specific', 'Regulatory elements', 'Transposable element functionalization', 'Transposons']","Barbara McClintock discovered the existence of transposable elements (TEs) in the late 1940s and initially proposed that they contributed to the gene regulatory program of higher organisms. This controversial idea gained acceptance only much later in the 1990s, when the first examples of TE-derived promoter sequences were uncovered. It is now known that half of the human genome is recognizably derived from TEs. It is thus important to understand the scope and nature of their contribution to gene regulation. Here, we provide a timeline of major discoveries in this area and discuss how transposons have revolutionized our understanding of mammalian genomes, with a special emphasis on the massive contribution of TEs to primate evolution. Our analysis of primate-specific functional elements supports a simple model for the rate at which new functional elements arise in unique and TE-derived DNA. Finally, we discuss some of the challenges and unresolved questions in the field, which need to be addressed in order to fully characterize the impact of TEs on gene regulation, evolution and disease processes."
26675057,PMC4682146,Predicting the impact of promoter variability on regulatory outputs.,2015,Sci Rep,10.1038/srep18238,"['Naomi N Kreamer', 'Rob Phillips', 'Dianne K Newman', 'James Q Boedicker']",[],"The increased availability of whole genome sequences calls for quantitative models of global gene expression, yet predicting gene expression patterns directly from genome sequence remains a challenge. We examine the contributions of an individual regulator, the ferrous iron-responsive regulatory element, BqsR, on global patterns of gene expression in Pseudomonas aeruginosa. The position weight matrix (PWM) derived for BqsR uncovered hundreds of likely binding sites throughout the genome. Only a subset of these potential binding sites had a regulatory consequence, suggesting that BqsR/DNA interactions were not captured within the PWM or that the broader regulatory context at each promoter played a greater role in setting promoter outputs. The architecture of the BqsR operator was systematically varied to understand how binding site parameters influence expression. We found that BqsR operator affinity was predicted by the PWM well. At many promoters the surrounding regulatory context, including overlapping operators of BqsR or the presence of RhlR binding sites, were influential in setting promoter outputs. These results indicate more comprehensive models that include local regulatory contexts are needed to develop a predictive understanding of global regulatory outputs. "
21094755,,Short communication: Identification of the bovine sterol regulatory element binding protein-1c promoter and its activation by liver X receptor.,2011,J Dairy Sci,10.3168/jds.2010-3236,"['A J Lengi', 'B A Corl']",[],"Sterol regulatory element binding proteins (SREBP) are a family of transcription factors that regulate cholesterogenesis and lipogenesis. Sterol regulatory element binding proteins-1a and -1c are transcribed from the same gene by the use of alternate promoters, and only differ at their first exon. Sterol regulatory element binding protein-1c is hypothesized to be an important regulator of genes involved in milk fat synthesis in the lactating dairy cow. However, the bovine SREBP-1c promoter has not been previously characterized, and studies to date that have investigated the role of SREBP-1 in the bovine mammary gland have not distinguished between isoforms 1a and 1c. The purpose of this study was to characterize the bovine SREBP-1c promoter and to investigate the DNA elements involved in the regulation of SREBP-1c expression by the liver X receptor agonist T0901317 in 2 different bovine mammary epithelial cell lines. Luciferase reporter constructs containing the wild-type SREBP-1c promoter or constructs with mutated liver X receptor response elements or sterol response element were transfected into MacT cells and bovine mammary epithelial (BME-UV) cells. We have demonstrated that the liver X receptor response elements sites in the SREBP-1c promoter are necessary for mediating the T0901317 response, and that stimulation through the sterol response element site plays only a minor role in this pathway. This report describes the bovine SREBP-1c promoter and its regulation by liver X receptor in bovine mammary epithelial cells."
22742899,,Carbenoxolone prevents the development of fatty liver in C57BL/6-Lep ob/ob mice via the inhibition of sterol regulatory element binding protein-1c activity and apoptosis.,2012,Eur J Pharmacol,10.1016/j.ejphar.2012.06.021,"['Sang Dal Rhee', 'Chi-Hyun Kim', 'Ji Seon Park', 'Won Hoon Jung', 'Sung Bum Park', 'Hee Youn Kim', 'Gyu Hwan Bae', 'Ta Jan Kim', 'Ki Young Kim']",[],"Carbenoxolone is the 3-hemisuccinate of glycyrrhetinic acid, the active principal of licorice (Glycyrrhiza glabra). It was reported that carbenoxolone improved glucose tolerance with increased insulin sensitivity in mice with high fat diet-induced obesity. In the present study, we elucidated the protective effect of carbenoxolone in fatty liver animal models of C57BL/6-Lep(ob/ob) mice through inhibition of hepatic lipogenesis and apoptosis. In addition, the potential mechanisms by which carbenoxolone could exert such protection were elucidated. Carbenoxolone was daily administrated by gavage for 28 days in C57BL/6 and C57BL/6-Lep(ob/ob) mice. Carbenoxolone prevented the plasma triglyceride and free fatty acid accumulation associated with the reduction of the expression of sterol regulatory element binding protein-1c, liver X receptor, fatty acid synthase and acethyl-CoA carboxylase in the livers of C57BL/6-Lep(ob/ob) mice. Carbenoxolone also prevented hepatic injury through anti-apoptotic action in the livers of C57BL/6-Lep(ob/ob) mice, accompanied by increased Bcl-2 expression and suppressed Bax and cytochrome c expression. As a mechanism, increased inflammatory cytokine expressions were inhibited by carbenoxolone in the fatty livers of C57BL/6-Lep(ob/ob) mice. Furthermore, carbenoxolone inhibited free fatty acid (oleate/palmitate) induced reactive oxygen species formation and reversed free fatty acid induced mitochondrial membrane depolarization in HepG2 cells. Carbenoxolone prevents the development of fatty liver by inhibiting sterol regulatory element binding protein-1c expression and activity with an anti-apoptotic mechanism via the inhibition of inflammatory cytokine and reactive oxygen species formation in the livers of C57BL/6-Lep(ob/ob) mice. It is suggested that carbenoxolone prevents the development and progression of fatty liver disease in patients with insulin resistance."
24362725,,Role for sterol regulatory element binding protein-1c activation in mediating skeletal muscle insulin resistance via repression of rat insulin receptor substrate-1 transcription.,2013,Diabetologia,10.1007/s00125-013-3136-1,"['Yan Bi', 'Wenjun Wu', 'Junfeng Shi', 'Hua Liang', 'Wenwen Yin', 'Yingying Chen', 'Sunyinyan Tang', 'Shu Cao', 'Mengyin Cai', 'Shanmei Shen', 'Qian Gao', 'Jianping Weng', 'Dalong Zhu']",[],"Sterol regulatory element binding protein-1c (SREBP-1c) is a master regulator of fatty acid synthase and controls lipogenesis. IRS-1 is the key insulin signalling mediator in skeletal muscle. In the present study, we investigated the role of SREBP-1c in the regulation of IRS-1 in skeletal muscle cells."
24789999,,Ginsenoside F2 reduces hair loss by controlling apoptosis through the sterol regulatory element-binding protein cleavage activating protein and transforming growth factor-β pathways in a dihydrotestosterone-induced mouse model.,2015,Biol Pharm Bull,10.1248/bpb.b13-00771,"['Heon-Sub Shin', 'Sang-Yong Park', 'Eun-Son Hwang', 'Don-Gil Lee', 'Gafurjon Turdalievich Mavlonov', 'Tae-Hoo Yi']",[],"This study was conducted to test whether ginsenoside F2 can reduce hair loss by influencing sterol regulatory element-binding protein (SREBP) cleavage-activating protein (SCAP) and the transforming growth factor beta (TGF-β) pathway of apoptosis in dihydrotestosterone (DHT)-treated hair cells and in a DHT-induced hair loss model in mice. Results for ginsenoside F2 were compared with finasteride. DHT inhibits proliferation of hair cells and induces androgenetic alopecia and was shown to activate an apoptosis signal pathway both in vitro and in vivo. The cell-based 3-(4,5-dimethylthiazol-2-yl)-2,5-diphenyltetrazolium bromide (MTT) assay showed that the proliferation rates of DHT-treated human hair dermal papilla cells (HHDPCs) and HaCaTs increased by 48% in the ginsenoside F2-treated group and by 12% in the finasteride-treated group. Western blot analysis showed that ginsenoside F2 decreased expression of TGF-β2 related factors involved in hair loss. The present study suggested a hair loss related pathway by changing SCAP related apoptosis pathway, which has been known to control cholesterol metabolism. SCAP, sterol regulatory element-binding protein (SREBP) and caspase-12 expression in the ginsenoside F2-treated group were decreased compared to the DHT and finasteride-treated group. C57BL/6 mice were also prepared by injection with DHT and then treated with ginsenoside F2 or finasteride. Hair growth rate, density, thickness measurements and tissue histotological analysis in these groups suggested that ginsenoside F2 suppressed hair cell apoptosis and premature entry to catagen more effectively than finasteride. Our results indicated that ginsenoside F2 decreased the expression of TGF-β2 and SCAP proteins, which have been suggested to be involved in apoptosis and entry into catagen. This study provides evidence those factors in the SCAP pathway could be targets for hair loss prevention drugs. "
25624274,PMC4382006,From trans to cis: transcriptional regulatory networks in neocortical development.,2015,Trends Genet,10.1016/j.tig.2014.12.004,"['Mikihito Shibata', 'Forrest O Gulden', 'Nenad Sestan']","['chromatin', 'cis-regulatory element', 'disease', 'epigenetics', 'gene expression', 'neuron', 'transcription factor']","Transcriptional mechanisms mediated by the binding of transcription factors (TFs) to cis-acting regulatory elements (CREs) in DNA play crucial roles in directing gene expression. While TFs have been extensively studied, less effort has gone towards the identification and functional characterization of CREs and associated epigenetic modulation. However, owing to methodological and analytical advances, more comprehensive studies of regulatory elements and mechanisms are now possible. We summarize recent progress in integrative analyses of these regulatory components in the development of the cerebral neocortex, the part of the brain involved in cognition and complex behavior. These studies are uncovering not only the underlying transcriptional regulatory networks, but also how these networks are altered across species and in neurological and psychiatric disorders. "
26117181,,The upstream regulatory sequence of the light harvesting complex Lhcf2 gene of the marine diatom Phaeodactylum tricornutum enhances transcription in an orientation- and distance-independent fashion.,2015,Mar Genomics,10.1016/j.margen.2015.06.010,"['Monia Teresa Russo', 'Rossella Annunziata', 'Remo Sanges', 'Maria Immacolata Ferrante', 'Angela Falciatore']","['Diatoms', 'Enhancer', 'Gene expression', 'Promoter', 'Regulatory element']","Diatoms are a key phytoplankton group in the contemporary ocean, showing extraordinary adaptation capacities to rapidly changing environments. The recent availability of whole genome sequences from representative species has revealed distinct features in their genomes, like novel combinations of genes encoding distinct metabolisms and a significant number of diatom-specific genes. However, the regulatory mechanisms driving diatom gene expression are still largely uncharacterized. Considering the wide variety of fields of study orbiting diatoms, ranging from ecology, evolutionary biology to biotechnology, it is thus essential to increase our understanding of fundamental gene regulatory processes such as transcriptional regulation. To this aim, we explored the functional properties of the 5'-flanking region of the Phaeodatylum tricornutum Lhcf2 gene, encoding a member of the Light Harvesting Complex superfamily and we showed that this region enhances transcription of a GUS reporter gene in an orientation- and distance-independent fashion. This represents the first example of a cis-regulatory sequence with enhancer-like features discovered in diatoms and it is instrumental for the generation of novel genetic tools and diatom exploitation in different areas of study. "
18021318,PMC3823491,Mef2c is an essential regulatory element required for unique expression of the cardiac-specific CARK gene.,2007,J Cell Mol Med,10.1111/j.1582-4934.2007.00155.x,"['Hu Wang', 'Chen Chen', 'Xiaodong Song', 'Jingzhou Chen', 'Yisong Zhen', 'Kai Sun', 'Rutai Hui']",[],"The cardiac ankyrin repeat kinase (CARK) gene, also named TNNI3K for its interaction with cardiac troponin I, is both a unique expression and heart-enriched gene. To understand the mechanisms of CARK gene expression and regulation, we first cloned the full-length mRNA sequence and mapped the transcription start site of the mouse CARK gene and characterized its promoter regions. Two transcriptional isoforms of the CARK gene were identified in mouse heart tissue. Truncation analysis of the CARK promoter identified a minimal 151 bp region that has strong basal transcription activity. Mutational analysis revealed five conserved cis-acting elements in this 151-bp long minimal promoter. Mutational and loss-of-functional analysis and co-transfection studies indicated that MEF2 binding region is the most critical cis-acting element in the CARK promoter, and CARK transcription level can be down-regulated by MEF2C antisense. Binding to the MEF2 sites by Mef2c protein was confirmed by electrophoretic mobility shift assay and competition and supershift electrophoretic mobility shift assays."
25436591,,New insights into the activation of sterol regulatory element-binding proteins by proteolytic processing.,2015,Biomol Concepts,10.1515/bmc-2013-0009,"['Jun Inoue', 'Ryuichiro Sato']",[],"Abstract Sterol regulatory element-binding proteins (SREBPs) are transcription factors that regulate a wide variety of genes involved in cholesterol and fatty acid synthesis. After transcription, SREBPs are controlled at multiple post-transcriptional levels, including proteolytic processing and post-translational modification. Among these, proteolytic processing is a crucial regulatory step that activates SREBPs, which are synthesized as inactive endoplasmic reticulum membrane proteins. In this review, we focus on recent progress with regard to signaling pathways and small molecules that affect activation of SREBPs by proteolytic processing. "
