PMID,PMCID,Title,Year,Journal,DOI,Authors,Keywords,Abstract
32803097,PMC7417000,Adrenal Corticomedullary Mixed Tumor Associated With the ,2020,J Endocr Soc,10.1210/jendso/bvaa101,"['Maki Kanzawa', 'Hidenori Fukuoka', 'Akane Yamamoto', 'Kentaro Suda', 'Katsumi Shigemura', 'Shigeo Hara', 'Naoko Imagawa', 'Ryuko Tsukamoto', 'Yayoi Aoyama', 'Yasuhiro Nakamura', 'Masato Fujisawa', 'Wataru Ogawa', 'Yutaka Takahashi', 'Tomoo Itoh']","['FGFR4-G388R variant', 'adrenal gland', 'corticomedullary mixed tumor']","Adrenal corticomedullary mixed tumors (CMMTs) are extremely rare; with only 20 cases being reported to date, the pathogenesis has remained elusive. A 31-year-old woman developed gestational hypertension with psychiatric disturbances persistent to postpartum and was diagnosed with pheochromocytoma, for which adrenalectomy was performed. Histological findings showed mixed adrenocortical adenoma and pheochromocytoma. Double immunostaining of inhibin and INSM1 (insulinoma-associated protein 1) showed that the 2 tumor components had distinct functional properties. Exome analysis of peripheral leukocytes and tumor (singular, as anatomically it is only 1 mass) revealed a homozygous germline "
32793144,PMC7393768,Molecular Characterization of an IncFII,2020,Front Microbiol,10.3389/fmicb.2020.01610,"['Hong Yao', 'Jing Cheng', 'Aijuan Li', 'Runhao Yu', 'Wenbo Zhao', 'Shangshang Qin', 'Xiang-Dang Du']","['IncFIIk plasmid', 'Klebsiella pneumoniae', 'blaIMP–26', 'carbapenems', 'resistance', 'tet(A) variant', 'tigecycline']","Carbapenems and tigecycline are two important classes of antimicrobial agents to treat the infections caused by Enterobacterales. Here, we reported a plasmid carrying both "
32680472,PMC7367331,A novel G6PD deleterious variant identified in three families with severe glucose-6-phosphate dehydrogenase deficiency.,2020,BMC Med Genet,10.1186/s12881-020-01090-2,"['Yongqing Tong', 'Bei Liu', 'Hongyun Zheng', 'Anyu Bao', 'Zegang Wu', 'Jian Gu', 'Bi-Hua Tan', 'Mary McGrath', 'Shriya Kane', 'Chunhua Song', 'Yan Li']","['D-G6PD', 'Infant', 'Neonatal jaundice', 'Variant']","Glucose-6-phosphate dehydrogenase deficiency (D-G6PD) is an X-linked recessive disorder resulted from deleterious variants in the housekeeping gene Glucose-6-phosphate 1-dehydrogenase (G6PD), causing impaired response to oxidizing agents. Screening for new variations of the gene helps with early diagnosis of D-G6PD resulting in a reduction of disease related complications and ultimately increased life expectancy of the patients."
32071838,PMC7012738,An ancestral variant causing type I xanthinuria in Turkmen and Arab families is predicted to prevail in the Afro-Asian stone-forming belt.,2019,JIMD Rep,10.1002/jmd2.12077,"['Hava Peretz', 'Michael Korostishevsky', 'David M Steinberg', 'Mustafa Kabha', 'Sali Usher', 'Irit Krause', 'Hannah Shalev', 'Daniel Landau', 'David Levartovsky']","['Afro‐Asian stone‐forming belt', 'Arabs', 'Turkmens', 'XDH gene', 'ancestral mutation', 'genealogical history', 'time to most recent common ancestor', 'xanthinuria']",Classical xanthinuria is a rare autosomal recessive metabolic disorder characterized by lack of xanthine dehydrogenase activity that often manifests as xanthine urolithiasis and risk of drug toxicity. Variants in the 
31709488,PMC6911126,A rare frameshift variant in trans with the IVS9-5T allele of CFTR in a Chinese pedigree with congenital aplasia of vas deferens.,2019,J Assist Reprod Genet,10.1007/s10815-019-01617-4,"['Bin Ge', 'Mingzhe Zhang', 'Ruyi Wang', 'Dejing Wang', 'Tengyan Li', 'Hongjun Li', 'Binbin Wang']","['CBAVD', 'CFTR', 'Chinese pedigree', 'Compound heterozygous']","Congenital aplasia of vas deferens (CAVD) is an atypical form of cystic fibrosis (CF) and causes obstructive azoospermia and male infertility. Compound heterozygous variants of CFTR are the main cause of CAVD. However, most evidence comes from genetic screening of sporadic cases and little is from pedigree analysis. In this study, we performed analysis in a Chinese pedigree with two CAVD patients in order to determine the genetic cause of this familial disorder."
30009426,,A PRRT2 variant in a Chinese family with paroxysmal kinesigenic dyskinesia and benign familial infantile seizures results in loss of interaction with STX1B.,2018,Epilepsia,10.1111/epi.14511,"['Hongying Ma', 'Shenglei Feng', 'Xuejun Deng', 'Li Wang', 'Sheng Zeng', 'Cheng Wang', 'Xixiang Ma', 'Hao Sun', 'Rui Chen', 'Shiyue Du', 'Jinglin Mao', 'Xianwei Zhang', 'Cong Ma', 'Hong Jiang', 'Luoying Zhang', 'Beisha Tang', 'Jing Yu Liu']","['\nPRRT2\n', 'benign familial infantile seizures', 'helix-loop-helix domain', 'paroxysmal kinesigenic dyskinesia', 'syntaxin 1B']",To identify the causative gene of autosomal dominant paroxysmal kinesigenic dyskinesia and benign familial infantile seizures (PKD/BFIS) in a large Chinese family and explore the potential pathogenic mechanism of a PRRT2 (proline-rich transmembrane protein 2) variant.
31852128,PMC6922386,A traditional Chinese patent medicine-Suhuang zhike capsule for cough variant asthma in adults: A protocol of systematic review and meta-analysis of randomized controlled trials.,2019,Medicine (Baltimore),10.1097/MD.0000000000018335,"['Jianxin Wang', 'Rui Sun', 'Ruiyin Wang', 'Jing Han', 'Shuhua Zhang', 'Zetao Yin', 'Zelu Han', 'Ying Nong', 'Jiangtao Lin']",[],Many people with cough variant asthma use Traditional Chinese Patent Medicine-Suhuang anti-tussive capsule to help reduce symptoms. However there is no systematic reviews had promising its efficacy and safety for cough variant asthma.
30339478,PMC6284562,Charge variant native mass spectrometry benefits mass precision and dynamic range of monoclonal antibody intact mass analysis.,2018,MAbs,10.1080/19420862.2018.1521131,"['Aaron O Bailey', 'Guanghui Han', 'Wilson Phung', 'Paul Gazis', 'Jennifer Sutton', 'Jonathan L Josephs', 'Wendy Sandoval']","['Orbitrap', 'charge variant', 'charge variant mass spectrometry', 'deamidation', 'high resolution', 'intact mass', 'ion exchange', 'native mass spectrometry', 'weak cation exchange']","The preponderance and diversity of charge variants in therapeutic monoclonal antibodies has implications for antibody efficacy and degradation. Understanding the extent and impact of minor antibody variants is of great interest, and it is also a critical regulatory requirement. Traditionally, a combination of approaches is used to characterize antibody charge heterogeneity, including ion exchange chromatography and independent mass spectrometric variant site mapping after proteolytic digestion. Here, we describe charge variant native mass spectrometry (CVMS), an integrated native ion exchange mass spectrometry-based charge variant analytical approach that delivers detailed molecular information in a single, semi-automated analysis. We utilized pure volatile salt mobile phases over a pH gradient that effectively separated variants based on minimal differences in isoelectric point. Characterization of variants such as deamidation, which are traditionally unattainable by intact mass due to their minimal molecular weight differences, were measured unambiguously by mass and retention time to allow confident MS1 identification. We demonstrate that efficient chromatographic separation allows introduction of the purified forms of the charge variant isoforms into the Orbitrap mass spectrometer. Our CVMS method allows confident assignment of intact monoclonal antibody isoforms of similar mass and relative abundance measurements across three orders of magnitude dynamic range."
28839198,PMC5571206,The effect of the TM6SF2 E167K variant on liver steatosis and fibrosis in patients with chronic hepatitis C: a meta-analysis.,2017,Sci Rep,10.1038/s41598-017-09548-9,"['Zhengtao Liu', 'Shuping Que', 'Lin Zhou', 'Shusen Zheng', 'Stefano Romeo', 'Adil Mardinoglu', 'Luca Valenti']",[],"The impact of Transmembrane 6 superfamily member 2 (TM6SF2) E167K variant, which causes hepatocellular fat retention by altering lipoprotein secretion, on liver damage and metabolic traits in chronic hepatitis C patients is still debated. We performed a systematic review and meta-analysis to clarify this relationship. Four studies with a total of 4325 patients were included. The risk of histologically-determined advanced steatosis, fibrosis, and cirrhosis (but not of severe inflammation) were increased in carriers of the TM6SF2 variant (P < 0.05). Unlike the inconsistent association with steatosis severity, due to the confounding effect of infection by the genotype-3 hepatitis C virus, the TM6SF2 variant was robustly associated with advanced fibrosis (OR = 1.07; 95% confidence interval [CI] = 1.01-1.14) and in particular with cirrhosis (OR = 2.05; 95% CI = 1.39-3.02). Regarding metabolic features, individuals positive for the TM6SF2 variant exhibited 5.8-12.0% lower levels of circulating triglycerides and non-HDL cholesterol (P < 0.05). Carriers of the variant were leaner, but there was high heterogeneity across studies (I"
30105462,,Substantial evidence for the clinical significance of missense variant BRCA1 c.5309G>T p.(Gly1770Val).,2018,Breast Cancer Res Treat,10.1007/s10549-018-4903-y,"['Emma Tudini', 'Setareh Moghadasi', 'Michael T Parsons', 'Lizet van der Kolk', 'Ans M W van den Ouweland', 'Dieter Niederacher', 'Lídia Feliubadaló', 'Barbara Wappenschmidt', 'Amanda B Spurdle', 'Conxi Lazaro']","['BRCA1', 'Breast and ovarian cancer', 'Evolutionary conservation', 'Multifactorial likelihood analysis', 'Variant classification']","Classification of rare BRCA1 missense variants presents a major challenge for the counseling and treatment of patients. Variant classification can be complicated by conflicting lines of evidence. BRCA1 c.5309G>T p.(Gly1770Val) has been shown to abrogate BRCA1 protein homologous DNA repair; however, multiple sequence alignment demonstrates a lack of sequence conservation at this position, suggesting that glycine at position 1770 may not be essential for cellular maintenance in humans. We analyzed clinical information to resolve the classification of BRCA1 c.5309G>T p.(Gly1770Val)."
29493581,PMC6119537,ClinGen's RASopathy Expert Panel consensus methods for variant interpretation.,2018,Genet Med,10.1038/gim.2018.3,"['Bruce D Gelb', 'Hélène Cavé', 'Mitchell W Dillon', 'Karen W Gripp', 'Jennifer A Lee', 'Heather Mason-Suares', 'Katherine A Rauen', 'Bradley Williams', 'Martin Zenker', 'Lisa M Vincent']","['ClinGen', 'Noonan', 'RASopathy', 'Ras/MAPK', 'variant interpretation']","Standardized and accurate variant assessment is essential for effective medical care. To that end, Clinical Genome (ClinGen) Resource clinical domain working groups (CDWGs) are systematically reviewing disease-associated genes for sufficient evidence to support disease causality and creating disease-specific specifications of American College of Medical Genetics and Genomics-Association for Molecular Pathology (ACMG-AMP) guidelines for consistent and accurate variant classification."
32539319,,Two subsequent metachroneus solid tumors: Oncocytic variant adrenocortical carcinoma and rhabdomyosarcoma of childhood: Case report and Literature Review.,2020,J Clin Res Pediatr Endocrinol,10.4274/jcrpe.galenos.2020.2020.0060,"['Onur Akin', 'Erman Atas', 'İrem Ayşe Atasoy', 'Nihal Durmaz', 'Ömer Kartal']","['Child', 'TP53', 'adrenocortical carcinoma', 'oncocytic variant', 'rhabdomyosarcoma']","Most cases of malignancies appear to be sporadic, but some syndromes are associated with malignancies with germline variants. Herein, a child with an unusual association of oncocytic variant adrenocortical carcinoma (ACC) and rhabdomyosarcoma was presented. An 18-month-old-boy was admitted with virilization of the genital area, penis enlargement, and erection which had begun six months ago. Serum total testosterone: 457 ng/dl (<10), androstenedione: 3.35ng/ml (<0.5) and DHEA-SO4: 206 mcg/dl (<35) were measured higher than normal ranges. Right adrenal mass was detected. After adrenalectomy, histopathological examination revealed oncocytic variant ACC. Three-month later from surgery, the child then presented with 6x8 cm sized swelling of the left leg. Histopathological examination revealed embryonal RMS. Testing for tumour protein (TP53) variant by DNA sequence analysis was positive; however; FISH analysis was negative. After chemotherapy and local radiotherapy, the patient is in good condition without tumour recurrence. Only about one-third of these tumours have a variant of TP53. This status also applies to other genetic variants related to cancer. However, a significant association of malignancies strongly suggests a problem in tumour suppressor genes or new variants. Another suppressor gene that is yet unidentified can also be present and effective in this locus. The occurrence of ACC as a part of a syndrome and positive family history of malignancies in patients are clinically important. These patients and their families should be scanned for genetic abnormalities. The patient with ACC should be followed-up carefully for other tumours to detect malignancy early."
32388819,,Functional characterization of a low-frequency V1937I variant in FASN associated with susceptibility to esophageal squamous cell carcinoma.,2020,Arch Toxicol,10.1007/s00204-020-02738-x,"['Xiaoyang Wang', 'Jianbo Tian', 'Qianyu Zhao', 'Nan Yang', 'Pingting Ying', 'Xiating Peng', 'Danyi Zou', 'Ying Zhu', 'Rong Zhong', 'Ying Gao', 'Jiang Chang', 'Xiaoping Miao']","['Esophageal squamous cell carcinoma', 'FASN', 'Low-frequency variant', 'Palmitate']","Metabolic reprogramming has been regarded as one of the core hallmarks of cancer and increased de novo fatty acid synthesis has been documented in multiple tumors including esophageal squamous cell carcinoma (ESCC). Our previous exome-wide analyses found a Val1937Ile variant (rs17848945) in the 34th exon of fatty acid synthase (FASN) that showed a strong association with the risk of ESCC. In this study, we performed a series of functional assays to investigate the biological functions underlying this variant in the development of ESCC. We demonstrated that FASN was upregulated in ESCC and both knockdown and knockout of FASN significantly inhibited ESCC cell proliferation, suggesting a tumor promoter role for this gene in ESCC. Furthermore, the results showed that overexpression of FASN[I] in the ESCC cells substantially enhanced cell proliferation, compared with overexpression of FASN[V], or the control vector. Intriguingly, we found that the FASN[I] variant can enhance the enzyme activity of FASN, and, thus, increase the amount of the FASN end-product, palmitate in the ESCC cells. We also observed elevated palmitate levels in the plasma of the FASN[I] genotype carriers among a total of 632 healthy Chinese adults. In conclusion, our results suggested that the FASN V1937I variant influenced ESCC cell proliferation and susceptibility by altering the catabolic activity of FASN on palmitate. These findings may highlight an important role of palmitate metabolism in the development of ESCC and may contribute to the personalized medicine of this disease."
31251897,,Rare P376L variant in the SR-BI gene associates with HDL dysfunction and risk of cardiovascular disease.,2019,Clin Biochem,10.1016/j.clinbiochem.2019.06.014,"['Sara Samadi', 'Zahra Farjami', 'Zeinab Sadat Hosseini', 'Gordon A Ferns', 'Amir Hooshang Mohammadpour', 'Maryam Tayefi', 'Homa Fal-Soleiman', 'Mohsen Moohebati', 'Majid Ghayour-Mobarhan', 'Habibollah Esmaily', 'Amir Avan']","['HDL Lipid peroxidation', 'HDL-C Level', 'HDLox', 'High density lipoprotein', 'SCARB1', 'rs74830766']","Scavenger receptor class B type 1 (SR-BI) encoded by SCARB1 gene serves as a multifunctional HDL receptor, facilitating the uptake of cholesteryl esters from HDL to the liver. Recent studies have identified the association between the P376L missense mutation of the SCARB1 gene with increased serum HDL-Cholesterol level. However, the contribution of this variant to the development of cardiovascular disease (CVD) remains unclear."
31164718,PMC6871078,A feline orthologue of the human MYH7 c.5647G>A (p.(Glu1883Lys)) variant causes hypertrophic cardiomyopathy in a Domestic Shorthair cat.,2019,Eur J Hum Genet,10.1038/s41431-019-0431-4,"['Tom Schipper', 'Mario Van Poucke', 'Laurien Sonck', 'Pascale Smets', 'Richard Ducatelle', 'Bart J G Broeckx', 'Luc J Peelman']",[],"Hypertrophic cardiomyopathy (HCM) is the most common inherited human heart disease. The same disease has a high prevalence in cats, where it is also suspected to be inherited. More than 1500 variants in MYBPC3, MYH7 and other sarcomeric genes are associated with human HCM, while in cats, only two causative variants in MYBPC3 are currently known. Here, we describe an adult Domestic Shorthair cat with arterial thromboembolism and heart failure that was diagnosed with HCM on necropsy. Sequencing of the coding regions of MYBPC3 and MYH7 revealed 21 variants, of which the MYH7 c.5647G>A (p.(Glu1883Lys)) variant was further analysed, because its orthologous variant had already been reported in a human patient with HCM, but with limited causal evidence. This variant affects the highly conserved assembly competence domain, is predicted in silico to be damaging and was found only once in population databases. Recently, functional studies have confirmed its predicted damaging effect and a paralogous variant in MYH6 has been associated with cardiac disease in humans as well. This report of an orthologous variant in a cat with HCM and its absence in 200 additional cats provides further evidence for its disease-causing nature. As the first report of feline HCM caused by a variant in MYH7, this study also emphasises this gene as a candidate gene for future studies in cats and highlights the similarity between human and feline HCM."
31703135,,[Phenotypic and genetic analysis of a pedigree affected with hereditary FV deficiency due to a novel deletional variant of F5 gene].,2019,Zhonghua Yi Xue Yi Chuan Xue Za Zhi,10.3760/cma.j.issn.1003-9406.2019.11.011,"['Hongxiang Ding', 'Kankan Su', 'Liqun Hu', 'Haiyue Zhang', 'Lidan Zhu', 'Lihong Yang', 'Yanhui Jin', 'Mingshan Wang']",[],To analyze the phenotype and F5 gene variant in a pedigree affected with hereditary coagulation factor V (FV) deficiency.
31476289,,A novel DPP6 variant in Chinese families causes early repolarization syndrome.,2019,Exp Cell Res,10.1016/j.yexcr.2019.111561,"['Cheng-Cheng Ji', 'Feng-Juan Yao', 'Yun-Jiu Cheng', 'Hao Yao', 'Jun Fan', 'Xu-Miao Chen', 'Zi-Heng Zheng', 'Yu-Gang Dong', 'Su-Hua Wu']","['DPP6', 'Early repolarization syndrome', 'I(to)', 'Whole-cell patch clamp']","Previous studies demonstrated that variants in dipeptidyl aminopeptidase-like protein-6 (DPP6) are involved in idiopathic ventricular fibrillation. However, its role in early repolarization syndrome (ERS) remains largely elusive. The aim of this study is to determine whether the novel DPP6-L747P variant is associated with ERS, and explore the underlying mechanisms. In our study, whole genome sequencing was used to identify a genetic variant in 4 Chinese families with sudden cardiac arrest induced by ERS. Then, wild-type (WT) DPP6 or mutant (c.2240T > C/p.L747P) DPP6 were respectively expressed in HEK293 cells, co-expressed with K"
31086968,,Variant Score Ranker-a web application for intuitive missense variant prioritization.,2020,Bioinformatics,10.1093/bioinformatics/btz252,"['Juanjiangmeng Du', 'Monica Sudarsanam', 'Eduardo Pérez-Palma', 'Andrea Ganna', 'Laurent Francioli', 'Sumaiya Iqbal', 'Lisa-Marie Niestroj', 'Costin Leu', 'Ben Weisburd', 'Tim Poterba', 'Peter Nürnberg', 'Mark J Daly', 'Aarno Palotie', 'Patrick May', 'Dennis Lal']",[],"The correct classification of missense variants as benign or pathogenic remains challenging. Pathogenic variants are expected to have higher deleterious prediction scores than benign variants in the same gene. However, most of the existing variant annotation tools do not reference the score range of benign population variants on gene level."
27761213,PMC5056015,Alanine to Serine Variant at Position 986 of Calcium Sensing Receptor and Colorectal Cancer Risk.,2016,Iran J Cancer Prev,10.17795/ijcp-8098,"['Reza Dabiri', 'Touraj Mahmoudi', 'Hamid Farahani', 'Hossein Nobakht', 'Mohammad Reza Zali']","['Calcium Sensing Receptor Gene', 'Colorectal Cancer', 'RFLP', 'Variant']","With regard to the effect of calcium against colorectal cancer (CRC) and considering the key role of calcium sensing receptor (CaSR) in calcium homeostasis, this study investigated whether "
28145583,,Structural Analysis of G1691S Variant in the Human Filamin B Gene Responsible for Larsen Syndrome: A Comparative Computational Approach.,2017,J Cell Biochem,10.1002/jcb.25920,"['Sneha P', 'Kumar Thirumal D', 'Himani Tanwar', 'Siva R', 'George Priya Doss C', 'Hatem Zayed']","['FLNB', 'G1691S', 'IN SILICO PREDICTIONS', 'LARSEN SYNDROME', 'MOLECULAR DYNAMICS']","Larsen syndrome (LRS) is a rare genetic disease associated with variable manifestations including skeletal malformations, dislocations of the large joints, and notable changes in facial and limb features. Genetic variants in the Filamin B (FLNB) gene are associated with the development of LRS. We searched two literature databases (OMIM and PubMed) and three gene variant databases (HGMD, UniProt, & dbSNP) to capture all the possible variants associated with LRS phenotype, which may have an impact on the FLNB function. Our search yielded 77 variants that might impact the FLNB protein function in patients with LRS. We performed rigorous computational analysis such as conservational, biochemical, pathogenicity, and structural computational analyses to understand the deleterious effect of the G1691S variant. Further, the structural changes of the G1691S variant was compared with a null variant (G1691A) and the native protein through a molecular dynamic simulation study of 50 ns. We found that the variant G1691S was highly deleterious and destabilize the protein when compared to the native and variant G1691A. This might be due to the physicochemical changes in the variant G1691S when compared to the native and variant G1691A. The destabilization was further supported by transformation of bend to coil in variant G1691S whereas bend was retained in native and variant G1691A through molecular dynamics analysis. Our study shed light on the importance of computational methods to understand the molecular nature of genetic variants and structural insights on the function of the FLNB protein. J. Cell. Biochem. 118: 1900-1910, 2017. © 2017 Wiley Periodicals, Inc."
32509087,PMC7270667,Discovery and characterization of a novel splice variant of the p53 tumor suppressor gene in a human T cell leukemia cellline.,2020,Int J Clin Exp Pathol,,"['Xiaomei Li', 'Yingshou Lei', 'Yang Yu', 'Yaqian Zhang', 'Wenfeng Zhang', 'Han Shen', 'Changli Tao', 'Fenglin Wu', 'Shulin Huang', 'Hongwei Shao']","['Jurkat', 'TP53', 'expression regulation', 'splice variant', 'transcriptome']",Alternative splicing produces multiple mRNA variants of 
32438863,,The association of a single-nucleotide variant in the microRNA-146a with advanced colorectal cancer prognosis.,2020,Tumour Biol,10.1177/1010428320923856,"['Jéssica Silva Dos Santos', 'Gabriella Lucatto Zunta', 'Amanda Binatto Negrini', 'Marina Silva Guinda Ribeiro', 'Carlos Augusto Real Martinez', 'Marcelo Lima Ribeiro', 'Gustavo Jacob Lourenço', 'Manoela Marques Ortega']","['BRCA1/2', 'Colorectal cancer', 'SNV n.60G>C (rs2910164)', 'miR-146a', 'prognosis', 'risk', 'single-nucleotide variant']","The aim of this study was to evaluate the association of single-nucleotide variant n.60G>C (rs2910164) of microRNA (miR)-146a, related to suppressing of BRCA1/2 DNA repair protein, with the risk and survival of colorectal cancer patients, as well as miR-146a and "
32364220,PMC7218218,"Whole exome sequencing of a family revealed a novel variant in the CHM gene, c.22delG p.(Glu8Serfs*4), which co-segregated with choroideremia.",2020,Biosci Rep,10.1042/BSR20200067,"['Handong Dan', 'Tuo Li', 'Xinlan Lei', 'Xin Huang', 'Yiqiao Xing', 'Yin Shen']","['choroideremia', 'gene variant', 'whole exome sequencing']","Choroideremia is a complex form of blindness-causing retinal degeneration. The aim of the present study was to investigate the pathogenic variant and molecular etiology associated with choroideremia in a Chinese family. All available family members underwent detailed ophthalmological examinations. Whole exome sequencing, bioinformatics analysis, Sanger sequencing, and co-segregation analysis of family members were used to validate sequencing data and confirm the presence of the disease-causing gene variant. The proband was diagnosed with choroideremia on the basis of clinical manifestations. Whole exome sequencing showed that the proband had a hemizygous variant in the CHM gene, c.22delG p. (Glu8Serfs*4), which was confirmed by Sanger sequencing and found to co-segregate with choroideremia. The variant was classified as likely pathogenic and has not previously been described. These results expand the spectrum of variants in the CHM gene, thus potentially enriching the understanding of the molecular basis of choroideremia. Moreover, they may provide insight for future choroideremia diagnosis and gene therapy."
