PMID,PMCID,Title,Year,Journal,DOI,Authors,Keywords,Abstract
30957963,,"R180T variant of δ-ornithine aminotransferase associated with gyrate atrophy: biochemical, computational, X-ray and NMR studies provide insight into its catalytic features.",2019,FEBS J,10.1111/febs.14843,"['Riccardo Montioli', 'Alessandro Paiardini', 'Giorgio Giardina', 'Serena Zanzoni', 'Francesca Cutruzzola', 'Barbara Cellini', 'Carla Borri Voltattorni']","['gyrate atrophy', 'ornithine aminotransferase', 'pathogenic variant', 'pyridoxal 5′-phosphate', 'substrate-binding mode']","Among the over 50 gyrate atrophy-causing mutations of ornithine δ-aminotransferase (OAT), the R180T involves an active site residue located at the dimer interface, which in the crystal structure of OAT complexed with 5-fluoromethylornithine engages a salt bridge with the α-carboxylate of the substrate analogue. Starting from the previous finding that no transaminase activity was detected in CHO-K"
28082085,,The E23K variant of the Kir6.2 subunit of the ATP-sensitive potassium channel increases susceptibility to ventricular arrhythmia in response to ischemia in rats.,2017,Int J Cardiol,10.1016/j.ijcard.2017.01.022,"['Ying Feng', 'Jianfang Liu', 'Menglong Wang', 'Menglin Liu', 'Lei Shi', 'Wenhui Yuan', 'Jing Ye', 'Dan Hu', 'Jun Wan']","['ATP-sensitive potassium channel', 'E23K variant', 'Ischemia', 'Transgenic model', 'Ventricular arrhythmia']","The E23K variant of the Kir6.2 subunit of the ATP-sensitive potassium (KATP) channel has been implicated in cardiac remodeling. However, the effects of E23K variant on ventricular electrophysiology and arrhythmogenesis remain unclear."
32844072,PMC7441036,A novel variant c.3706C>T p.(Avg 1236Cys) in the ,2020,Intractable Rare Dis Res,10.5582/irdr.2020.03033,"['Hussein Algahtani', 'Bader Shirah', 'Alhusain Alshareef', 'Mohammad H Al-Qahtani', 'Angham Abdulrahman Abdulkareem', 'Muhammad Imran Naseer']","['ABCA7', 'Alzheimer disease', 'Saudi Arabia', 'dementia', 'mutation']",Alzheimer's disease (AD) is the most common cause of dementia with around 50 million people suffering from this disease worldwide. Mutations in the ATP-binding cassette sub-family A member 7 (
32814565,PMC7437021,Different subtypes of collateral vessels in hemorrhagic moyamoya disease with p.R4810K variant.,2020,BMC Neurol,10.1186/s12883-020-01884-0,"['Peicong Ge', 'Qian Zhang', 'Xun Ye', 'Xingju Liu', 'Xiaofeng Deng', 'Jia Wang', 'Rong Wang', 'Yan Zhang', 'Dong Zhang', 'Jizong Zhao']","['Collateral vessel', 'Hemorrhage', 'Hemorrhgic sites', 'Moyamoya disease', 'P.R4810 K vaiant']",The aim of this study was to investigate the hemorrhgic sites and collateral vessels in hemorrhagic MMD with the p.R4810K variant.
32750235,PMC7480906,Functional and pharmacological evaluation of a novel SCN2A variant linked to early-onset epilepsy.,2020,Ann Clin Transl Neurol,10.1002/acn3.51105,"['Scott K Adney', 'John J Millichap', 'Jean-Marc DeKeyser', 'Tatiana Abramova', 'Christopher H Thompson', 'Alfred L George']",[],"We identified a novel de novo SCN2A variant (M1879T) associated with infantile-onset epilepsy that responded dramatically to sodium channel blocker antiepileptic drugs. We analyzed the functional and pharmacological consequences of this variant to establish pathogenicity, and to correlate genotype with phenotype and clinical drug response."
29363275,PMC5902394,Functional study of a novel missense single-nucleotide variant of NUP107 in two daughters of Mexican origin with premature ovarian insufficiency.,2018,Mol Genet Genomic Med,10.1002/mgg3.345,"['Yu Ren', 'Feiyang Diao', 'Sunita Katari', 'Svetlana Yatsenko', 'Huaiyang Jiang', 'Michelle A Wood-Trageser', 'Aleksandar Rajkovic']","['CRISPR', 'Nup107', 'hypergonadotropic hypogonadism', 'infertility', 'ovary']","Hypergonadotropic hypogonadism (HH) is a genetically heterogeneous disorder that usually presents with amenorrhea, atrophic ovaries, and low estrogen. Most cases of HH are idiopathic and nonsyndromic. Nucleoporin 107 (NUP107), a protein involved in transport between cytoplasm and nucleus with putative roles in meiosis/mitosis progression, was recently implicated as a cause of HH. We identified a NUP107 genetic variant in a nonconsanguineous family with two sisters affected with primary amenorrhea and HH, and generated a mouse model that carried the human variant."
29215655,,Observed frequency and challenges of variant reclassification in a hereditary cancer clinic.,2017,Genet Med,10.1038/gim.2017.207,"['Sarah Macklin', 'Nisha Durand', 'Paldeep Atwal', 'Stephanie Hines']",[],"PurposeEfforts have been made by the American College of Medical Genetics and Genomics and the Association for Molecular Pathology to make variant classification more uniform, but many limitations remain. Reclassification of a variant of uncertain significance (VUS) is expected, but other more certain calls, like pathogenic or benign, can also be reclassified once additional information is gathered. Variant reclassification can create difficult circumstances for both patients and clinicians.MethodsRetrospective review of all variant reclassifications in genes associated with hereditary cancer syndromes at one clinic between September 2013 and February 2017 was completed. All variant reclassifications were completed and reported by the original testing laboratory.ResultsA total of 1,103 hereditary cancer tests were ordered. Fewer than 5% (40/1,103) of the initial reports were updated during that time period. Most reclassifications (29/40) were downgrades of VUS to likely benign. Only three reclassifications could potentially alter medical management.ConclusionThe majority of variant reclassifications do not impact medical management. Upgrading a variant call to pathogenic could be important for a patient's care and shows the importance of open communication between laboratories and clinicians. A variant downgrade from pathogenic can be a significant reclassification as well, especially if prophylactic surgery has been completed."
29520510,,Variant Angina and Aborted Sudden Cardiac Death.,2018,Curr Cardiol Rep,10.1007/s11886-018-0963-1,"['Amartya Kundu', 'Aditya Vaze', 'Partha Sardar', 'Ahmed Nagy', 'Wilbert S Aronow', 'Naomi F Botkin']","['Cardiac arrest', 'Coronary vasospasm', 'Sudden death', 'Variant angina']","Variant angina, which is characterized by recurrent chest pain and transient ECG changes along with angiographic evidence of coronary artery spasm, generally has a favorable prognosis. However, episodes of ischemia caused by vasospasm may lead to potentially life-threatening ventricular arrhythmias and cardiac arrest, even in patients with no history of prior cardiac disease. This review describes the epidemiology, pathogenesis, clinical spectrum, and management of variant angina, as well as outcomes in patients who present with aborted sudden cardiac death (ASCD)."
29450617,,A natural variant of arylsulfatase from Kluyveromyces lactis shows no formylglycine modification and has no enzyme activity.,2018,Appl Microbiol Biotechnol,10.1007/s00253-018-8828-5,"['Timo Stressler', 'Katrin Reichenberger', 'Claudia Glück', 'Sebastian Leptihn', 'Jens Pfannstiel', 'Paul Swietalski', 'Andreas Kuhn', 'Ines Seitl', 'Lutz Fischer']","['Amino acid exchange', 'Arylsulfatase', 'Formylglycine', 'Kluyveromyces lactis', 'Secondary structure determination', 'p-cresol sulfate', 'p-nitrophenyl sulfate']","Kluyveromyces lactis is a common fungal microorganism used for the production of enzyme preparations such as β-galactosidases (native) or chymosin (recombinant). It is generally important that enzyme preparations have no unwanted side activities. In the case of β-galactosidase preparations produced from K. lactis, an unwanted side activity could be the presence of arylsulfatase (EC 3.1.6.1). Due to the action of arylsulfatase, an unpleasant ""cowshed-like"" off-flavor would occur in the final product. The best choice to avoid this is to use a yeast strain without this activity. Interestingly, we found that certain natural K. lactis strains express arylsulfatases, which only differ in one amino acid at position 139. The result of this difference is that K. lactis DSM 70799 (expressing R139 variant) shows no arylsulfatase activity, unlike K. lactis GG799 (expressing S139 variant). After recombinant production of both variants in Escherichia coli, the R139 variant remains inactive, whereas the S139 variant showed full activity. Mass spectrometric analyses showed that the important posttranslational modification of C56 to formylglycine was not found in the R139 variant. By contrast, the C56 residue of the S139 variant was modified. We further investigated the packing and secondary structure of the arylsulfatase variants using optical spectroscopy, including fluorescence and circular dichroism. We found out that the inactive R139 variant exhibits a different structure regarding folding and packing compared to the active S139 variant. The importance of the amino acid residue 139 was documented further by the construction of 18 more variants, whereof only ten showed activity but always reduced compared to the native S139 variant."
32703994,PMC7378213,MAGPEL: an autoMated pipeline for inferring vAriant-driven Gene PanEls from the full-length biomedical literature.,2020,Sci Rep,10.1038/s41598-020-68649-0,"['Nafiseh Saberian', 'Adib Shafi', 'Azam Peyvandipour', 'Sorin Draghici']",[],"In spite of the efforts in developing and maintaining accurate variant databases, a large number of disease-associated variants are still hidden in the biomedical literature. Curation of the biomedical literature in an effort to extract this information is a challenging task due to: (i) the complexity of natural language processing, (ii) inconsistent use of standard recommendations for variant description, and (iii) the lack of clarity and consistency in describing the variant-genotype-phenotype associations in the biomedical literature. In this article, we employ text mining and word cloud analysis techniques to address these challenges. The proposed framework extracts the variant-gene-disease associations from the full-length biomedical literature and designs an evidence-based variant-driven gene panel for a given condition. We validate the identified genes by showing their diagnostic abilities to predict the patients' clinical outcome on several independent validation cohorts. As representative examples, we present our results for acute myeloid leukemia (AML), breast cancer and prostate cancer. We compare these panels with other variant-driven gene panels obtained from Clinvar, Mastermind and others from literature, as well as with a panel identified with a classical differentially expressed genes (DEGs) approach. The results show that the panels obtained by the proposed framework yield better results than the other gene panels currently available in the literature."
32311412,,Alternative 3' splice site selection of intron 5 within the prmt8 gene results in a novel variant widely distributed in vertebrates and specifically abundant in Aves.,2020,Gene,10.1016/j.gene.2020.144684,"['Yi-Chun Wang', 'Chien-Ping Chang', 'Yun-Jung Tsai', 'Yu-Jen Lee', 'Chuan Li']","['3′ splice site selection', 'Alternative splicing', 'Heteroduplex', 'PRMT8', 'Vertebrate evolution']","PRMT8 is a neuron-specific protein arginine methyltransferase in vertebrates. From data mining, we found a novel prmt8e6+43 splicing variant with a 43-nucleotide (nt) extension at the 5' of exon 6 in chicken. RT-PCR analyses confirmed the existence of two splicing variants but also detected a third upper signal. The triplet pattern detected in chicken suggests that one strand from the prmt8e6+43 transcript and one strand from the regular splicing products form a heteroduplex with a bulb conformation and the two transcripts are of similar abundance. One short plus one faint upper heteroduplex signal detected in mouse and human indicate that the level of the variant is much less than the normal one in mammals. The relative expression of the normal and prmt8e6+43 variants in different species can be inferred from the reads of intron 5 that contains the 43-nt extension or not in the RNA-seq data of NCBI Gene database. The results of the analyses showed that the prmt8e6+43 variant is relatively abundant in birds but much less or even not detected in mammalian species. As conserved intron 5 sequences and evidences of alternative splicing (AS) are detected in elephant shark, a cartilaginous fish with the slowest-evolving genome, we propose that the prmt8e6+43 variant is present in the common ancestor of jawed vertebrates. The prmt8e6+43 variant includes a premature termination codon and thus should encode a truncated PRMT8 with deletion from the dimerization arm. Western blot analyses showed very weak low-molecular-weight signals in chicken, which might be the C-terminal truncated PRMT8. Why avian species maintain high RNA but not protein levels of the prmt8e6+43 variant and whether the evolutionary conserved sequence and AS might regulate PRMT8 expression require further investigation."
32200540,,Analysis of 3297 individuals suggests that the pathogenic germline 5'-UTR variant BRCA1 c.-107A > T is not common in south-east Germany.,2020,Fam Cancer,10.1007/s10689-020-00175-4,"['A Laner', 'A Benet-Pages', 'B Neitzel', 'E Holinski-Feder']","['5´UTR', 'BRCA1', 'KASP', 'c.-107A\u2009>\u2009T']",In this study we aim to determine the prevalence of the recently identified pathogenic BRCA1 variant c.-107A > T in the south-east German population. This variant causes the epigenetic silencing of the BRCA1 promotor and has been detected in two independent families from the UK without a germline BRCA1 or BRCA2 pathogenic variant. A total of 3297 individuals with suspicion of hereditary breast and ovarian cancer and fulfilling the clinical criteria necessary for genetic testing in Germany were analyzed for presence of the variant by a Kompetitive Allele-Specific PCR (KASP) assay or direct Sanger sequencing. Since we did not detect an individual carrying the variant we conclude that BRCA1 c.-107A > T is not a common variant in the south-east German population.
32057119,,A missense variant remote from the active site impairs stability of human phosphoglucomutase 1.,2020,J Inherit Metab Dis,10.1002/jimd.12222,"['Kyle M Stiers', 'Reed P Hansen', 'Bana A Daghlas', 'Kelly N Mason', 'Jian-She Zhu', 'David L Jakeman', 'Lesa J Beamer']","['X-ray crystallography', 'impaired stability', 'inherited disease', 'missense variants', 'phosphoglucomutase']","Missense variants of human phosphoglucomutase 1 (PGM1) cause the inherited metabolic disease known as PGM1 deficiency. This condition is categorised as both a glycogen storage disease and a congenital disorder of glycosylation. Approximately 20 missense variants of PGM1 are linked to PGM1 deficiency, and biochemical studies have suggested that they fall into two general categories: those affecting the active site and catalytic efficiency, and those that appear to impair protein folding and/or stability. In this study, we characterise a novel variant of Arg422, a residue distal from the active site of PGM1 and the site of a previously identified disease-related variant (Arg422Trp). In prior studies, the R422W variant was found to produce insoluble protein in a recombinant expression system, precluding further in vitro characterisation. Here we investigate an alternative variant of this residue, Arg422Gln, which is amenable to experimental characterisation presumably due to its more conservative physicochemical substitution. Biochemical, crystallographic, and computational studies of R422Q establish that this variant causes only minor changes in catalytic efficiency and 3D structure, but is nonetheless dramatically reduced in stability. Unexpectedly, binding of a substrate analog is found to further destabilise the protein, in contrast to its stabilising effect on wild-type PGM1 and several other missense variants. This work establishes Arg422 as a lynchpin residue for the stability of PGM1 and supports the impairment of protein stability as a pathomechanism for variants that cause PGM1 deficiency. SYNOPSIS: Biochemical and structural studies of a missense variant far from the active site of human PGM1 identify a residue with a key role in enzyme stability."
31020001,PMC6469258,Alternative splicing in a presenilin 2 variant associated with Alzheimer disease.,2019,Ann Clin Transl Neurol,10.1002/acn3.755,"['Jacquelyn E Braggin', 'Stephanie A Bucks', 'Meredith M Course', 'Carole L Smith', 'Bryce Sopher', 'Leah Osnis', 'Kiel D Shuey', 'Kimiko Domoto-Reilly', 'Christina Caso', 'Chizuru Kinoshita', 'Kathryn P Scherpelz', 'Chloe Cross', 'Thomas Grabowski', 'Seyyed H M Nik', 'Morgan Newman', 'Gwenn A Garden', 'James B Leverenz', 'Debby Tsuang', 'Caitlin Latimer', 'Luis F Gonzalez-Cuyar', 'Christopher Dirk Keene', 'Richard S Morrison', 'Kristoffer Rhoads', 'Ellen M Wijsman', 'Michael O Dorschner', 'Michael Lardelli', 'Jessica E Young', 'Paul N Valdmanis', 'Thomas D Bird', 'Suman Jayadev']",[],Autosomal-dominant familial Alzheimer disease (AD) is caused by by variants in presenilin 1 (
30219899,PMC6383060,The 4q25 variant rs13143308T links risk of atrial fibrillation to defective calcium homoeostasis.,2020,Cardiovasc Res,10.1093/cvr/cvy215,"['Adela Herraiz-Martínez', 'Anna Llach', 'Carmen Tarifa', 'Jorge Gandía', 'Verónica Jiménez-Sabado', 'Estefanía Lozano-Velasco', 'Selma A Serra', 'Alexander Vallmitjana', 'Eduardo Vázquez Ruiz de Castroviejo', 'Raúl Benítez', 'Amelia Aranega', 'Christian Muñoz-Guijosa', 'Diego Franco', 'Juan Cinca', 'Leif Hove-Madsen']","['Human atrial myocytes', 'Ryanodine receptor', 'Sarcoplasmic reticulum calcium release', 'Single nucleotide polymorphisms', 'Spontaneous electrical activity']","Single nucleotide polymorphisms on chromosome 4q25 have been associated with risk of atrial fibrillation (AF) but the exiguous knowledge of the mechanistic links between these risk variants and underlying electrophysiological alterations hampers their clinical utility. Here, we tested the hypothesis that 4q25 risk variants cause alterations in the intracellular calcium homoeostasis that predispose to spontaneous electrical activity."
32619248,,[Identification of a novel splicing variant of IDS gene in a pedigree affected with type II glycosaminoglycan product storage disease].,2020,Zhonghua Yi Xue Yi Chuan Xue Za Zhi,10.3760/cma.j.issn.1003-9406.2020.07.003,"['Hongqiang Xie', 'Lijuan Wang', 'Sexin Huang', 'Jie Li', 'Yang Zou', 'Peiwen Xu', 'Ming Gao', 'Ranran Kang', 'Yuping Niu', 'Xiaowei Liu', 'Yuan Gao']",[],To analyze variant of IDS gene in a pedigree affected with mucopolysaccharidosis type II (MPS II).
32338743,PMC7319464,VarFish: comprehensive DNA variant analysis for diagnostics and research.,2020,Nucleic Acids Res,10.1093/nar/gkaa241,"['Manuel Holtgrewe', 'Oliver Stolpe', 'Mikko Nieminen', 'Stefan Mundlos', 'Alexej Knaus', 'Uwe Kornak', 'Dominik Seelow', 'Lara Segebrecht', 'Malte Spielmann', 'Björn Fischer-Zirnsak', 'Felix Boschann', 'Ute Scholl', 'Nadja Ehmke', 'Dieter Beule']",[],"VarFish is a user-friendly web application for the quality control, filtering, prioritization, analysis, and user-based annotation of DNA variant data with a focus on rare disease genetics. It is capable of processing variant call files with single or multiple samples. The variants are automatically annotated with population frequencies, molecular impact, and presence in databases such as ClinVar. Further, it provides support for pathogenicity scores including CADD, MutationTaster, and phenotypic similarity scores. Users can filter variants based on these annotations and presumed inheritance pattern and sort the results by these scores. Variants passing the filter are listed with their annotations and many useful link-outs to genome browsers, other gene/variant data portals, and external tools for variant assessment. VarFish allows users to create their own annotations including support for variant assessment following ACMG-AMP guidelines. In close collaboration with medical practitioners, VarFish was designed for variant analysis and prioritization in diagnostic and research settings as described in the software's extensive manual. The user interface has been optimized for supporting these protocols. Users can install VarFish on their own in-house servers where it provides additional lab notebook features for collaborative analysis and allows re-analysis of cases, e.g. after update of genotype or phenotype databases."
31216982,PMC6585023,A rare functional variant of SHARPIN attenuates the inflammatory response and associates with increased risk of late-onset Alzheimer's disease.,2019,Mol Med,10.1186/s10020-019-0090-5,"['Yuya Asanomi', 'Daichi Shigemizu', 'Akinori Miyashita', 'Risa Mitsumori', 'Taiki Mori', 'Norikazu Hara', 'Kaoru Ito', 'Shumpei Niida', 'Takeshi Ikeuchi', 'Kouichi Ozaki']","['Alzheimer’s disease', 'Genetic risk factor', 'Inflammation', 'Rare functional variant', 'SHARPIN']","Late-onset Alzheimer's disease (LOAD), the most common form of dementia, results from complicated interactions among multiple environmental and genetic factors. Despite recent advances in genetic analysis of LOAD, more than half of the heritability for the disease remains unclear. Although genetic studies in Caucasians found rare risk variants for LOAD with large effect sizes, these variants are hardly detectable in the Japanese population."
31486122,PMC6842318,A comprehensive biomedical variant catalogue based on whole genome sequences of 582 dogs and eight wolves.,2019,Anim Genet,10.1111/age.12834,"['V Jagannathan', 'C Drögemüller', 'T Leeb']","['\nCanis lupus familaris\n', 'Mendelian', 'animal model', 'bioinformatics', 'functional annotation', 'genetic diversity', 'precision medicine', 'rare disease', 'variant database', 'whole genome sequencing']","The domestic dog serves as an excellent model to investigate the genetic basis of disease. More than 400 heritable traits analogous to human diseases have been described in dogs. To further canine medical genetics research, we established the Dog Biomedical Variant Database Consortium (DBVDC) and present a comprehensive list of functionally annotated genome variants that were identified with whole genome sequencing of 582 dogs from 126 breeds and eight wolves. The genomes used in the study have a minimum coverage of 10× and an average coverage of ~24×. In total, we identified 23 133 692 single-nucleotide variants (SNVs) and 10 048 038 short indels, including 93% undescribed variants. On average, each individual dog genome carried ∼4.1 million single-nucleotide and ~1.4 million short-indel variants with respect to the reference genome assembly. About 2% of the variants were located in coding regions of annotated genes and loci. Variant effect classification showed 247 141 SNVs and 99 562 short indels having moderate or high impact on 11 267 protein-coding genes. On average, each genome contained heterozygous loss-of-function variants in 30 potentially embryonic lethal genes and 97 genes associated with developmental disorders. More than 50 inherited disorders and traits have been unravelled using the DBVDC variant catalogue, enabling genetic testing for breeding and diagnostics. This resource of annotated variants and their corresponding genotype frequencies constitutes a highly useful tool for the identification of potential variants causative for rare inherited disorders in dogs."
29207017,PMC5752242,A common African variant of human connexin 37 is associated with Caucasian primary ovarian insufficiency and has a deleterious effect in vitro.,2017,Int J Mol Med,10.3892/ijmm.2017.3257,"['Anne Bachelot', 'Jerome Gilleron', 'Geri Meduri', 'Mihelai Guberto', 'Jerome Dulon', 'Sylviane Boucherie', 'Philippe Touraine', 'Micheline Misrahi']",[],"Folliculogenesis requires communication between granulosa cells and oocytes, mediated by connexin-based gap junctions. Connexin 37 (Cx37)-deficient female mice are infertile. The present study assessed Cx37 deficiency in patients with primary ovarian insufficiency (POI). A candidate gene study was performed in patients and controls from the National Genotyping Center (Evry, France) including 58 Caucasian patients with idiopathic isolated POI and 142 Caucasian controls. Direct genomic sequencing of the coding regions of the GJA4 gene (encoding Cx37) was performed with the aim to identify a deleterious variant associated with POI and absent in ethnically matched controls. A single Cx37 variant absent in the control population was identified, namely a c.946G>A heterozygous substitution leading to a p.Gly316Ser variant that was present in two POI patients. This variant was absent in all Caucasian controls from various databases, and has been observed exclusively in African populations. This variant was identified to have a dominant negative effect in HeLa cells in vitro to alter connexon function (by 67.2±7.17%), as determined by Gap-fluorescence recovery after photobleaching. The alteration principally resulted from a decrease of cell surface connexons due to altered trafficking (by 47.73±8.59%). In marked contrast to this observation, a p.Pro258Ser variant frequent in all ethnic populations in databases had no functional effect in vitro. In conclusion, the present study reported on a Cx37 variant in two Caucasian POI patients, which was absent in control Caucasian populations, and which had a deleterious effect in vitro. It is therefore suggested that in the genetic context of the Caucasian population, this variant may contribute to POI."
