PMID,PMCID,Title,Year,Journal,DOI,Authors,Keywords,Abstract
31892348,PMC6938631,Recommendations for application of the functional evidence PS3/BS3 criterion using the ACMG/AMP sequence variant interpretation framework.,2019,Genome Med,10.1186/s13073-019-0690-2,"['Sarah E Brnich', 'Ahmad N Abou Tayoun', 'Fergus J Couch', 'Garry R Cutting', 'Marc S Greenblatt', 'Christopher D Heinen', 'Dona M Kanavy', 'Xi Luo', 'Shannon M McNulty', 'Lea M Starita', 'Sean V Tavtigian', 'Matt W Wright', 'Steven M Harrison', 'Leslie G Biesecker', 'Jonathan S Berg']","['Functional assays', 'Guidelines', 'Variant interpretation']","The American College of Medical Genetics and Genomics (ACMG)/Association for Molecular Pathology (AMP) clinical variant interpretation guidelines established criteria for different types of evidence. This includes the strong evidence codes PS3 and BS3 for ""well-established"" functional assays demonstrating a variant has abnormal or normal gene/protein function, respectively. However, they did not provide detailed guidance on how functional evidence should be evaluated, and differences in the application of the PS3/BS3 codes are a contributor to variant interpretation discordance between laboratories. This recommendation seeks to provide a more structured approach to the assessment of functional assays for variant interpretation and guidance on the use of various levels of strength based on assay validation."
32918381,,Evidence of pathogenicity for the leaky splice variant c.1066-6T>G in ATM.,2020,Am J Med Genet A,10.1002/ajmg.a.61870,"['Simone Schröder', 'Britta Wieland', 'Andreas Ohlenbusch', 'Gökhan Yigit', 'Janine Altmüller', 'Eugen Boltshauser', 'Thilo Dörk', 'Knut Brockmann']","['IVS10-6T>G', 'ataxia telangiectasia', 'ataxia-telangiectasia mutated gene', 'leaky splice site variant', 'ocular motor apraxia', 'variant A-T']","Mild clinical phenotypes of ataxia-telangiectasia (variant A-T) are associated with biallelic ATM variants resulting in residual function of the ATM kinase. At least one regulatory, missense, or leaky splice site mutation resulting in expression of ATM with low level kinase activity was identified in subjects with variant A-T. Studies on the pathogenicity of the germline splicing ATM variant c.1066-6T>G have provided conflicting results. Using whole-exome sequencing, we identified two splice site ATM variants, c.1066-6T>G; [p.?], and c.2250G>A, [p.Ile709_Lys750del], in a compound heterozygous state in a 27-year-old woman who had been diagnosed as having congenital ocular motor apraxia type Cogan in her childhood. Reappraisal of her clinical phenotype revealed consistency with variant A-T. Functional analyses showed reduced expression of ATM protein and residual activity of the ATM kinase at a level consistent with variant A-T. Our results provide evidence for pathogenicity of the leaky ATM splice site variant c.1066-6T>G."
32902816,,A classic variant of Fabry disease in a family with the M296I late-onset variant.,2020,CEN Case Rep,10.1007/s13730-020-00527-0,"['Shuma Hirashio', 'Reiko Kagawa', 'Go Tajima', 'Takao Masaki']","['Classic variant', 'Fabry disease', 'Genotype', 'Late-onset variant', 'M296I mutation', 'Phenotype']","Fabry disease is an X-linked recessive disease of glycosphingolipid metabolism caused by deficiency or reduced activity of α-galactosidase A. Fabry disease phenotypes are known to consist of a classic variant and a late-onset variant. In patients with Fabry disease, the phenotype is generally considered to be defined (at least partially) by the genotype. However, patients with the classic variant have been encountered in families with mutations that are expected to produce the late-onset variant. Here, we describe a 4-year-old boy with a classic variant of Fabry disease in a family with the M296I late-onset variant. The patient's grandfather, mother, and aunt experienced late-onset disease, characteristic of the M296I variant. Conversely, the patient experienced typical disease symptoms in childhood. He had symptoms of hypohidrosis and associated heat accumulation. He cried at night due to the occurrence of severe acroparaesthesia. This symptom became more pronounced in warmer climates. Although the patient's family had a late-onset variant mutation of Fabry disease, we determined that the patient's symptoms were similar to those of classic Fabry disease. Therefore, the patient began enzyme replacement therapy, which alleviated his symptoms. Notably, enzyme replacement therapy led to rapid improvement of the patient's subjective symptoms. Thus, we presumed that the patient's symptoms supported a diagnosis of classic Fabry disease. These findings suggest that childhood symptoms may occur in patients with Fabry disease, even in families with late-onset variant mutations. The genotype-phenotype correlation in Fabry disease remains controversial."
31748954,,Differences in survival and impact of adjuvant chemotherapy in patients with variant histology of tumors of the renal pelvis.,2019,World J Urol,10.1007/s00345-019-03003-2,"['Karl H Tully', 'Marieke J Krimphove Md', 'Melissa J Huynh', 'Maya Marchese', 'Adam S Kibel', 'Joachim Noldus', 'Luis A Kluth', 'Bradley McGregor', 'Steven L Chang', 'Quoc-Dien Trinh', 'Matthew Mossanen']","['Adenocarcinoma', 'Adjuvant chemotherapy', 'Squamous cell carcinoma', 'UTUC', 'Upper tract urothelial carcinoma', 'Variant histology']","The impact of variant histologies on overall survival (OS), as well as their influence on the response to neoadjuvant and adjuvant chemotherapy (AC) is well studied in patients diagnosed with bladder cancer. However, little is known about tumors with variant histologies of the upper urinary tract. The objective of this study was to assess the survival of the predominant variant histologies of tumors of the renal pelvis (RPT) after surgical intervention, and to examine the influence of AC on the OS of the different variant histologies."
32875920,,Dialysis-related amyloidosis associated with a novel β,2020,Amyloid,10.1080/13506129.2020.1813097,"['Hiroki Mizuno', 'Junichi Hoshino', 'Masatomo So', 'Yuta Kogure', 'Takeshi Fujii', 'Yoshifumi Ubara', 'Kenmei Takaichi', 'Tetsuko Nakaniwa', 'Hideaki Tanaka', 'Genji Kurisu', 'Fuyuki Kametani', 'Mayuko Nakagawa', 'Tsuneaki Yoshinaga', 'Yoshiki Sekijima', 'Keiichi Higuchi', 'Yuji Goto', 'Masahide Yazaki']","['Dialysis-related amyloidosis', 'disulphide bond', 'variant β2-microglobulin', 'wild-type β2-microglobulin']","Till date, there had been no reported case of dialysis-related amyloidosis (DRA) associated with a β"
32854699,PMC7450592,A machine learning framework for genotyping the structural variations with copy number variant.,2020,BMC Med Genomics,10.1186/s12920-020-00733-w,"['Tian Zheng', 'Xiaoyan Zhu', 'Xuanping Zhang', 'Zhongmeng Zhao', 'Xin Yi', 'Jiayin Wang', 'Hongle Li']","['Cancer genomics', 'Copy number variant', 'Genotyping structural variation', 'Multiclass relevance vector machine', 'NGS data analysis']","Genotyping of structural variation is an important computational problem in next generation sequence data analysis. However, in cancer genomes, the copy number variant(CNV) often coexists with other types of structural variations which significantly reduces the accuracy of the existing genotype methods. The bias on sequencing coverage and variant allelic frequency can be observed on a CNV region, which leads to the genotyping approaches that misinterpret the heterozygote as a homozygote. Furthermore, other data signals such as split mapped read, abnormal read will also be misjudged because of the CNV. Therefore, genotyping the structural variations with CNV is a complicated computational problem which should consider multiple features and their interactions."
32847582,PMC7448337,Variant c.2158-2A>G in MANBA is an important and frequent cause of hereditary hearing loss and beta-mannosidosis among the Czech and Slovak Roma population- evidence for a new ethnic-specific variant.,2020,Orphanet J Rare Dis,10.1186/s13023-020-01508-3,"['Dana Safka Brozkova', 'Lukas Varga', 'Anna Uhrova Meszarosova', 'Zuzana Slobodova', 'Martina Skopkova', 'Andrea Soltysova', 'Andrej Ficek', 'Jan Jencik', 'Jana Lastuvkova', 'Daniela Gasperikova', 'Pavel Seeman']","['Beta-mannosidosis', 'Ethnic-specific variant', 'Hearing loss', 'Mental retardation', 'Roma']","The Roma are a European ethnic minority threatened by several recessive diseases. Variants in MANBA cause a rare lysosomal storage disorder named beta-mannosidosis whose clinical manifestation includes deafness and mental retardation. Since 1986, only 23 patients with beta-mannosidosis and biallelic MANBA variants have been described worldwide."
32807073,PMC7430858,Evaluation of variant calling tools for large plant genome re-sequencing.,2020,BMC Bioinformatics,10.1186/s12859-020-03704-1,"['Zhen Yao', 'Frank M You', ""Amidou N'Diaye"", 'Ron E Knox', 'Curt McCartney', 'Colin W Hiebert', 'Curtis Pozniak', 'Wayne Xu']","['Sequence mapping tools', 'Tool evaluation', 'Variant calling', 'Variant calling tools', 'Wheat exome capture sequences']","Discovering single nucleotide polymorphisms (SNPs) from agriculture crop genome sequences has been a widely used strategy for developing genetic markers for several applications including marker-assisted breeding, population diversity studies for eco-geographical adaption, genotyping crop germplasm collections, and others. Accurately detecting SNPs from large polyploid crop genomes such as wheat is crucial and challenging. A few variant calling methods have been previously developed but they show a low concordance between their variant calls. A gold standard of variant sets generated from one human individual sample was established for variant calling tool evaluations, however hitherto no gold standard of crop variant set is available for wheat use. The intent of this study was to evaluate seven SNP variant calling tools (FreeBayes, GATK, Platypus, Samtools/mpileup, SNVer, VarScan, VarDict) with the two most popular mapping tools (BWA-mem and Bowtie2) on wheat whole exome capture (WEC) re-sequencing data from allohexaploid wheat."
32882262,,The CnB1 p.D102A variant is linked to dilated cardiomyopathy via impaired Calcineurin activity.,2020,J Mol Cell Cardiol,10.1016/j.yjmcc.2020.08.012,"['M D Jinqiang Zhuang', 'M D Ruijun Yuan', 'M D Yizeng', 'M D Congliang Miao', 'M D Dandan Zhou', 'M D Anli Na', 'M D Xinying Yang', 'M D Hui Xu', 'Jiang Hong']","['Calcineurin', 'CnB1', 'Dilated cardiomyopathy', 'NFAT', 'Variant']","The role of calcineurin (protein phosphatase 2B (PP2B)) in the pathogenesis of human dilated cardiomyopathy (DCM) has not been fully elucidated. We determined the potential involvement of calcineurin in the pathogenesis of DCM caused by mutations in CnB1, a subunit of calcineurin."
32735210,,Genomic variant-identification methods may alter ,2020,Microb Genom,10.1099/mgen.0.000418,"['Katharine S Walter', 'Caroline Colijn', 'Ted Cohen', 'Barun Mathema', 'Qingyun Liu', 'Jolene Bowers', 'David M Engelthaler', 'Apurva Narechania', 'Darrin Lemmer', 'Julio Croda', 'Jason R Andrews']","['genomic epidemiology', 'pathogen genomics', 'transmission', 'tuberculosis', 'variant identification']","Pathogen genomic data are increasingly used to characterize global and local transmission patterns of important human pathogens and to inform public health interventions. Yet, there is no current consensus on how to measure genomic variation. To test the effect of the variant-identification approach on transmission inferences for "
32698196,,Benchmarking variant callers in next-generation and third-generation sequencing analysis.,2020,Brief Bioinform,10.1093/bib/bbaa148,"['Surui Pei', 'Tao Liu', 'Xue Ren', 'Weizhong Li', 'Chongjian Chen', 'Zhi Xie']","['germline variant', 'somatic variant', 'variant callers']","DNA variants represent an important source of genetic variations among individuals. Next- generation sequencing (NGS) is the most popular technology for genome-wide variant calling. Third-generation sequencing (TGS) has also recently been used in genetic studies. Although many variant callers are available, no single caller can call both types of variants on NGS or TGS data with high sensitivity and specificity. In this study, we systematically evaluated 11 variant callers on 12 NGS and TGS datasets. For germline variant calling, we tested DNAseq and DNAscope modes from Sentieon, HaplotypeCaller mode from GATK and WGS mode from DeepVariant. All the four callers had comparable performance on NGS data and 30× coverage of WGS data was recommended. For germline variant calling on TGS data, we tested DNAseq mode from Sentieon, HaplotypeCaller mode from GATK and PACBIO mode from DeepVariant. All the three callers had similar performance in SNP calling, while DeepVariant outperformed the others in InDel calling. TGS detected more variants than NGS, particularly in complex and repetitive regions. For somatic variant calling on NGS, we tested TNscope and TNseq modes from Sentieon, MuTect2 mode from GATK, NeuSomatic, VarScan2, and Strelka2. TNscope and Mutect2 outperformed the other callers. A higher proportion of tumor sample purity (from 10 to 20%) significantly increased the recall value of calling. Finally, computational costs of the callers were compared and Sentieon required the least computational cost. These results suggest that careful selection of a tool and parameters is needed for accurate SNP or InDel calling under different scenarios."
31950242,,Clinicopathologic analysis of upper urinary tract carcinoma with variant histology.,2020,Virchows Arch,10.1007/s00428-020-02745-4,"['Inês Rolim', 'Vanessa Henriques', 'Nídia Rolim', 'Ana Blanca', 'Rita Canas Marques', 'Metka Volavšek', 'Inês Carvalho', 'Rodolfo Montironi', 'Alessia Cimadamore', 'Maria R Raspollini', 'Liang Cheng', 'Antonio Lopez-Beltran']","['Divergent', 'Glandular', 'MMR', 'Micropapillary', 'Nested', 'Plasmacytoid', 'Renal pelvis', 'Sarcomatoid', 'Squamous', 'Ureter', 'Urothelial carcinoma', 'Variant histology']","We report on the clinicopathologic features of 115 cases of high-grade urothelial carcinoma of the upper urinary tract with variant histology present in 39 (34%). Variant histology was typically seen in high pathological stage (pT2-pT4) (82%, 32 cases) patients with lower survival rate (70%, 27 cases, median survival 31 months) and consisted in urothelial with one (23%), two (3%), and three or more variants (3%); 4% of cases presented with pure variant histology. Squamous divergent differentiation was the most common variant (7%) followed by sarcomatoid (6%) and glandular (4%), followed by 3% each of micropapillary, diffuse-plasmacytoid, inverted growth, clear cell glycogenic, or lipid-rich. The pseudo-angiosarcomatous variant is seen in 2%, and 1% each of nested, giant-cell, lymphoepithelioma-like, small-cell, trophoblastic, rhabdoid, microcystic, lymphoid-rich stroma, or myxoid stroma/chordoid completed the study series. Loss of mismatch repair protein expression was identified in one case of upper urinary tract carcinoma with inverted growth variant (3.6%). Variant histology was associated to pathological stage (p = 0.007) and survival status (p = 0.039). The univariate survival analysis identified variant histology as a feature of lower recurrence-free survival (p = 0.046). Our findings suggest that variant histology is a feature of aggressiveness in urothelial carcinoma of the upper urinary tract worth it to be reported."
31530497,,What Is the Significance of Variant Histology in Urothelial Carcinoma?,2019,Eur Urol Focus,10.1016/j.euf.2019.09.003,"['Niyati Lobo', 'Shahrokh F Shariat', 'Charles Chuanhai Guo', 'Mario I Fernandez', 'Wassim Kassouf', 'Ananya Choudhury', 'Jianjun Gao', 'Stephen B Williams', 'Matthew D Galsky', 'John A Taylor', 'Morgan Roupret', 'Ashish M Kamat']","['Adenocarcinoma', 'Bladder cancer', 'Clear cell urothelial carcinoma', 'Lymphoepithelioma-like carcinoma', 'Microcystic urothelial carcinoma', 'Micropapillary urothelial carcinoma', 'Nested urothelial carcinoma', 'Plasmacytoid urothelial carcinoma', 'Sarcomatoid urothelial carcinoma', 'Small cell carcinoma', 'Squamous cell carcinoma', 'Variant histology']",Urothelial carcinoma can exhibit a wide range of variant morphologies. Many variants present diagnostic challenges and carry clinical implications that inform prognosis and treatment decisions.
32060960,,New genomic features of the polled intersex syndrome variant in goats unraveled by long-read whole-genome sequencing.,2020,Anim Genet,10.1111/age.12918,"['R Simon', 'H E L Lischer', 'A Pieńkowska-Schelling', 'I Keller', 'I M Häfliger', 'A Letko', 'C Schelling', 'G Lühken', 'C Drögemüller']","['\nCapra hircus\n', 'FISH', 'copy number variant', 'gene testing', 'horn', 'long-read sequencing', 'precision medicine', 'structural variant']","In domestic goats, the polled intersex syndrome (PIS) refers to XX female-to-male sex reversal associated with the absence of horn growth (polled). The causal variant was previously reported as a 11.7 kb deletion at approximately 129 Mb on chromosome 1 that affects the transcription of both FOXL2 and several long non-coding RNAs. In the meantime the presence of different versions of the PIS deletion was postulated and trials to establish genetic testing with the existing molecular genetic information failed. Therefore, we revisited this variant by long-read whole-genome sequencing of two genetically female (XX) goats, a PIS-affected and a horned control. This revealed the presence of a more complex structural variant consisting of a deletion with a total length of 10 159 bp and an inversely inserted approximately 480 kb-sized duplicated segment of a region located approximately 21 Mb further downstream on chromosome 1 containing two genes, KCNJ15 and ERG. Publicly available short-read whole-genome sequencing data, Sanger sequencing of the breakpoints and FISH using BAC clones corresponding to both involved genome regions confirmed this structural variant. A diagnostic PCR was developed for simultaneous genotyping of carriers for this variant and determination of their genetic sex. We showed that the variant allele was present in all 334 genotyped polled goats of diverse breeds and that all analyzed 15 PIS-affected XX goats were homozygous. Our findings enable for the first time a precise genetic diagnosis for polledness and PIS in goats and add a further genomic feature to the complexity of the PIS phenomenon."
32554948,,Case report: exceptionally rapid growth character of hobnail variant of papillary thyroid carcinoma: a report of four cases.,2020,Endocr J,10.1507/endocrj.EJ20-0248,"['Yasuhiro Ito', 'Mitsuyoshi Hirokawa', 'Toshitetsu Hayashi', 'Hisashi Ota', 'Maki Oshita', 'Minoru Kihara', 'Akihiro Miya', 'Akira Miyauchi']","['Hobnail variant', 'Papillary thyroid carcinoma', 'Rapid growth', 'Recurrence']","The newest WHO classification adopts hobnail variant as an aggressive variant of papillary thyroid carcinoma (PTC). We here report four cases (ages 70-76 years, all females) with hobnail variant PTC treated at Kuma Hospital. Their lesions were cytologically diagnosed as PTC before surgery, but not as hobnail variant. All patients underwent a total thyroidectomy with central node dissection, and two patients also underwent therapeutic lateral node dissection. The clinical courses of three of the patients were very eventful. One patient showed recurrence to lymph nodes in the lateral compartment only 5 months after the initial surgery. In the initial surgery, one patient had a 36-mm lymph node metastasis in the lateral compartment, which was diagnosed as hobnail variant on pathology; 9 months post-surgery, metastases to the ipsilateral lateral lymph node, lung, and bone were newly detected. Her lung metastasis grew rapidly; its tumor volume-doubling time was 0.15 years and its tumor-doubling rate was 6.67/year. One patient underwent annual ultrasound examinations as postoperative follow-up after hemithyroidectomy for a benign nodule, but a 35-mm nodule diagnosed as PTC on cytology and lateral node metastases appeared within a short period, and she underwent a second surgery. Both the primary lesion and lymph nodes were diagnosed as hobnail variant by postoperative pathology. Three of the four patients showed exceptionally rapid growth of primary and/or metastatic/recurred lesions, indicating that patients with the hobnail variant should undergo very close and careful post-operative observation."
31978613,,A novel missense variant in GPT2 causes non-syndromic autosomal recessive intellectual disability in a consanguineous Iranian family.,2020,Eur J Med Genet,10.1016/j.ejmg.2020.103853,"['Sima Binaafar', 'Ehsan Razmara', 'Nejat Mahdieh', 'Hamidreza Sahebjame', 'Ali Reza Tavasoli', 'Masoud Garshasbi']","['GPT2', 'Missense variant', 'Non-syndromic intellectual disability', 'WES']","Intellectual disability (ID) affects 1-3% of the general population worldwide. Genetic factors play an undeniable role in the etiology of Non-Syndromic Intellectual disability (NS-ID). Nowadays, whole-exome sequencing (WES) technique is used frequently to identify the causative genes in such heterogeneous diseases. Herein, we subjected four patients with initial diagnostics of NS-ID in a consanguineous Iranian family. To find the possible genetic cause(s), Trio-WES was performed on the proband and his both healthy parents. Sanger sequencing was performed to confirm the identified variant by WES and also investigate whether it co-segregates with the patients' phenotype in the family. Using several online in-silico predictors, the probable impacts of the variant on structure and function of GPT2 protein were predicted. A novel variant, c.266A>G; p.(Glu89Gly), in exon 3 of GPT2 (NM_133443.3) was identified using Trio-WES. The candidate variant was also verified by Sanger sequencing. All affected members showed the common clinical features suffering from a non-progressive mild-to-severe ID. Also, different clinical observations compared to previously reported cases such as no facial features, no obvious structural malformations, ability to speak but with difficulty, and lack of any morphological defects were noted for the first time in this family. The c.266A>G; p.(Glu89Gly) variant reported here is the sixth variant identified up to now in the GPT2 gene, to be associated with NS-ID. Our data support the potential malfunction of the substituted GPT2 protein resulted from the novel variant, however, we strongly suggest confirming this finding more by doing functional analysis."
32292534,PMC7140378,A rare missense variant in ,2020,Hered Cancer Clin Pract,10.1186/s13053-020-00140-3,"['Malene Djursby', 'Karin Wadt', 'Jane Hübertz Frederiksen', 'Majbritt Busk Madsen', 'Lukas Adrian Berchtold', 'Jane Preuss Hasselby', 'Gro Linno Willemoe', 'Thomas V O Hansen', 'Anne-Marie Gerdes']","['APC', 'Adenocarcinoma', 'Colorectal cancer', 'Missense variant', 'Polyposis', 'Splicing']",We report the first case of a missense variant in the 
32252761,PMC7137240,The benign c.344G > A: p.(Arg115His) variant in the LDLR gene interpreted from a pedigree-based genetic analysis of familial hypercholesterolemia.,2020,Lipids Health Dis,10.1186/s12944-020-01252-4,"['Mika Hori', 'Atsushi Takahashi', 'Cheol Son', 'Masatsune Ogura', 'Mariko Harada-Shiba']","['Annotation', 'Benign', 'Familial hypercholesterolemia', 'LDL receptor', 'Variant']","We previously identified the c.344G > A: p.(Arg115His) variant in the low-density lipoprotein receptor (LDLR) gene, which was interpreted as ""conflicting interpretations of pathogenicity"" in ClinVar, based on a genetic analysis of patients with familial hypercholesterolemia (FH). However, whether this variant affects the pathophysiology of FH remains unclear. Therefore, our aim was to annotate the c.344G > A: p.(Arg115His) variant in the LDLR gene in FH. We present 2 families harboring the c.344G > A: p.(Arg115His) variant in the LDLR gene."
32252658,PMC7137186,"New genetic variant in the SERPINC1 gene: hereditary Antithrombin deficiency case report, familial thrombosis and considerations on genetic counseling.",2020,BMC Med Genet,10.1186/s12881-020-01001-5,"['Margarita E Polyak', 'Elena V Zaklyazminskaya']","['Antithrombin deficiency', 'Case report', 'New genetic variant', 'SERPINC1', 'Thromboprophylaxis']","Inherited deficiency of the antithrombin (hereditary antithrombin deficiency, AT deficiency, OMIM #613118) is a relatively rare (1:2000-3000) autosomal-dominant disorder with high risk of venous thromboembolism. Mutations in the serpin family C member 1 gene (SERPINC1) can lead to Quantitative (type I) and Qualitative (type II) types of antithrombin deficiency. We describe a new genetic variant in the SERPINC1 gene and our approach to variant interpretation."
31754268,PMC7127982,Variant interpretation is a component of clinical practice among genetic counselors in multiple specialties.,2019,Genet Med,10.1038/s41436-019-0705-9,"['Karen E Wain', 'Danielle R Azzariti', 'Jennifer L Goldstein', 'Amy Knight Johnson', 'Patti Krautscheid', 'Brianna Lepore', ""Julianne M O'Daniel"", 'Deborah Ritter', 'Juliann M Savatt', 'Erin Rooney Riggs', 'Christa Lese Martin']","['clinical genetic counselors', 'professional education', 'scope of practice', 'variant discrepancy', 'variant interpretation']","Genomic testing is routinely utilized across clinical settings and can have significant variant interpretation challenges. The extent of genetic counselor (GC) engagement in variant interpretation in clinical practice is unknown. This study aimed to explore clinical GCs' variant interpretation practice across specialties, understand outcomes of this practice, and identify resource and educational needs."
