PMID,PMCID,Title,Year,Journal,DOI,Authors,Keywords,Abstract
30942410,,HPT axis‑independent TSHβ splice variant regulates the synthesis of thyroid hormone in mice.,2019,Mol Med Rep,10.3892/mmr.2019.10082,"['Chunrong Liu', 'Jun Miao', 'Xiaorong Liu', 'Zhankao Zhao', 'Tianlei Kou', 'Jing Liu', 'Ruimin Wang', 'Lanying Li', 'Qian Dong']",[],"Thyroid stimulating hormone (TSH) consists of an α‑subunit and a unique β‑subunit. The first in‑frame TSHβ splice variant produced by the cells of immune system was identified in 2009. The TSHβ splice variant and native TSHβ exhibit different expression profiles, and research has been conducted to elucidate the role of the TSHβ splice variant in different diseases. However, understanding of the fundamental physiological characteristics of the TSHβ splice variant is currently limited. To verify whether the TSHβ splice variant has the potential to induce thyroid follicular cells to synthesize thyroid hormone, in vivo and in vitro stimulation experiments were conducted in the present study. A total of 60 C57BL/6 mice were divided into control‑, 5 and 10 µg TSHβ splice variant‑treated groups at random. Mice were sacrificed at 0.5, 1 and 4 h after intraperitoneal injection, and serum levels of tri‑iodothyronine (T3) and thyroxine (T4) were determined using a radioimmunoassay. Thyroid follicular cells were isolated from the thyroids of mice, and stimulated with 2 µg/ml TSHβ splice variant. Supernatants were collected, and the levels of T3 and T4 were detected. The protein expression levels of the sodium‑iodide symporter, thyroperoxidase and thyroglobulin in thyroid follicular cells were quantified using western blot analysis. To verify whether the TSHβ splice variant expression was regulated by the hypothalamus‑pituitary‑thyroid (HPT) axis, similar to native TSHβ, a total of 60 C57BL/6 mice were equally divided into control, 2 mg/kg T3 intraperitoneal injection and 0.05 mg/kg thyroid‑releasing hormone intraperitoneal injection groups at random. Mice were sacrificed at 1 and 4 h after injection. Alterations in the expression of the TSHβ splice variant in the pituitary, thyroid, peripheral blood leukocytes and spleen tissues were detected using western blot analysis. The present study demonstrated that the TSHβ splice variant is not regulated by the HPT axis and may affect thyroid hormone synthesis. Modifications in the expression of the TSHβ splice variant may occur in a uniquely regulated manner to provide peripheral immunological compartments with a source of activated cells, particularly under immune stress."
30858580,PMC6699627,Best practices for benchmarking germline small-variant calls in human genomes.,2019,Nat Biotechnol,10.1038/s41587-019-0054-x,"['Peter Krusche', 'Len Trigg', 'Paul C Boutros', 'Christopher E Mason', 'Francisco M De La Vega', 'Benjamin L Moore', 'Mar Gonzalez-Porta', 'Michael A Eberle', 'Zivana Tezak', 'Samir Lababidi', 'Rebecca Truty', 'George Asimenos', 'Birgit Funke', 'Mark Fleharty', 'Brad A Chapman', 'Marc Salit', 'Justin M Zook']",[],"Standardized benchmarking approaches are required to assess the accuracy of variants called from sequence data. Although variant-calling tools and the metrics used to assess their performance continue to improve, important challenges remain. Here, as part of the Global Alliance for Genomics and Health (GA4GH), we present a benchmarking framework for variant calling. We provide guidance on how to match variant calls with different representations, define standard performance metrics, and stratify performance by variant type and genome context. We describe limitations of high-confidence calls and regions that can be used as truth sets (for example, single-nucleotide variant concordance of two methods is 99.7% inside versus 76.5% outside high-confidence regions). Our web-based app enables comparison of variant calls against truth sets to obtain a standardized performance report. Our approach has been piloted in the PrecisionFDA variant-calling challenges to identify the best-in-class variant-calling methods within high-confidence regions. Finally, we recommend a set of best practices for using our tools and evaluating the results."
30620387,,Impact of adjuvant chemotherapy in patients with adverse features and variant histology at radical cystectomy for muscle-invasive carcinoma of the bladder: Does histologic subtype matter?,2019,Cancer,10.1002/cncr.31952,"['Sebastian Berg', ""David D'Andrea"", 'Malte W Vetterlein', 'Alexander P Cole', 'Sean A Fletcher', 'Marieke J Krimphove', 'Maya Marchese', 'Stuart R Lipsitz', 'Guru Sonpavde', 'Joachim Noldus', 'Shahrokh F Shariat', 'Adam S Kibel', 'Quoc-Dien Trinh', 'Matthew Mossanen']","['adjuvant chemotherapy', 'overall survival', 'radical cystectomy', 'urothelial carcinoma of the bladder', 'variant histology carcinoma of the bladder']","The use of adjuvant chemotherapy (AC) in pure urothelial carcinoma of the bladder is established. Regarding variant histology, there is a gap in knowledge concerning the optimal treatment after radical cystectomy (RC). The objective of this study was to assess the effect of AC on overall survival (OS) in patients who had pure urothelial carcinoma, urothelial carcinoma with concomitant variant histology, or another pure variant histology."
31985795,,UMI-VarCal: a new UMI-based variant caller that efficiently improves low-frequency variant detection in paired-end sequencing NGS libraries.,2020,Bioinformatics,10.1093/bioinformatics/btaa053,"['Vincent Sater', 'Pierre-Julien Viailly', 'Thierry Lecroq', 'Élise Prieur-Gaston', 'Élodie Bohers', 'Mathieu Viennot', 'Philippe Ruminy', 'Hélène Dauchel', 'Pierre Vera', 'Fabrice Jardin']",[],"Next-generation sequencing has become the go-to standard method for the detection of single-nucleotide variants in tumor cells. The use of such technologies requires a PCR amplification step and a sequencing step, steps in which artifacts are introduced at very low frequencies. These artifacts are often confused with true low-frequency variants that can be found in tumor cells and cell-free DNA. The recent use of unique molecular identifiers (UMI) in targeted sequencing protocols has offered a trustworthy approach to filter out artefactual variants and accurately call low-frequency variants. However, the integration of UMI analysis in the variant calling process led to developing tools that are significantly slower and more memory consuming than raw-reads-based variant callers."
32471379,PMC7260818,A novel deletion variant in TRAPPC2 causes spondyloepiphyseal dysplasia tarda in a five-generation Chinese family.,2020,BMC Med Genet,10.1186/s12881-020-01052-8,"['Cai Zhang', 'Caiqi Du', 'Juan Ye', 'Feng Ye', 'Renfa Wang', 'Xiaoping Luo', 'Yan Liang']","['SEDL', 'Short stature', 'Spondyloepiphyseal dysplasia tarda', 'TRAPPC2']",Spondyloepiphyseal dysplasia tarda (SEDT) is a rare X-linked recessive inherited osteochondrodysplasia caused by mutations in the TRAPPC2 gene. It is clinically characterized by disproportionate short stature and early onset of degenerative osteoarthritis. Clinical diagnosis can be challenging due to the late-onset of the disease and lack of systemic metabolic abnomalites. Genetic diagnosis is critical in both early diagnosis and management of the disease. Here we reported a five-generation Chinese SEDT family and described the novel molecular findings.
32974172,PMC7471930,,2020,Front Oncol,10.3389/fonc.2020.01467,"['Elisa Gelli', 'Chiara Fallerini', 'Floriana Valentino', 'Annarita Giliberti', 'Francesca Castiglione', 'Lucrezia Laschi', 'Maria Palmieri', 'Alessandra Fabbiani', 'Rossella Tita', 'Maria Antonietta Mencarelli', 'Alessandra Renieri', 'Francesca Ariani']","['RB1', 'hypomorphic variant', 'ovarian cancer', 'tumor predisposition', 'yolk sac tumor']","Malignant ovarian germ cell tumors (MOGCTs) are neoplasms of the ovary, of which, due to their rarity and heterogeneity, few is reported about genetic background and development. Here, we report a 18-years old patient diagnosed with an ovarian mixed germ cell tumor, without any previous history of malignancies, who has been treated with surgery and chemotherapy and died 4 years later due to peritoneal metastasis complications. Patient's blood DNA was screened for a panel of 52 cancer-related genes in order to identify predisposing aberrations to this rare cancer. The analysis discovered the uncharacterized c.2393G>A variant in "
32712854,,Novel frameshift variant of the CFTR gene: S511Lfs*2 from phenotype to molecular predictions.,2020,Mol Biol Rep,10.1007/s11033-020-05677-z,"['Thaiane Rispoli', 'Grazielle Motta Rodrigues', 'Mayara Jorgens Prado', 'Leonardo Araújo Pinto', 'Marcelo Tadday Rodrigues', 'Cynthia Rocha Dullius', 'Tarciana Grandi', 'Cláudia Maria Dornelles da Silva', 'José Eduardo Vargas', 'Maurício Menegatti Rigo', 'Maria Lucia Rossetti']","['CFTR gene', 'CFTR protein', 'Cystic fibrosis', 'Frameshift variant', 'S511Lfs*2 variant']","Cystic fibrosis (CF) is a genetic disease caused by variants in the cystic fibrosis transmembrane conductance regulator (CFTR) gene. There are over 2,000 different pathogenic and non-pathogenic variants described in association with a broad clinical heterogeneity. In this work, we identified a novel variant S511Lfs*2 in CFTR gene that has not been reported in patients with CF. The patient was a female genotyped with c.1000C>T (legacy name: R334W) variant (pathogenic, CF-causing) and the novel variant (S511Lfs*2). We verified the amino acid sequence, the protein structure, and predicted the pathogenicity employing computational analysis. Our findings showed that S511Lfs*2 is a frameshift variant and suggest that it is associated with severe CF phenotype, as it leads to a lack of CFTR protein synthesis, and consequently the loss of its functional activity."
32446918,,Loss of the KH1 domain of FMR1 in humans due to a synonymous variant causes global developmental retardation.,2020,Gene,10.1016/j.gene.2020.144793,"['Nathalie Carion', 'Audrey Briand', 'Laurence Cuisset', 'Laurence Pacot', 'Alexandra Afenjar', 'Thierry Bienvenu']","['Exon skipping', 'FMR1', 'Fragile X syndrome', 'Synonymous variant']","Fragile X syndrome (FXS) is a monogenic disorder and a common cause of intellectual disability (ID). Up to now, very few pathological variants other than the typical CGG-repeat expansion have been reported in the FMR1 gene."
32271091,,New PA/1220/98-like variant of infectious bronchitis virus in Poland.,2020,Avian Pathol,10.1080/03079457.2020.1754332,"['Katarzyna Domanska-Blicharz', 'Joanna Sajewicz-Krukowska', 'Anna Lisowska']","['IBV', 'Infectious bronchitis virus', 'Poland', 'laying hens', 'phylogenetic analysis', 'variant']","The aim of the present study was to report the first detection of a new infectious bronchitis virus (IBV) variant in Polish commercial flocks which is completely different to any previously known in this region. In 2018, samples from Ross 308 breeding hens aged 35 weeks were delivered for IBV diagnosis. IBV presence was detected, but all attempts to amplify the S gene fragment were negative. The field material was analysed using the Illumina MiSeq platform and a 1073-nt fragment of the S1 coding region was obtained. The gCoV/ck/Poland/516/2018 strain shared only 52.7-58.1% nucleotide identity to any known genotype of IBV and shared the highest identity of 81.4% to the unique North American PA/1220/98 variant. Based on the obtained sequence, a specific molecular test was constructed and used for screening of chicken samples from 35 field cases delivered to our laboratory between 2018 and 2019 for IBV diagnosis. Application of this test enabled detection of another three chicken flocks as positive for this new strain. All positives were identified in commercial layers with egg production problems. To date, the virus has not been detected in broiler chickens. Taking into account the proposed criteria for the definition of a new IBV genotype or lineage, it seems that the detected viruses in Poland, together with the unique North American PA/1220/98 variant, may be classified as separate lineages/genotype in the new IBV classification. "
32812185,,"Dual Mechanism of a New SMN1 Variant (c.835G>C, p.Gly279Arg) by Interrupting Exon 7 Skipping and YG Oligomerization in Causation of Spinal Muscular Atrophy.",2020,J Mol Neurosci,10.1007/s12031-020-01631-7,"['JinLi Bai', 'YuJin Qu', 'Fang Song', 'YanYan Cao', 'Miaomiao Cheng', 'Jia Wang', 'YuWei Jin', 'Hong Wang']","['E7 skipping', 'Spinal muscular atrophy', 'Subtle variant', 'Survival motor neuron gene-1', 'YG box']","Spinal muscular atrophy (SMA) is an autosomal recessive neuromuscular disorder caused by deletion or subtle variant of survival motor neuron 1 (SMN1) gene. By multiplex ligation-dependent probe amplification, genomic sequencing, and T-A cloning on cDNA level, we identified one novel SMN1 subtle variant c.835G>C (p.Gly279Arg) in a non-homozygous patient with type 1 SMA. Full-length SMN1 (fl-SMN1) transcripts in the peripheral bloods of the patient were significantly decreased compared with those in healthy individuals and the carries (p < 0.05). And two fragments of SMN1 transcripts including fl-SMN1 and △7-SMN1 were observed by RT-PCR, which indicated Exon 7 skipping of SMN1 gene. To further evaluate its splicing effects on Exon 7, we performed ex vivo splicing analysis, which showed that the mutant mini gene with c.835G>C reduced Exon 7 inclusion to 54%. In addition, self-oligomerization between mutant SMN protein with the c.835G>C (p.Gly279Arg) and wild SMN was decreased in self-interaction assays. Our study clearly demonstrates that the c.835G>C (p.Gly279Arg) variant can lead to a decrease in fl-SMN1 transcripts by interrupting correct splicing of SMN1. What is more, the variant also affects SMN self-oligomerization via amino acid substitution from Gly to Arg at amino acid position of 279. This work presents the first evidence that it does exit double-hit events for the novel variant, which is crucial to understanding a severe SMA phenotype (type 1)."
30120217,,Homozygosity for the c.428delG variant in ,2018,J Med Genet,10.1136/jmedgenet-2018-105470,"['Silke Pauli', 'Janine Altmüller', 'Simone Schröder', 'Andreas Ohlenbusch', 'Steffi Dreha-Kulaczewski', 'Carsten Bergmann', 'Peter Nürnberg', 'Holger Thiele', 'Yun Li', 'Bernd Wollnik', 'Knut Brockmann']","['clinical genetics', 'joubert syndrome', 'kiaa0586', 'neurology']",Joubert syndrome (JBTS) is a rare neurodevelopmental disorder with marked phenotypic variability and genetic heterogeneity. Homozygous or compound heterozygous mutations in the 
32126534,,Modulation of muscle synergies for multiple forearm movements under variant force and arm position constraints.,2020,J Neural Eng,10.1088/1741-2552/ab7c1a,"['Yanjuan Geng', 'Hanjie Deng', 'Oluwarotimi Williams Samuel', 'Vincent Cheung', 'Lisheng Xu', 'Guanglin Li']",[],"To promote clinical applications of muscle-synergy-based neurorehabilitation techniques, this study aims to clarify any potential modulations of both the muscular compositions and temporal activations of forearm muscle synergies for multiple movements under variant force levels and arm positions."
32734436,,Papez Circuit Gray Matter and Episodic Memory in Amyotrophic Lateral Sclerosis and Behavioural Variant Frontotemporal Dementia.,2020,Brain Imaging Behav,10.1007/s11682-020-00307-5,"['Ana Paula Arantes Bueno', 'Leonardo Cruz de Souza', 'Walter Hugo Lopez Pinaya', 'Antônio Lúcio Teixeira', 'Laura Godoy Rousseff de Prado', 'Paulo Caramelli', 'Michael Hornberger', 'João Ricardo Sato']","['Amyotrophic lateral sclerosis', 'Behavioural variant frontotemporal dementia', 'Episodic memory', 'Papez circuit']","Amyotrophic lateral sclerosis and behavioural variant frontotemporal dementia are two different diseases recognized to overlap at clinical, pathological and genetic characteristics. Both conditions are traditionally known for relative sparing of episodic memory. However, recent studies have disputed that with the report of patients presenting with marked episodic memory impairment. Besides that, structural and functional changes in temporal lobe regions responsible for episodic memory processing are often detected in neuroimaging studies of both conditions. In this study, we investigated the gray matter features associated with the Papez circuit in amyotrophic lateral sclerosis, behavioural variant frontotemporal dementia and healthy controls to further explore similarities and differences between the two conditions. Our non-demented amyotrophic lateral sclerosis patients showed no episodic memory deficits measured by a short-term delayed recall test while no changes in gray matter of the Papez circuit were found. Compared with the amyotrophic lateral sclerosis group, the behavioural variant frontotemporal dementia group had lower performance on the short-term delayed recall test and marked atrophy in gray matter of the Papez circuit. Bilateral atrophy of entorhinal cortex and mammillary bodies distinguished behavioural variant frontotemporal dementia from amyotrophic lateral sclerosis patients as well as atrophy in left cingulate, left hippocampus and right parahippocampal gyrus. Taken together, our results suggest that sub-regions of the Papez circuit could be differently affected in amyotrophic lateral sclerosis and behavioural variant frontotemporal dementia."
32651855,,Meta-analysis of the association between CHCHD10 Pro34Ser variant and the risk of amyotrophic lateral sclerosis.,2020,Neurol Sci,10.1007/s10072-020-04579-z,"['Baiyuan Yang', 'Chenghui Yang', 'Junwei Ren', 'Chengqing Zhong', 'Keting Liu', 'Liusha Zhao', 'Li Li', 'Han Wang', 'Mingling Zhu', 'Zhenfang Lin']","['Amyotrophic lateral sclerosis', 'CHCHD10', 'Meta-analysis', 'Pro34Ser', 'Variant']","Amyotrophic lateral sclerosis (ALS), one of the motor neuron diseases, appears to be caused by genetic and environmental risk factors. However, the influence of Pro34Ser variant of CHCHD10 gene in increasing risk of ALS remains indeterminate. This study conducted a meta-analysis to establish the association between Pro34Ser variant of CHCHD10 gene and risk of ALS."
30851902,,The impact of variant histological differentiation on extranodal extension and survival in node positive bladder cancer treated with radical cystectomy.,2019,Surg Oncol,10.1016/j.suronc.2019.01.008,"['Phillip Marks', 'Philipp Gild', 'Armin Soave', 'Florian Janisch', 'Sarah Minner', 'Oliver Engel', 'Malte W Vetterlein', 'Shahrokh F Shariat', 'Guido Sauter', 'Roland Dahlem', 'Margit Fisch', 'Michael Rink']","['Extra nodal extension', 'Histology', 'Lymph node metastasis', 'Radical cystectomy', 'Urinary bladder cancer', 'Urothelial carcinoma']",To investigate the impact of variant urothelial carcinoma of the bladder (UCB) histologies on extra nodal extension (ENE) and survival in lymph node (LN) positive bladder cancer patients undergoing radical cystectomy (RC).
30604514,PMC6418762,Functional assessment of triheteromeric NMDA receptors containing a human variant associated with epilepsy.,2019,J Physiol,10.1113/JP277292,"['Katie F M Marwick', 'Kasper B Hansen', 'Paul A Skehel', 'Giles E Hardingham', 'David J A Wyllie']","['Epilepsy', 'Genetics', 'Human', 'electrophysiology', 'intellectual disability']",NMDA receptors are neurotransmitter-gated ion channels that are critically involved in brain cell communication Variations in genes encoding NMDA receptor subunits have been found in a range of neurodevelopmental disorders. We investigated a de novo genetic variant found in patients with epileptic encephalopathy that changes a residue located in the ion channel pore of the GluN2A NMDA receptor subunit. We found that this variant (GluN2A
30032161,PMC6752295,The effect of NOTCH3 pathogenic variant position on CADASIL disease severity: NOTCH3 EGFr 1-6 pathogenic variant are associated with a more severe phenotype and lower survival compared with EGFr 7-34 pathogenic variant.,2018,Genet Med,10.1038/s41436-018-0088-3,"['Julie W Rutten', 'Bastian J Van Eijsden', 'Marco Duering', 'Eric Jouvent', 'Christian Opherk', 'Leonardo Pantoni', 'Antonio Federico', 'Martin Dichgans', 'Hugh S Markus', 'Hugues Chabriat', 'Saskia A J Lesnik Oberstein']","['CADASIL', 'Genotype–phenotype correlation', 'NOTCH3', 'Small-vessel disease']","CADASIL is a small-vessel disease caused by a cysteine-altering pathogenic variant in one of the 34 epidermal growth factor-like repeat (EGFr) domains of the NOTCH3 protein. We recently found that pathogenic variant in EGFr domains 7-34 have an unexpectedly high frequency in the general population (1:300). We hypothesized that EGFr 7-34 pathogenic variant more frequently cause a much milder phenotype, thereby explaining an important part of CADASIL disease variability."
32407886,,MinProtMaxVP: Generating a minimized number of protein variant sequences containing all possible variant peptides for proteogenomic analysis.,2020,J Proteomics,10.1016/j.jprot.2020.103819,"['Wai-Kok Choong', 'Jen-Hung Wang', 'Ting-Yi Sung']","['Proteogenomic analysis', 'SAV-harboring protein sequences', 'Single amino acid variants (SAVs)', 'Single nucleotide variants (SNVs)', 'Variant peptides']","Identifying single-amino-acid variants (SAVs) from mass spectrometry-based experiments is critical for validating single-nucleotide variants (SNVs) at the protein level to facilitate biomedical research. Currently, two approaches are usually applied to convert SNV annotations into SAV-harboring protein sequences. One approach generates one sequence containing exactly one SAV, and the other all SAVs. However, they may neglect the possibility of SAV combinations, e.g., haplotypes, existing in bio-samples. Therefore, it is necessary to consider all SAV combinations of a protein when generating SAV-harboring protein sequences. In this paper, we propose MinProtMaxVP, a novel approach which selects a minimized number of SAV-harboring protein sequences generated from the exhaustive approach, while still accommodating all possible variant peptides, by solving a classic set covering problem. Our study on known haplotype variations of TAS2R38 justifies the necessity for MinProtMaxVP to consider all combinations of SAVs. The performance of MinProtMaxVP is demonstrated by an in silico study on OR2T27 with five SAVs and real experimental data of the HEK293 cell line. Furthermore, assuming simulated somatic and germline variants of OR2T27 in tumor and normal tissues demonstrates that when adopting the appropriate somatic and germline SAV integration strategy, MinProtMaxVP is adaptable to labeling and label-free mass spectrometry-based experiments. SIGNIFICANCE: We present MinProtMaxVP, a novel approach to generate SAV-harboring protein sequences for constructing a customized protein sequence database, which is used in database searching for variant peptide identification. This approach outperforms the existing approaches in generating all possible variant peptides to be included in protein sequences and possibly leading to identification of more variant peptides in proteogenomic analysis."
30992731,PMC6434291,The Clinical and Vascular Characteristics of RNF213 c.14576G>A Variant-Related Intracranial Major Artery Disease in China.,2019,Behav Neurol,10.1155/2019/7908392,"['Weiyang Cheng', 'Sufang Xue', 'Fang Wu', 'Xiaowei Song', 'Qiang Huang', 'Haiqing Song', 'Jian Wu']",[],"Recently, several studies indicated the c.14576G>A variant on the ring finger protein 213 (RNF213), a founder variant of moyamoya diseases (MMD), was associated with non-MMD intracranial major artery stenosis/occlusion (non-MMD ICASO). We proposed that RNF213 variant-related ICASO including MMD might be a special entity with its own characteristics based on a genetic background. The aim of the study was to learn the clinical and vascular features of RNF213 variant-related ICASO. Moreover, we tried to explore the clinical significance of a testing variant in ICASO patients in China."
